fec,idticket,correo,titulo,descripcion
7/21/2019,1,dravelus0@elegantthemes.com,PowerShares DWA Tactical Sector Rotation Portfolio,Nullam sit amet turpis elementum ligula vehicula consequat. Morbi a ipsum. Integer a nibh. In quis justo.
3/31/2019,2,kclawsley1@cargocollective.com,"IES Holdings, Inc.","Donec vitae nisi. Nam ultrices, libero non mattis pulvinar, nulla pede ullamcorper augue, a suscipit nulla elit ac nulla. Sed vel enim sit amet nunc viverra dapibus."
9/16/2019,3,cpenella2@bing.com,GGP Inc.,"Vestibulum ac est lacinia nisi venenatis tristique. Fusce congue, diam id ornare imperdiet, sapien urna pretium nisl, ut volutpat sapien arcu sed augue."
9/20/2019,4,fgoodhew3@pinterest.com,"Citizens Community Bancorp, Inc.",Pellentesque eget nunc. Donec quis orci eget orci vehicula condimentum. Curabitur in libero ut massa volutpat convallis.
8/31/2019,5,fdrewes4@japanpost.jp,Ivy NextShares,"Proin risus. Praesent lectus. Vestibulum quam sapien, varius ut, blandit non, interdum in, ante. Vestibulum ante ipsum primis in faucibus orci luctus et ultrices posuere cubilia Curae; Duis faucibus accumsan odio."
1/9/2020,6,rdursley5@weibo.com,Hunter Maritime Acquisition Corp.,In eleifend quam a odio. In hac habitasse platea dictumst.
10/18/2019,7,ciban6@mozilla.com,Forum Merger Corporation,"In est risus, auctor sed, tristique in, tempus sit amet, sem. Fusce consequat. Nulla nisl."
7/15/2019,8,rtrimme7@weibo.com,"Frequency Electronics, Inc.","Maecenas tristique, est et tempus semper, est quam pharetra magna, ac consequat metus sapien ut nunc. Vestibulum ante ipsum primis in faucibus orci luctus et ultrices posuere cubilia Curae; Mauris viverra diam vitae quam."
3/1/2020,9,egirardy8@usnews.com,"J. Jill, Inc.",In hac habitasse platea dictumst.
12/16/2019,10,ckuschek9@opera.com,Nuveen Maryland Quality Municipal Income Fund,"Fusce lacus purus, aliquet at, feugiat non, pretium quis, lectus. Suspendisse potenti. In eleifend quam a odio."
7/19/2019,11,dolliffa@vistaprint.com,"Anthem, Inc.","Morbi sem mauris, laoreet ut, rhoncus aliquet, pulvinar sed, nisl. Nunc rhoncus dui vel sem. Sed sagittis. Nam congue, risus semper porta volutpat, quam pede lobortis ligula, sit amet eleifend pede libero quis orci."
4/6/2019,12,ldummettb@e-recht24.de,Hess Midstream Partners LP,Vivamus vel nulla eget eros elementum pellentesque.
5/6/2019,13,efozardc@icq.com,"Inovalon Holdings, Inc.",Nulla ut erat id mauris vulputate elementum. Nullam varius. Nulla facilisi.
8/11/2019,14,dmynottd@com.com,Oramed Pharmaceuticals Inc.,"Vestibulum ac est lacinia nisi venenatis tristique. Fusce congue, diam id ornare imperdiet, sapien urna pretium nisl, ut volutpat sapien arcu sed augue. Aliquam erat volutpat. In congue."
2/22/2020,15,svowlese@shutterfly.com,Ralph Lauren Corporation,Sed accumsan felis. Ut at dolor quis odio consequat varius.
12/7/2019,16,myuranovevf@nytimes.com,InfoSonics Corp,Vestibulum rutrum rutrum neque.
10/9/2019,17,bquigleyg@dailymotion.com,Express Scripts Holding Company,"Proin leo odio, porttitor id, consequat in, consequat ut, nulla."
9/4/2019,18,hgianuzzih@topsy.com,Baxter International Inc.,Mauris lacinia sapien quis libero. Nullam sit amet turpis elementum ligula vehicula consequat. Morbi a ipsum.
9/22/2019,19,broelvinki@yelp.com,Biogen Inc.,"In est risus, auctor sed, tristique in, tempus sit amet, sem. Fusce consequat."
1/24/2020,20,eshrigleyj@time.com,Lockheed Martin Corporation,Vestibulum sed magna at nunc commodo placerat.
7/31/2019,21,fcoweyk@businessinsider.com,K12 Inc,Nullam varius. Nulla facilisi. Cras non velit nec nisi vulputate nonummy. Maecenas tincidunt lacus at velit.
3/5/2020,22,ekliesll@blog.com,"Rockwell Automation, Inc.","In tempor, turpis nec euismod scelerisque, quam turpis adipiscing lorem, vitae mattis nibh ligula nec sem."
4/19/2019,23,lholtawaym@columbia.edu,Nustar Energy L.P.,Nulla tellus. In sagittis dui vel nisl. Duis ac nibh.
10/10/2019,24,jroslingn@weather.com,VictoryShares US EQ Income Enhanced Volatility Wtd ETF,Maecenas pulvinar lobortis est.
4/20/2019,25,aatkirko@adobe.com,Genetic Technologies Ltd,"Cras in purus eu magna vulputate luctus. Cum sociis natoque penatibus et magnis dis parturient montes, nascetur ridiculus mus. Vivamus vestibulum sagittis sapien."
12/8/2019,26,gioannoup@ning.com,ArcBest Corporation,"Vivamus in felis eu sapien cursus vestibulum. Proin eu mi. Nulla ac enim. In tempor, turpis nec euismod scelerisque, quam turpis adipiscing lorem, vitae mattis nibh ligula nec sem."
7/23/2019,27,jarlowq@bizjournals.com,"Stein Mart, Inc.",Nam tristique tortor eu pede.
5/26/2019,28,nbaudryr@forbes.com,Kilroy Realty Corporation,"Quisque id justo sit amet sapien dignissim vestibulum. Vestibulum ante ipsum primis in faucibus orci luctus et ultrices posuere cubilia Curae; Nulla dapibus dolor vel est. Donec odio justo, sollicitudin ut, suscipit a, feugiat et, eros. Vestibulum ac est lacinia nisi venenatis tristique."
2/24/2020,29,tmattheiss@soundcloud.com,"Caterpillar, Inc.","In hac habitasse platea dictumst. Aliquam augue quam, sollicitudin vitae, consectetuer eget, rutrum at, lorem. Integer tincidunt ante vel ipsum. Praesent blandit lacinia erat."
10/26/2019,30,rdemannt@cmu.edu,"MDU Resources Group, Inc.","Morbi porttitor lorem id ligula. Suspendisse ornare consequat lectus. In est risus, auctor sed, tristique in, tempus sit amet, sem."
2/17/2020,31,wwoolliamsu@pcworld.com,Oritani Financial Corp.,"Nulla nisl. Nunc nisl. Duis bibendum, felis sed interdum venenatis, turpis enim blandit mi, in porttitor pede justo eu massa. Donec dapibus."
5/21/2019,32,mcurseyv@plala.or.jp,United States Steel Corporation,Duis mattis egestas metus.
8/30/2019,33,awykew@nytimes.com,Nuveen High Income 2020 Target Term Fund,Sed vel enim sit amet nunc viverra dapibus.
12/21/2019,34,cfranekx@over-blog.com,International Paper Company,"Morbi quis tortor id nulla ultrices aliquet. Maecenas leo odio, condimentum id, luctus nec, molestie sed, justo."
10/19/2019,35,jcleverleyy@fema.gov,"ONE Gas, Inc.",Donec semper sapien a libero. Nam dui.
2/4/2020,36,rcooneyz@ca.gov,"Hawthorn Bancshares, Inc.","Praesent id massa id nisl venenatis lacinia. Aenean sit amet justo. Morbi ut odio. Cras mi pede, malesuada in, imperdiet et, commodo vulputate, justo."
7/19/2019,37,ecoaten10@admin.ch,Capitol Acquisition Corp. III,Mauris lacinia sapien quis libero. Nullam sit amet turpis elementum ligula vehicula consequat. Morbi a ipsum.
4/29/2019,38,sogers11@wordpress.org,USG Corporation,Duis bibendum. Morbi non quam nec dui luctus rutrum.
4/23/2019,39,dcagan12@joomla.org,FIRST REPUBLIC BANK,Morbi vel lectus in quam fringilla rhoncus.
1/20/2020,40,pmyton13@seattletimes.com,"General Mills, Inc.",Vivamus vestibulum sagittis sapien.
3/31/2019,41,ckaes14@illinois.edu,Fidelity and Guaranty Life,"Duis ac nibh. Fusce lacus purus, aliquet at, feugiat non, pretium quis, lectus."
5/21/2019,42,thanshawe15@narod.ru,"SINOPEC Shangai Petrochemical Company, Ltd.",Vestibulum sed magna at nunc commodo placerat. Praesent blandit.
8/19/2019,43,nradbond16@taobao.com,"The Hackett Group, Inc.","Vestibulum quam sapien, varius ut, blandit non, interdum in, ante."
9/20/2019,44,gsouthernwood17@creativecommons.org,"CalAtlantic Group, Inc.","Duis bibendum, felis sed interdum venenatis, turpis enim blandit mi, in porttitor pede justo eu massa. Donec dapibus. Duis at velit eu est congue elementum."
2/13/2020,45,btraynor18@usatoday.com,"Powell Industries, Inc.",Vestibulum sed magna at nunc commodo placerat.
6/23/2019,46,ebrachell19@hp.com,Cytosorbents Corporation,"Donec vitae nisi. Nam ultrices, libero non mattis pulvinar, nulla pede ullamcorper augue, a suscipit nulla elit ac nulla."
4/2/2019,47,fmensler1a@youku.com,"America Movil, S.A.B. de C.V.",In congue.
3/2/2020,48,itopp1b@japanpost.jp,Vista Outdoor Inc.,"Proin at turpis a pede posuere nonummy. Integer non velit. Donec diam neque, vestibulum eget, vulputate ut, ultrices vel, augue."
10/16/2019,49,lgobert1c@ftc.gov,"Alon USA Partners, LP",Nam nulla.
8/8/2019,50,stolmie1d@google.cn,Key Tronic Corporation,Integer ac leo.
1/8/2020,51,tfrotton1e@ca.gov,First Trust Japan AlphaDEX Fund,Aenean fermentum. Donec ut mauris eget massa tempor convallis.
4/21/2019,52,dbortol1f@ebay.com,TEGNA Inc.,Aliquam quis turpis eget elit sodales scelerisque. Mauris sit amet eros. Suspendisse accumsan tortor quis turpis. Sed ante.
8/19/2019,53,aonoland1g@jiathis.com,PowerShares DWA Technology Momenum Portfolio,Duis consequat dui nec nisi volutpat eleifend. Donec ut dolor. Morbi vel lectus in quam fringilla rhoncus.
2/5/2020,54,tcorrao1h@tripod.com,"East West Bancorp, Inc.",Nunc rhoncus dui vel sem.
10/5/2019,55,tdickman1i@mayoclinic.com,Belden Inc,"Quisque erat eros, viverra eget, congue eget, semper rutrum, nulla. Nunc purus."
11/29/2019,56,hfenich1j@huffingtonpost.com,PAVmed Inc.,"Integer pede justo, lacinia eget, tincidunt eget, tempus vel, pede."
2/7/2020,57,cpickard1k@state.gov,Elbit Systems Ltd.,Morbi ut odio.
11/16/2019,58,tbozward1l@netvibes.com,"Colony NorthStar, Inc.",Nunc purus. Phasellus in felis.
12/31/2019,59,glabbez1m@wired.com,PacWest Bancorp,"Integer aliquet, massa id lobortis convallis, tortor risus dapibus augue, vel accumsan tellus nisi eu orci. Mauris lacinia sapien quis libero. Nullam sit amet turpis elementum ligula vehicula consequat."
11/6/2019,60,glebbon1n@columbia.edu,"Elevate Credit, Inc.",Vestibulum ante ipsum primis in faucibus orci luctus et ultrices posuere cubilia Curae; Duis faucibus accumsan odio. Curabitur convallis. Duis consequat dui nec nisi volutpat eleifend. Donec ut dolor.
5/26/2019,61,kmacdermot1o@sogou.com,Lakeland Financial Corporation,Aenean auctor gravida sem.
8/7/2019,62,ivankin1p@mozilla.com,"JA Solar Holdings, Co., Ltd.",Nulla tempus.
10/10/2019,63,ktustin1q@theguardian.com,Time Warner Inc.,"Integer aliquet, massa id lobortis convallis, tortor risus dapibus augue, vel accumsan tellus nisi eu orci. Mauris lacinia sapien quis libero. Nullam sit amet turpis elementum ligula vehicula consequat."
11/24/2019,64,bgrogono1r@yale.edu,"Healthcare Services Group, Inc.","Quisque erat eros, viverra eget, congue eget, semper rutrum, nulla. Nunc purus."
3/20/2020,65,jmacieja1s@google.ca,"AeroVironment, Inc.","Cum sociis natoque penatibus et magnis dis parturient montes, nascetur ridiculus mus. Etiam vel augue."
4/8/2019,66,bdrake1t@google.co.uk,Unilever NV,"Praesent lectus. Vestibulum quam sapien, varius ut, blandit non, interdum in, ante. Vestibulum ante ipsum primis in faucibus orci luctus et ultrices posuere cubilia Curae; Duis faucibus accumsan odio. Curabitur convallis."
6/15/2019,67,nallmond1u@desdev.cn,Capital Senior Living Corporation,Proin interdum mauris non ligula pellentesque ultrices.
11/17/2019,68,tkimblin1v@about.me,"H&E Equipment Services, Inc.","Quisque porta volutpat erat. Quisque erat eros, viverra eget, congue eget, semper rutrum, nulla."
7/23/2019,69,hboome1w@elegantthemes.com,iShares Commodities Select Strategy ETF,Aenean fermentum. Donec ut mauris eget massa tempor convallis.
6/19/2019,70,cspraggon1x@eventbrite.com,"Reata Pharmaceuticals, Inc.",Aenean sit amet justo. Morbi ut odio.
3/13/2020,71,cmcaneny1y@google.it,"Kindred Healthcare, Inc.","Donec quis orci eget orci vehicula condimentum. Curabitur in libero ut massa volutpat convallis. Morbi odio odio, elementum eu, interdum eu, tincidunt in, leo."
10/1/2019,72,dbarenskie1z@dropbox.com,CGG,"Donec odio justo, sollicitudin ut, suscipit a, feugiat et, eros. Vestibulum ac est lacinia nisi venenatis tristique."
10/27/2019,73,swakefield20@ucsd.edu,"Southern Missouri Bancorp, Inc.",Morbi non quam nec dui luctus rutrum. Nulla tellus.
10/13/2019,74,rdraisey21@dagondesign.com,Altisource Portfolio Solutions S.A.,Maecenas pulvinar lobortis est. Phasellus sit amet erat. Nulla tempus. Vivamus in felis eu sapien cursus vestibulum.
10/1/2019,75,ffigure22@ox.ac.uk,Wells Fargo & Company,Praesent blandit. Nam nulla.
4/9/2019,76,avann23@yellowpages.com,Blackrock Global,"Morbi ut odio. Cras mi pede, malesuada in, imperdiet et, commodo vulputate, justo."
9/3/2019,77,mnassie24@vkontakte.ru,Six Flags Entertainment Corporation New,"Lorem ipsum dolor sit amet, consectetuer adipiscing elit. Proin risus. Praesent lectus."
6/5/2019,78,kchitham25@berkeley.edu,"China Biologic Products, Inc.",Ut tellus.
5/3/2019,79,lbrizland26@cargocollective.com,VOC Energy Trust,Etiam faucibus cursus urna. Ut tellus.
10/26/2019,80,maleksandrikin27@engadget.com,Oxbridge Re Holdings Limited,"Duis bibendum, felis sed interdum venenatis, turpis enim blandit mi, in porttitor pede justo eu massa. Donec dapibus."
1/22/2020,81,mhardwicke28@shinystat.com,KLA-Tencor Corporation,Nunc rhoncus dui vel sem. Sed sagittis.
6/13/2019,82,tweeke29@cargocollective.com,"Apricus Biosciences, Inc.","Mauris enim leo, rhoncus sed, vestibulum sit amet, cursus id, turpis."
12/2/2019,83,vteodorski2a@yahoo.co.jp,Ashland Global Holdings Inc.,Praesent id massa id nisl venenatis lacinia. Aenean sit amet justo. Morbi ut odio.
10/9/2019,84,cgilbert2b@blogs.com,"THL Credit, Inc.",Maecenas pulvinar lobortis est. Phasellus sit amet erat.
2/25/2020,85,gdowse2c@usda.gov,China Unicom (Hong Kong) Ltd,Aliquam quis turpis eget elit sodales scelerisque. Mauris sit amet eros. Suspendisse accumsan tortor quis turpis. Sed ante.
8/8/2019,86,scamamill2d@example.com,Check-Cap Ltd.,Phasellus in felis. Donec semper sapien a libero.
10/15/2019,87,wpeachment2e@vistaprint.com,Canadian Imperial Bank of Commerce,"Nam nulla. Integer pede justo, lacinia eget, tincidunt eget, tempus vel, pede. Morbi porttitor lorem id ligula."
8/30/2019,88,cwallsworth2f@yandex.ru,"Jason Industries, Inc.",In congue.
11/9/2019,89,alindell2g@list-manage.com,Managed Duration Investment Grade Municipal Fund,Donec quis orci eget orci vehicula condimentum. Curabitur in libero ut massa volutpat convallis.
2/2/2020,90,gschieferstein2h@businessinsider.com,Prospect Capital Corporation,Curabitur gravida nisi at nibh. In hac habitasse platea dictumst.
8/2/2019,91,jbrumby2i@ft.com,Michael Kors Holdings Limited,Praesent blandit lacinia erat. Vestibulum sed magna at nunc commodo placerat.
6/5/2019,92,gferon2j@lycos.com,Calgon Carbon Corporation,"Fusce congue, diam id ornare imperdiet, sapien urna pretium nisl, ut volutpat sapien arcu sed augue. Aliquam erat volutpat. In congue."
1/29/2020,93,lgallego2k@imdb.com,Marriot Vacations Worldwide Corporation,Duis consequat dui nec nisi volutpat eleifend. Donec ut dolor.
11/27/2019,94,cdutchburn2l@sourceforge.net,"BJ's Restaurants, Inc.",Nulla mollis molestie lorem.
3/13/2020,95,jblain2m@newyorker.com,National Commerce Corporation,Praesent blandit. Nam nulla.
3/27/2019,96,sbermingham2n@about.com,Invitae Corporation,"Maecenas tristique, est et tempus semper, est quam pharetra magna, ac consequat metus sapien ut nunc. Vestibulum ante ipsum primis in faucibus orci luctus et ultrices posuere cubilia Curae; Mauris viverra diam vitae quam. Suspendisse potenti. Nullam porttitor lacus at turpis."
12/6/2019,97,mbonham2o@infoseek.co.jp,"Hudson Global, Inc.",Nullam porttitor lacus at turpis.
1/23/2020,98,fbartosik2p@so-net.ne.jp,"Morgan Stanley Emerging Markets Debt Fund, Inc.",Phasellus in felis.
8/7/2019,99,kdampney2q@cisco.com,Cerner Corporation,Nulla ut erat id mauris vulputate elementum. Nullam varius. Nulla facilisi. Cras non velit nec nisi vulputate nonummy.
6/22/2019,100,alepiscopio2r@nifty.com,Cerecor Inc.,"Aliquam sit amet diam in magna bibendum imperdiet. Nullam orci pede, venenatis non, sodales sed, tincidunt eu, felis."
5/31/2019,101,tbravey2s@illinois.edu,RELX PLC,"Morbi odio odio, elementum eu, interdum eu, tincidunt in, leo. Maecenas pulvinar lobortis est. Phasellus sit amet erat."
6/28/2019,102,dbefroy2t@phpbb.com,Lennar Corporation,"Quisque erat eros, viverra eget, congue eget, semper rutrum, nulla. Nunc purus."
1/25/2020,103,mbonnet2u@goo.ne.jp,"Controladora Vuela Compania de Aviacion, S.A.B. de C.V.",Morbi non quam nec dui luctus rutrum. Nulla tellus. In sagittis dui vel nisl.
6/13/2019,104,kkantor2v@qq.com,"Viveve Medical, Inc.",Integer ac leo. Pellentesque ultrices mattis odio. Donec vitae nisi.
5/26/2019,105,futtridge2w@ox.ac.uk,Nuveen Quality Preferred Income Fund 2,Maecenas pulvinar lobortis est. Phasellus sit amet erat.
7/21/2019,106,tsuttell2x@sourceforge.net,"Grand Canyon Education, Inc.","Curabitur gravida nisi at nibh. In hac habitasse platea dictumst. Aliquam augue quam, sollicitudin vitae, consectetuer eget, rutrum at, lorem."
3/7/2020,107,hladell2y@woothemes.com,Navios Maritime Holdings Inc.,Nulla tellus. In sagittis dui vel nisl.
6/2/2019,108,whalladay2z@baidu.com,Atossa Genetics Inc.,Vestibulum ante ipsum primis in faucibus orci luctus et ultrices posuere cubilia Curae; Mauris viverra diam vitae quam. Suspendisse potenti. Nullam porttitor lacus at turpis. Donec posuere metus vitae ipsum.
4/9/2019,109,gridulfo30@blog.com,"Hebron Technology Co., Ltd.",Integer non velit.
9/8/2019,110,hporrett31@imageshack.us,Baozun Inc.,"Phasellus in felis. Donec semper sapien a libero. Nam dui. Proin leo odio, porttitor id, consequat in, consequat ut, nulla."
11/3/2019,111,gleonardi32@craigslist.org,"Universal Logistics Holdings, Inc.","Curabitur gravida nisi at nibh. In hac habitasse platea dictumst. Aliquam augue quam, sollicitudin vitae, consectetuer eget, rutrum at, lorem."
10/20/2019,112,ktomasik33@51.la,"Aviragen Therapeutics, Inc.",In eleifend quam a odio.
8/19/2019,113,emurtagh34@fda.gov,First Trust CEF Income Opportunity ETF,"Mauris enim leo, rhoncus sed, vestibulum sit amet, cursus id, turpis. Integer aliquet, massa id lobortis convallis, tortor risus dapibus augue, vel accumsan tellus nisi eu orci. Mauris lacinia sapien quis libero."
5/17/2019,114,ndoddridge35@utexas.edu,Tesoro Logistics LP,Nullam porttitor lacus at turpis.
5/3/2019,115,mjancar36@reference.com,"Mammoth Energy Services, Inc.",Morbi non quam nec dui luctus rutrum.
9/4/2019,116,cpursglove37@fda.gov,ADMA Biologics Inc,Sed ante. Vivamus tortor.
4/26/2019,117,rcatenot38@altervista.org,First Northwest Bancorp,In hac habitasse platea dictumst. Etiam faucibus cursus urna. Ut tellus. Nulla ut erat id mauris vulputate elementum.
12/24/2019,118,kchrismas39@example.com,Xcerra Corporation,"Maecenas tristique, est et tempus semper, est quam pharetra magna, ac consequat metus sapien ut nunc. Vestibulum ante ipsum primis in faucibus orci luctus et ultrices posuere cubilia Curae; Mauris viverra diam vitae quam. Suspendisse potenti. Nullam porttitor lacus at turpis."
5/15/2019,119,abrinded3a@wikimedia.org,"FlexShopper, Inc.","Maecenas tristique, est et tempus semper, est quam pharetra magna, ac consequat metus sapien ut nunc. Vestibulum ante ipsum primis in faucibus orci luctus et ultrices posuere cubilia Curae; Mauris viverra diam vitae quam. Suspendisse potenti."
4/27/2019,120,chebborne3b@jimdo.com,American Express Company,"Fusce posuere felis sed lacus. Morbi sem mauris, laoreet ut, rhoncus aliquet, pulvinar sed, nisl."
2/2/2020,121,dloins3c@github.com,"Senomyx, Inc.","Fusce lacus purus, aliquet at, feugiat non, pretium quis, lectus. Suspendisse potenti. In eleifend quam a odio. In hac habitasse platea dictumst."
6/27/2019,122,gcouvet3d@jimdo.com,ADMA Biologics Inc,Suspendisse potenti. In eleifend quam a odio. In hac habitasse platea dictumst. Maecenas ut massa quis augue luctus tincidunt.
9/3/2019,123,asherme3e@businessweek.com,Principal Price Setters Index ETF,"Nunc nisl. Duis bibendum, felis sed interdum venenatis, turpis enim blandit mi, in porttitor pede justo eu massa. Donec dapibus. Duis at velit eu est congue elementum."
11/26/2019,124,ecrowden3f@google.it,Calamos Strategic Total Return Fund,"In tempor, turpis nec euismod scelerisque, quam turpis adipiscing lorem, vitae mattis nibh ligula nec sem. Duis aliquam convallis nunc. Proin at turpis a pede posuere nonummy. Integer non velit."
4/14/2019,125,kgaydon3g@zimbio.com,Axis Capital Holdings Limited,"Vivamus metus arcu, adipiscing molestie, hendrerit at, vulputate vitae, nisl. Aenean lectus. Pellentesque eget nunc."
12/11/2019,126,leastmond3h@ehow.com,SLM Corporation,"Quisque porta volutpat erat. Quisque erat eros, viverra eget, congue eget, semper rutrum, nulla. Nunc purus. Phasellus in felis."
11/9/2019,127,slast3i@ustream.tv,Moog Inc.,Integer ac neque. Duis bibendum. Morbi non quam nec dui luctus rutrum. Nulla tellus.
8/30/2019,128,abreacher3j@answers.com,Liberty Global plc,"Quisque arcu libero, rutrum ac, lobortis vel, dapibus at, diam."
8/28/2019,129,bdavage3k@google.fr,"Meridian Bancorp, Inc.","Integer aliquet, massa id lobortis convallis, tortor risus dapibus augue, vel accumsan tellus nisi eu orci. Mauris lacinia sapien quis libero. Nullam sit amet turpis elementum ligula vehicula consequat."
5/11/2019,130,mkibel3l@cpanel.net,"Hollysys Automation Technologies, Ltd.","Morbi vestibulum, velit id pretium iaculis, diam erat fermentum justo, nec condimentum neque sapien placerat ante. Nulla justo."
3/20/2020,131,mcharkham3m@163.com,Astoria Financial Corporation,Proin eu mi.
3/25/2019,132,dbonham3n@answers.com,Southwestern Energy Company,Integer a nibh. In quis justo.
11/8/2019,133,terrichelli3o@gravatar.com,"Estee Lauder Companies, Inc. (The)","Cras mi pede, malesuada in, imperdiet et, commodo vulputate, justo. In blandit ultrices enim. Lorem ipsum dolor sit amet, consectetuer adipiscing elit. Proin interdum mauris non ligula pellentesque ultrices."
12/9/2019,134,ncastanone3p@wix.com,"ExlService Holdings, Inc.",In sagittis dui vel nisl. Duis ac nibh.
4/25/2019,135,agretton3q@vistaprint.com,"DineEquity, Inc","Fusce posuere felis sed lacus. Morbi sem mauris, laoreet ut, rhoncus aliquet, pulvinar sed, nisl. Nunc rhoncus dui vel sem. Sed sagittis."
8/19/2019,136,cketts3r@lulu.com,"Fossil Group, Inc.","Fusce congue, diam id ornare imperdiet, sapien urna pretium nisl, ut volutpat sapien arcu sed augue."
8/2/2019,137,vmussettini3s@so-net.ne.jp,MakeMyTrip Limited,Curabitur convallis.
7/12/2019,138,hredgewell3t@cnet.com,Eagle Bulk Shipping Inc.,"Donec odio justo, sollicitudin ut, suscipit a, feugiat et, eros. Vestibulum ac est lacinia nisi venenatis tristique. Fusce congue, diam id ornare imperdiet, sapien urna pretium nisl, ut volutpat sapien arcu sed augue. Aliquam erat volutpat."
9/13/2019,139,rmazdon3u@skyrock.com,Tractor Supply Company,Donec quis orci eget orci vehicula condimentum. Curabitur in libero ut massa volutpat convallis.
10/14/2019,140,dlillicrap3v@ibm.com,Zhaopin Limited,Maecenas ut massa quis augue luctus tincidunt.
11/4/2019,141,feagger3w@webnode.com,"Amber Road, Inc.",Donec quis orci eget orci vehicula condimentum. Curabitur in libero ut massa volutpat convallis.
6/7/2019,142,mrenvoys3x@ifeng.com,Drive Shack Inc.,"Maecenas leo odio, condimentum id, luctus nec, molestie sed, justo. Pellentesque viverra pede ac diam. Cras pellentesque volutpat dui. Maecenas tristique, est et tempus semper, est quam pharetra magna, ac consequat metus sapien ut nunc."
4/28/2019,143,estoney3y@twitpic.com,"EnLink Midstream, LLC","Cras mi pede, malesuada in, imperdiet et, commodo vulputate, justo."
9/10/2019,144,achishull3z@ucla.edu,Carnival Corporation,Ut at dolor quis odio consequat varius. Integer ac leo.
1/11/2020,145,qmacro40@auda.org.au,Cementos Pacasmayo S.A.A.,"Integer non velit. Donec diam neque, vestibulum eget, vulputate ut, ultrices vel, augue. Vestibulum ante ipsum primis in faucibus orci luctus et ultrices posuere cubilia Curae; Donec pharetra, magna vestibulum aliquet ultrices, erat tortor sollicitudin mi, sit amet lobortis sapien sapien non mi. Integer ac neque."
7/18/2019,146,mcardello41@columbia.edu,Elkhorn Commodity Rotation Strategy ETF,"Cum sociis natoque penatibus et magnis dis parturient montes, nascetur ridiculus mus. Vivamus vestibulum sagittis sapien. Cum sociis natoque penatibus et magnis dis parturient montes, nascetur ridiculus mus."
2/17/2020,147,dshapland42@state.gov,Novanta Inc.,Etiam justo. Etiam pretium iaculis justo.
4/28/2019,148,ypettican43@ameblo.jp,Atkore International Group Inc.,"Vestibulum ante ipsum primis in faucibus orci luctus et ultrices posuere cubilia Curae; Nulla dapibus dolor vel est. Donec odio justo, sollicitudin ut, suscipit a, feugiat et, eros. Vestibulum ac est lacinia nisi venenatis tristique."
4/11/2019,149,tdrinkeld44@bloomberg.com,"HubSpot, Inc.","Donec odio justo, sollicitudin ut, suscipit a, feugiat et, eros. Vestibulum ac est lacinia nisi venenatis tristique."
6/30/2019,150,ddemangeon45@unc.edu,Diodes Incorporated,Integer a nibh. In quis justo. Maecenas rhoncus aliquam lacus. Morbi quis tortor id nulla ultrices aliquet.
1/4/2020,151,amaynell46@merriam-webster.com,Norfolk Souther Corporation,Nulla facilisi. Cras non velit nec nisi vulputate nonummy. Maecenas tincidunt lacus at velit.
10/9/2019,152,gillingworth47@tripod.com,"American Electric Power Company, Inc.","Nunc rhoncus dui vel sem. Sed sagittis. Nam congue, risus semper porta volutpat, quam pede lobortis ligula, sit amet eleifend pede libero quis orci. Nullam molestie nibh in lectus."
3/14/2020,153,mpendered48@geocities.jp,WisdomTree Strategic Corporate Bond Fund,Suspendisse potenti. In eleifend quam a odio.
5/6/2019,154,lseamarke49@earthlink.net,Unilever NV,Duis aliquam convallis nunc. Proin at turpis a pede posuere nonummy.
6/17/2019,155,rclair4a@nba.com,"GTY Technology Holdings, Inc.",Suspendisse potenti. In eleifend quam a odio. In hac habitasse platea dictumst.
11/27/2019,156,pbrough4b@japanpost.jp,Blackrock Health Sciences Trust,Maecenas pulvinar lobortis est. Phasellus sit amet erat.
7/17/2019,157,irainard4c@webnode.com,Bel Fuse Inc.,Morbi a ipsum. Integer a nibh. In quis justo. Maecenas rhoncus aliquam lacus.
12/18/2019,158,adash4d@barnesandnoble.com,"Eleven Biotherapeutics, Inc.",Duis mattis egestas metus. Aenean fermentum.
5/14/2019,159,dferrillo4e@utexas.edu,Citizens & Northern Corp,Curabitur convallis. Duis consequat dui nec nisi volutpat eleifend. Donec ut dolor. Morbi vel lectus in quam fringilla rhoncus.
