fec,idticket,correo,titulo,descripcion
1/20/2020,314,hmccreary8p@admin.ch,Eaton Vance Enhance Equity Income Fund,"Maecenas tristique, est et tempus semper, est quam pharetra magna, ac consequat metus sapien ut nunc. Vestibulum ante ipsum primis in faucibus orci luctus et ultrices posuere cubilia Curae; Mauris viverra diam vitae quam."
8/25/2019,315,vgriggs8q@twitter.com,Smith (A.O.) Corporation,Aenean lectus. Pellentesque eget nunc. Donec quis orci eget orci vehicula condimentum. Curabitur in libero ut massa volutpat convallis.
6/16/2019,316,bentres8r@delicious.com,"Schmitt Industries, Inc.","Pellentesque ultrices mattis odio. Donec vitae nisi. Nam ultrices, libero non mattis pulvinar, nulla pede ullamcorper augue, a suscipit nulla elit ac nulla. Sed vel enim sit amet nunc viverra dapibus."
5/14/2019,317,hcausier8s@123-reg.co.uk,"Stellar Biotechnologies, Inc.","Vivamus vel nulla eget eros elementum pellentesque. Quisque porta volutpat erat. Quisque erat eros, viverra eget, congue eget, semper rutrum, nulla."
11/14/2019,318,tburgisi8t@sogou.com,Charter Financial Corp.,Curabitur convallis. Duis consequat dui nec nisi volutpat eleifend. Donec ut dolor. Morbi vel lectus in quam fringilla rhoncus.
10/22/2019,319,wfarge8u@flickr.com,United Community Financial Corp.,In eleifend quam a odio. In hac habitasse platea dictumst. Maecenas ut massa quis augue luctus tincidunt.
6/26/2019,320,dchaim8v@epa.gov,"Spartan Motors, Inc.","Aliquam augue quam, sollicitudin vitae, consectetuer eget, rutrum at, lorem. Integer tincidunt ante vel ipsum."
6/17/2019,321,nschaffel8w@a8.net,iShares MSCI UAE Capped ETF,"Quisque porta volutpat erat. Quisque erat eros, viverra eget, congue eget, semper rutrum, nulla."
5/15/2019,322,cspeere8x@stumbleupon.com,PowerShares Global Gold & Precious Metals Portfolio,Ut tellus. Nulla ut erat id mauris vulputate elementum. Nullam varius. Nulla facilisi.
2/18/2020,323,gkrzysztof8y@wix.com,"China Jo-Jo Drugstores, Inc.","Nulla neque libero, convallis eget, eleifend luctus, ultricies eu, nibh. Quisque id justo sit amet sapien dignissim vestibulum. Vestibulum ante ipsum primis in faucibus orci luctus et ultrices posuere cubilia Curae; Nulla dapibus dolor vel est."
3/11/2020,324,egarrad8z@state.gov,MRC Global Inc.,"Nulla neque libero, convallis eget, eleifend luctus, ultricies eu, nibh."
11/21/2019,325,ibonnick90@dion.ne.jp,WSFS Financial Corporation,"Quisque id justo sit amet sapien dignissim vestibulum. Vestibulum ante ipsum primis in faucibus orci luctus et ultrices posuere cubilia Curae; Nulla dapibus dolor vel est. Donec odio justo, sollicitudin ut, suscipit a, feugiat et, eros."
12/22/2019,326,mgiannoni91@simplemachines.org,"Clovis Oncology, Inc.",Donec ut mauris eget massa tempor convallis.
11/18/2019,327,rscotney92@timesonline.co.uk,"Plug Power, Inc.",Aenean auctor gravida sem. Praesent id massa id nisl venenatis lacinia. Aenean sit amet justo.
1/8/2020,328,gzeale93@gov.uk,Manchester United Ltd.,Duis consequat dui nec nisi volutpat eleifend.
4/3/2019,329,rlovell94@yahoo.co.jp,Brightcove Inc.,"Praesent lectus. Vestibulum quam sapien, varius ut, blandit non, interdum in, ante. Vestibulum ante ipsum primis in faucibus orci luctus et ultrices posuere cubilia Curae; Duis faucibus accumsan odio. Curabitur convallis."
2/29/2020,330,rsweetzer95@hostgator.com,"Twitter, Inc.","Fusce posuere felis sed lacus. Morbi sem mauris, laoreet ut, rhoncus aliquet, pulvinar sed, nisl. Nunc rhoncus dui vel sem. Sed sagittis."
12/11/2019,331,lfoster96@newsvine.com,ImmuCell Corporation,Ut at dolor quis odio consequat varius. Integer ac leo. Pellentesque ultrices mattis odio.
5/7/2019,332,smenpes97@unesco.org,Global X S&P 500 Catholic Values ETF,"Quisque arcu libero, rutrum ac, lobortis vel, dapibus at, diam. Nam tristique tortor eu pede."
3/21/2020,333,dmorrell98@dropbox.com,American Homes 4 Rent,"Proin leo odio, porttitor id, consequat in, consequat ut, nulla. Sed accumsan felis. Ut at dolor quis odio consequat varius. Integer ac leo."
2/11/2020,334,earthan99@cbslocal.com,"MCBC Holdings, Inc.",Donec ut dolor. Morbi vel lectus in quam fringilla rhoncus.
12/29/2019,335,jbarnewelle9a@squidoo.com,Universal Health Realty Income Trust,"Proin eu mi. Nulla ac enim. In tempor, turpis nec euismod scelerisque, quam turpis adipiscing lorem, vitae mattis nibh ligula nec sem."
2/4/2020,336,mkillingback9b@go.com,"Threshold Pharmaceuticals, Inc.","Quisque id justo sit amet sapien dignissim vestibulum. Vestibulum ante ipsum primis in faucibus orci luctus et ultrices posuere cubilia Curae; Nulla dapibus dolor vel est. Donec odio justo, sollicitudin ut, suscipit a, feugiat et, eros."
12/16/2019,337,mbalaisot9c@amazon.co.jp,J P Morgan Chase & Co,In hac habitasse platea dictumst. Maecenas ut massa quis augue luctus tincidunt. Nulla mollis molestie lorem. Quisque ut erat.
1/21/2020,338,jkolak9d@baidu.com,Federal Realty Investment Trust,Mauris lacinia sapien quis libero. Nullam sit amet turpis elementum ligula vehicula consequat. Morbi a ipsum.
1/3/2020,339,aprue9e@google.cn,"Marsh & McLennan Companies, Inc.","Duis bibendum, felis sed interdum venenatis, turpis enim blandit mi, in porttitor pede justo eu massa. Donec dapibus. Duis at velit eu est congue elementum. In hac habitasse platea dictumst."
7/1/2019,340,bsarvar9f@about.me,Liberty Interactive Corporation,"Duis aliquam convallis nunc. Proin at turpis a pede posuere nonummy. Integer non velit. Donec diam neque, vestibulum eget, vulputate ut, ultrices vel, augue."
3/1/2020,341,scuppitt9g@amazon.com,Dynegy Inc.,"Duis ac nibh. Fusce lacus purus, aliquet at, feugiat non, pretium quis, lectus. Suspendisse potenti. In eleifend quam a odio."
10/12/2019,342,dplatts9h@engadget.com,Nuveen Preferred and Income Term Fund,"Suspendisse ornare consequat lectus. In est risus, auctor sed, tristique in, tempus sit amet, sem. Fusce consequat."
4/29/2019,343,hfreeberne9i@google.co.jp,Gabelli Global Small and Mid Cap Value Trust (The),Vestibulum ante ipsum primis in faucibus orci luctus et ultrices posuere cubilia Curae; Mauris viverra diam vitae quam. Suspendisse potenti. Nullam porttitor lacus at turpis.
5/10/2019,344,dhawkswood9j@oaic.gov.au,OFG Bancorp,"In est risus, auctor sed, tristique in, tempus sit amet, sem. Fusce consequat. Nulla nisl."
12/9/2019,345,rhopkins9k@e-recht24.de,Liberty Broadband Corporation,"Integer pede justo, lacinia eget, tincidunt eget, tempus vel, pede. Morbi porttitor lorem id ligula. Suspendisse ornare consequat lectus."
3/7/2020,346,ngregore9l@who.int,"Edge Therapeutics, Inc.",Morbi a ipsum. Integer a nibh. In quis justo.
11/18/2019,347,kbewlie9m@blinklist.com,Barrick Gold Corporation,Quisque porta volutpat erat.
7/1/2019,348,scassell9n@va.gov,Polaris Industries Inc.,In hac habitasse platea dictumst. Etiam faucibus cursus urna. Ut tellus.
12/14/2019,349,emogford9o@archive.org,"Prudential Short Duration High Yield Fund, Inc.",Duis at velit eu est congue elementum.
6/22/2019,350,kbellocht9p@hud.gov,Evogene Ltd.,Cras pellentesque volutpat dui.
10/27/2019,351,acostelloe9q@salon.com,Eaton Vance NextShares Trust,Duis consequat dui nec nisi volutpat eleifend.
8/11/2019,352,jgrain9r@ftc.gov,Omeros Corporation,"Vivamus metus arcu, adipiscing molestie, hendrerit at, vulputate vitae, nisl. Aenean lectus. Pellentesque eget nunc. Donec quis orci eget orci vehicula condimentum."
11/6/2019,353,rchanter9s@mayoclinic.com,Santander Consumer USA Holdings Inc.,"Morbi odio odio, elementum eu, interdum eu, tincidunt in, leo. Maecenas pulvinar lobortis est. Phasellus sit amet erat."
8/23/2019,354,jwakelam9t@guardian.co.uk,Panera Bread Company,"Quisque porta volutpat erat. Quisque erat eros, viverra eget, congue eget, semper rutrum, nulla. Nunc purus."
3/20/2020,355,jpavier9u@ocn.ne.jp,Check-Cap Ltd.,"Cum sociis natoque penatibus et magnis dis parturient montes, nascetur ridiculus mus. Vivamus vestibulum sagittis sapien."
10/27/2019,356,kmckune9v@rambler.ru,Phoenix New Media Limited,"Aliquam augue quam, sollicitudin vitae, consectetuer eget, rutrum at, lorem."
6/8/2019,357,rgoolding9w@csmonitor.com,Agenus Inc.,"Cum sociis natoque penatibus et magnis dis parturient montes, nascetur ridiculus mus. Etiam vel augue."
7/28/2019,358,lmarquese9x@elegantthemes.com,Aon plc,Suspendisse potenti.
3/11/2020,359,bbulmer9y@epa.gov,"Barnes & Noble Education, Inc","Maecenas rhoncus aliquam lacus. Morbi quis tortor id nulla ultrices aliquet. Maecenas leo odio, condimentum id, luctus nec, molestie sed, justo."
2/19/2020,360,adayer9z@ebay.com,"Ulta Beauty, Inc.","Nam dui. Proin leo odio, porttitor id, consequat in, consequat ut, nulla."
3/24/2019,361,rbohdena0@phpbb.com,"NextEra Energy, Inc.","Pellentesque viverra pede ac diam. Cras pellentesque volutpat dui. Maecenas tristique, est et tempus semper, est quam pharetra magna, ac consequat metus sapien ut nunc. Vestibulum ante ipsum primis in faucibus orci luctus et ultrices posuere cubilia Curae; Mauris viverra diam vitae quam."
9/30/2019,362,aadkinsa1@hc360.com,Tennessee Valley Authority,Vestibulum sed magna at nunc commodo placerat.
9/1/2019,363,cstanlacka2@yale.edu,"Greenhill & Co., Inc.",Sed vel enim sit amet nunc viverra dapibus. Nulla suscipit ligula in lacus. Curabitur at ipsum ac tellus semper interdum.
2/29/2020,364,woberta3@timesonline.co.uk,"Windstream Holdings, Inc.",Nunc purus. Phasellus in felis.
7/4/2019,365,fguierrea4@bluehost.com,STMicroelectronics N.V.,Integer tincidunt ante vel ipsum. Praesent blandit lacinia erat.
1/1/2020,366,pantona5@nsw.gov.au,Eaton Vance Corporation,"Nulla ac enim. In tempor, turpis nec euismod scelerisque, quam turpis adipiscing lorem, vitae mattis nibh ligula nec sem."
4/20/2019,367,jattleea6@webmd.com,Broadcom Limited,"Maecenas tincidunt lacus at velit. Vivamus vel nulla eget eros elementum pellentesque. Quisque porta volutpat erat. Quisque erat eros, viverra eget, congue eget, semper rutrum, nulla."
12/29/2019,368,nculwena7@lycos.com,"Republic Services, Inc.","Quisque arcu libero, rutrum ac, lobortis vel, dapibus at, diam. Nam tristique tortor eu pede."
1/2/2020,369,aseaa8@tumblr.com,"Titan Pharmaceuticals, Inc.","Nunc nisl. Duis bibendum, felis sed interdum venenatis, turpis enim blandit mi, in porttitor pede justo eu massa. Donec dapibus."
3/1/2020,370,aapsa9@furl.net,eBay Inc.,Donec posuere metus vitae ipsum. Aliquam non mauris. Morbi non lectus.
12/24/2019,371,cglisenanaa@ning.com,First Potomac Realty Trust,"Lorem ipsum dolor sit amet, consectetuer adipiscing elit."
10/30/2019,372,tscotchbourougeab@vk.com,Enel Americas S.A.,"Donec ut mauris eget massa tempor convallis. Nulla neque libero, convallis eget, eleifend luctus, ultricies eu, nibh. Quisque id justo sit amet sapien dignissim vestibulum."
10/11/2019,373,cdamantac@studiopress.com,"J.C. Penney Company, Inc. Holding Company","Curabitur gravida nisi at nibh. In hac habitasse platea dictumst. Aliquam augue quam, sollicitudin vitae, consectetuer eget, rutrum at, lorem. Integer tincidunt ante vel ipsum."
4/22/2019,374,mgossanad@spotify.com,"Cellcom Israel, Ltd.",Duis aliquam convallis nunc. Proin at turpis a pede posuere nonummy. Integer non velit.
10/8/2019,375,omckinlessae@wisc.edu,Pointer Telocation Ltd.,"Cras pellentesque volutpat dui. Maecenas tristique, est et tempus semper, est quam pharetra magna, ac consequat metus sapien ut nunc. Vestibulum ante ipsum primis in faucibus orci luctus et ultrices posuere cubilia Curae; Mauris viverra diam vitae quam."
2/3/2020,376,jhabertaf@wikimedia.org,Fidelity and Guaranty Life,"Quisque id justo sit amet sapien dignissim vestibulum. Vestibulum ante ipsum primis in faucibus orci luctus et ultrices posuere cubilia Curae; Nulla dapibus dolor vel est. Donec odio justo, sollicitudin ut, suscipit a, feugiat et, eros."
11/23/2019,377,mgallyag@scribd.com,Eagle Point Credit Company Inc.,"Fusce consequat. Nulla nisl. Nunc nisl. Duis bibendum, felis sed interdum venenatis, turpis enim blandit mi, in porttitor pede justo eu massa."
8/26/2019,378,lflamentah@slideshare.net,Silicon Motion Technology Corporation,Phasellus sit amet erat. Nulla tempus. Vivamus in felis eu sapien cursus vestibulum.
6/13/2019,379,wpetrazziai@jimdo.com,Conyers Park Acquisition Corp.,"In quis justo. Maecenas rhoncus aliquam lacus. Morbi quis tortor id nulla ultrices aliquet. Maecenas leo odio, condimentum id, luctus nec, molestie sed, justo."
5/18/2019,380,elipscombaj@xing.com,Stifel Financial Corporation,"Cras mi pede, malesuada in, imperdiet et, commodo vulputate, justo."
5/31/2019,381,shalburtonak@wikispaces.com,Westrock Company,Mauris sit amet eros.
10/6/2019,382,pannattal@hud.gov,"Richmont Mines, Inc.","Morbi non lectus. Aliquam sit amet diam in magna bibendum imperdiet. Nullam orci pede, venenatis non, sodales sed, tincidunt eu, felis. Fusce posuere felis sed lacus."
12/16/2019,383,isalvatoream@census.gov,"Proto Labs, Inc.",Morbi porttitor lorem id ligula. Suspendisse ornare consequat lectus.
7/10/2019,384,challihanean@cbslocal.com,"Goldman Sachs Group, Inc. (The)",Phasellus sit amet erat. Nulla tempus. Vivamus in felis eu sapien cursus vestibulum. Proin eu mi.
6/19/2019,385,rthomelao@reddit.com,Arbor Realty Trust,In eleifend quam a odio. In hac habitasse platea dictumst. Maecenas ut massa quis augue luctus tincidunt. Nulla mollis molestie lorem.
7/13/2019,386,sgroganap@e-recht24.de,"AquaBounty Technologies, Inc.","Mauris enim leo, rhoncus sed, vestibulum sit amet, cursus id, turpis. Integer aliquet, massa id lobortis convallis, tortor risus dapibus augue, vel accumsan tellus nisi eu orci. Mauris lacinia sapien quis libero. Nullam sit amet turpis elementum ligula vehicula consequat."
3/13/2020,387,cgaulaq@upenn.edu,Principal Healthcare Innovators Index ETF,Nulla facilisi. Cras non velit nec nisi vulputate nonummy.
12/5/2019,388,cjeannotar@imageshack.us,First Trust United Kingdom AlphaDEX Fund,Donec posuere metus vitae ipsum. Aliquam non mauris. Morbi non lectus. Aliquam sit amet diam in magna bibendum imperdiet.
9/10/2019,389,lkoschkeas@bluehost.com,Agree Realty Corporation,"Proin leo odio, porttitor id, consequat in, consequat ut, nulla."
9/9/2019,390,hcaselliat@edublogs.org,"PRGX Global, Inc.",Etiam justo. Etiam pretium iaculis justo. In hac habitasse platea dictumst.
3/7/2020,391,lfifieldau@go.com,Dawson Geophysical Company,"Morbi vestibulum, velit id pretium iaculis, diam erat fermentum justo, nec condimentum neque sapien placerat ante. Nulla justo. Aliquam quis turpis eget elit sodales scelerisque."
9/6/2019,392,srohlfingav@fc2.com,Vulcan Materials Company,Maecenas tincidunt lacus at velit. Vivamus vel nulla eget eros elementum pellentesque.
6/27/2019,393,ogintyaw@mail.ru,GP Investments Acquisition Corp.,Phasellus in felis. Donec semper sapien a libero. Nam dui.
6/14/2019,394,dsamartax@nyu.edu,Axovant Sciences Ltd.,"Nunc nisl. Duis bibendum, felis sed interdum venenatis, turpis enim blandit mi, in porttitor pede justo eu massa."
3/27/2019,395,tglenwrightay@hatena.ne.jp,Barington/Hilco Acquisition Corp.,"In hac habitasse platea dictumst. Aliquam augue quam, sollicitudin vitae, consectetuer eget, rutrum at, lorem. Integer tincidunt ante vel ipsum."
5/21/2019,396,gclipshamaz@xrea.com,Forum Merger Corporation,Quisque porta volutpat erat.
10/21/2019,397,hmessinghamb0@yolasite.com,"OraSure Technologies, Inc.","Quisque erat eros, viverra eget, congue eget, semper rutrum, nulla."
7/30/2019,398,tpicardob1@goodreads.com,Western Union Company (The),"Phasellus id sapien in sapien iaculis congue. Vivamus metus arcu, adipiscing molestie, hendrerit at, vulputate vitae, nisl. Aenean lectus."
11/27/2019,399,mdellb2@ted.com,"Sierra Oncology, Inc.","Lorem ipsum dolor sit amet, consectetuer adipiscing elit. Proin interdum mauris non ligula pellentesque ultrices."
11/19/2019,400,ktrussb3@odnoklassniki.ru,Nuveen New York Municipal Value Fund 2,"Curabitur in libero ut massa volutpat convallis. Morbi odio odio, elementum eu, interdum eu, tincidunt in, leo. Maecenas pulvinar lobortis est. Phasellus sit amet erat."
11/5/2019,401,kluptonb4@umn.edu,WAVE Life Sciences Ltd.,In eleifend quam a odio. In hac habitasse platea dictumst.
6/8/2019,402,vberrygunb5@time.com,"WellCare Health Plans, Inc.",In eleifend quam a odio. In hac habitasse platea dictumst. Maecenas ut massa quis augue luctus tincidunt. Nulla mollis molestie lorem.
10/7/2019,403,sduchenneb6@mayoclinic.com,Alkermes plc,"In tempor, turpis nec euismod scelerisque, quam turpis adipiscing lorem, vitae mattis nibh ligula nec sem. Duis aliquam convallis nunc."
6/10/2019,404,lnajafianb7@java.com,"Yatra Online, Inc.",Nulla tempus.
6/2/2019,405,nwadworthb8@springer.com,Michael Kors Holdings Limited,In hac habitasse platea dictumst.
10/10/2019,406,scockellb9@netvibes.com,LMP Capital and Income Fund Inc.,"Cum sociis natoque penatibus et magnis dis parturient montes, nascetur ridiculus mus. Etiam vel augue."
3/21/2020,407,aeckersleyba@arizona.edu,Everi Holdings Inc.,Praesent id massa id nisl venenatis lacinia.
6/6/2019,408,nranyellbb@reuters.com,"Gildan Activewear, Inc.",Nullam varius. Nulla facilisi. Cras non velit nec nisi vulputate nonummy.
12/7/2019,409,rpulteneyebc@parallels.com,Astrotech Corporation,"Morbi quis tortor id nulla ultrices aliquet. Maecenas leo odio, condimentum id, luctus nec, molestie sed, justo. Pellentesque viverra pede ac diam. Cras pellentesque volutpat dui."
12/15/2019,410,jtiffinbd@paypal.com,"PGT Innovations, Inc.",Ut tellus. Nulla ut erat id mauris vulputate elementum. Nullam varius. Nulla facilisi.
10/1/2019,411,spenvarnebe@timesonline.co.uk,"Aberdeen Greater China Fund, Inc.",Duis consequat dui nec nisi volutpat eleifend.
3/2/2020,412,ddefilippobf@liveinternet.ru,"Synopsys, Inc.",Pellentesque at nulla. Suspendisse potenti. Cras in purus eu magna vulputate luctus.
10/31/2019,413,snuschkebg@statcounter.com,XTL Biopharmaceuticals Ltd.,"In tempor, turpis nec euismod scelerisque, quam turpis adipiscing lorem, vitae mattis nibh ligula nec sem. Duis aliquam convallis nunc."
7/20/2019,414,tschoenfischbh@biblegateway.com,Gladstone Land Corporation,Proin eu mi. Nulla ac enim.
11/30/2019,415,pneatebi@marriott.com,China Rapid Finance Limited,Suspendisse accumsan tortor quis turpis. Sed ante. Vivamus tortor.
5/30/2019,416,pkincaidbj@ibm.com,Celgene Corporation,"Integer non velit. Donec diam neque, vestibulum eget, vulputate ut, ultrices vel, augue."
7/26/2019,417,icapsbk@slashdot.org,"Boston Beer Company, Inc. (The)",Donec semper sapien a libero. Nam dui.
10/15/2019,418,ewoodmanbl@fotki.com,Stone Energy Corporation,"Donec quis orci eget orci vehicula condimentum. Curabitur in libero ut massa volutpat convallis. Morbi odio odio, elementum eu, interdum eu, tincidunt in, leo."
3/1/2020,419,zsnadenbm@psu.edu,"Armada Hoffler Properties, Inc.",Nullam varius. Nulla facilisi. Cras non velit nec nisi vulputate nonummy. Maecenas tincidunt lacus at velit.
2/22/2020,420,mgaisfordbn@pinterest.com,CombiMatrix Corporation,Sed accumsan felis. Ut at dolor quis odio consequat varius. Integer ac leo.
7/2/2019,421,shaselybo@dagondesign.com,Semgroup Corporation,"Nullam orci pede, venenatis non, sodales sed, tincidunt eu, felis. Fusce posuere felis sed lacus. Morbi sem mauris, laoreet ut, rhoncus aliquet, pulvinar sed, nisl."
4/3/2019,422,ldorrbp@sphinn.com,"Nuveen Municipal Income Fund, Inc.","Vestibulum sed magna at nunc commodo placerat. Praesent blandit. Nam nulla. Integer pede justo, lacinia eget, tincidunt eget, tempus vel, pede."
3/22/2020,423,bstrydebq@1688.com,"FBL Financial Group, Inc.","Lorem ipsum dolor sit amet, consectetuer adipiscing elit."
2/9/2020,424,belcoatebr@imdb.com,Citigroup Inc.,Suspendisse potenti. Nullam porttitor lacus at turpis. Donec posuere metus vitae ipsum.
11/26/2019,425,tthonbs@histats.com,"Autodesk, Inc.",Vivamus tortor. Duis mattis egestas metus.
4/16/2019,426,bpetrowskybt@ucla.edu,Oxbridge Re Holdings Limited,Curabitur at ipsum ac tellus semper interdum. Mauris ullamcorper purus sit amet nulla.
2/1/2020,427,achappellebu@weebly.com,Kingold Jewelry Inc.,Donec semper sapien a libero. Nam dui.
4/23/2019,428,ujuggingsbv@1688.com,"FuelCell Energy, Inc.","Nunc nisl. Duis bibendum, felis sed interdum venenatis, turpis enim blandit mi, in porttitor pede justo eu massa."
12/29/2019,429,gderobertisbw@ucla.edu,Mercantile Bank Corporation,"Cum sociis natoque penatibus et magnis dis parturient montes, nascetur ridiculus mus."
2/25/2020,430,aondrusekbx@hubpages.com,"NexPoint Residential Trust, Inc.",Mauris lacinia sapien quis libero.
4/10/2019,431,ahaggerstoneby@economist.com,"NVR, Inc.","In hac habitasse platea dictumst. Aliquam augue quam, sollicitudin vitae, consectetuer eget, rutrum at, lorem. Integer tincidunt ante vel ipsum. Praesent blandit lacinia erat."
4/9/2019,432,iwildesbz@ameblo.jp,First Trust RiverFront Dynamic Europe ETF,"Nam nulla. Integer pede justo, lacinia eget, tincidunt eget, tempus vel, pede. Morbi porttitor lorem id ligula."
6/7/2019,433,oblownc0@yellowbook.com,Pebblebrook Hotel Trust,"Proin leo odio, porttitor id, consequat in, consequat ut, nulla. Sed accumsan felis. Ut at dolor quis odio consequat varius. Integer ac leo."
7/21/2019,434,kguillouc1@163.com,"Customers Bancorp, Inc","Maecenas tristique, est et tempus semper, est quam pharetra magna, ac consequat metus sapien ut nunc. Vestibulum ante ipsum primis in faucibus orci luctus et ultrices posuere cubilia Curae; Mauris viverra diam vitae quam. Suspendisse potenti."
7/17/2019,435,stansliec2@icq.com,"Civista Bancshares, Inc. ","In blandit ultrices enim. Lorem ipsum dolor sit amet, consectetuer adipiscing elit. Proin interdum mauris non ligula pellentesque ultrices."
7/24/2019,436,rklosserc3@bravesites.com,Loncar Cancer Immunotherapy ETF,Proin at turpis a pede posuere nonummy. Integer non velit.
3/15/2020,437,bgolsthorpc4@theguardian.com,Spherix Incorporated,Praesent blandit lacinia erat.
9/4/2019,438,zcucksonc5@ed.gov,Koppers Holdings Inc.,Morbi non lectus. Aliquam sit amet diam in magna bibendum imperdiet.
11/2/2019,439,dstockauc6@ask.com,"Wheeler Real Estate Investment Trust, Inc.","Vestibulum ac est lacinia nisi venenatis tristique. Fusce congue, diam id ornare imperdiet, sapien urna pretium nisl, ut volutpat sapien arcu sed augue. Aliquam erat volutpat."
4/19/2019,440,ncolisbec7@surveymonkey.com,Mosaic Company (The),"Nunc nisl. Duis bibendum, felis sed interdum venenatis, turpis enim blandit mi, in porttitor pede justo eu massa."
7/27/2019,441,sgarrityc8@hp.com,First Trust NASDAQ Technology Dividend Index Fund,Mauris sit amet eros. Suspendisse accumsan tortor quis turpis. Sed ante. Vivamus tortor.
6/17/2019,442,dcraufordc9@eventbrite.com,BLDRS Emerging Markets 50 ADR Index Fund,"Morbi ut odio. Cras mi pede, malesuada in, imperdiet et, commodo vulputate, justo. In blandit ultrices enim. Lorem ipsum dolor sit amet, consectetuer adipiscing elit."
3/14/2020,443,tberreclothca@behance.net,iShares S&P India Nifty 50 Index Fund,"Morbi vestibulum, velit id pretium iaculis, diam erat fermentum justo, nec condimentum neque sapien placerat ante. Nulla justo."
4/28/2019,444,fmcguffiecb@ask.com,CalAmp Corp.,Nullam varius.
11/6/2019,445,nblowfeldecc@earthlink.net,Northrop Grumman Corporation,"Suspendisse potenti. Cras in purus eu magna vulputate luctus. Cum sociis natoque penatibus et magnis dis parturient montes, nascetur ridiculus mus. Vivamus vestibulum sagittis sapien."
9/28/2019,446,condrasekcd@altervista.org,Western Alliance Bancorporation,"Quisque erat eros, viverra eget, congue eget, semper rutrum, nulla. Nunc purus."
10/28/2019,447,broffce@pen.io,Univest Corporation of Pennsylvania,"Vestibulum quam sapien, varius ut, blandit non, interdum in, ante. Vestibulum ante ipsum primis in faucibus orci luctus et ultrices posuere cubilia Curae; Duis faucibus accumsan odio. Curabitur convallis."
1/19/2020,448,mgaskallcf@mail.ru,First Trust Nasdaq Transportation ETF,Nulla tellus. In sagittis dui vel nisl. Duis ac nibh.
6/21/2019,449,aarpurcg@smugmug.com,United States Cellular Corporation,Mauris ullamcorper purus sit amet nulla.
7/7/2019,450,ebattrumch@weebly.com,Microbot Medical Inc. ,Mauris sit amet eros. Suspendisse accumsan tortor quis turpis.
1/23/2020,451,ldimnageci@stumbleupon.com,"Viveve Medical, Inc.","Nam nulla. Integer pede justo, lacinia eget, tincidunt eget, tempus vel, pede. Morbi porttitor lorem id ligula."
3/16/2020,452,jevertoncj@livejournal.com,"Eldorado Resorts, Inc.",Curabitur gravida nisi at nibh. In hac habitasse platea dictumst.
9/13/2019,453,kutteridgeck@slideshare.net,American Tower Corporation (REIT),"Nulla neque libero, convallis eget, eleifend luctus, ultricies eu, nibh. Quisque id justo sit amet sapien dignissim vestibulum."
3/5/2020,454,mlathleiffcl@elpais.com,Newmont Mining Corporation,"Vestibulum quam sapien, varius ut, blandit non, interdum in, ante. Vestibulum ante ipsum primis in faucibus orci luctus et ultrices posuere cubilia Curae; Duis faucibus accumsan odio."
12/17/2019,455,kfruchoncm@comsenz.com,QAD Inc.,"Morbi vel lectus in quam fringilla rhoncus. Mauris enim leo, rhoncus sed, vestibulum sit amet, cursus id, turpis. Integer aliquet, massa id lobortis convallis, tortor risus dapibus augue, vel accumsan tellus nisi eu orci. Mauris lacinia sapien quis libero."
9/18/2019,456,braundscn@telegraph.co.uk,Silver Standard Resources Inc.,Integer a nibh. In quis justo. Maecenas rhoncus aliquam lacus. Morbi quis tortor id nulla ultrices aliquet.
1/31/2020,457,cstokerco@linkedin.com,Colonial Intermediate High Income Fund,"Integer pede justo, lacinia eget, tincidunt eget, tempus vel, pede. Morbi porttitor lorem id ligula."
11/22/2019,458,amccaskillcp@istockphoto.com,Mid Penn Bancorp,"Morbi quis tortor id nulla ultrices aliquet. Maecenas leo odio, condimentum id, luctus nec, molestie sed, justo. Pellentesque viverra pede ac diam. Cras pellentesque volutpat dui."
