fec,idticket,correo,titulo,descripcion
7/11/2019,459,gcreamcq@tumblr.com,"Blackrock Enhanced Government Fund, Inc","Nulla neque libero, convallis eget, eleifend luctus, ultricies eu, nibh. Quisque id justo sit amet sapien dignissim vestibulum. Vestibulum ante ipsum primis in faucibus orci luctus et ultrices posuere cubilia Curae; Nulla dapibus dolor vel est. Donec odio justo, sollicitudin ut, suscipit a, feugiat et, eros."
6/5/2019,460,tadiecr@eventbrite.com,Grupo Financiero Galicia S.A.,Morbi a ipsum. Integer a nibh. In quis justo.
11/24/2019,461,tcahalancs@trellian.com,"Energy Recovery, Inc.",Aliquam non mauris. Morbi non lectus. Aliquam sit amet diam in magna bibendum imperdiet.
3/28/2019,462,jgavahanct@amazon.co.uk,"Dominion Energy, Inc.",Maecenas tincidunt lacus at velit. Vivamus vel nulla eget eros elementum pellentesque. Quisque porta volutpat erat.
6/6/2019,463,mgaroghancu@wikipedia.org,"Leggett & Platt, Incorporated",Duis mattis egestas metus. Aenean fermentum.
6/17/2019,464,ephilipcv@msn.com,Ivy High Income Opportunities Fund,Sed accumsan felis. Ut at dolor quis odio consequat varius. Integer ac leo. Pellentesque ultrices mattis odio.
6/16/2019,465,mluceycw@hubpages.com,Oasmia Pharmaceutical AB,In eleifend quam a odio. In hac habitasse platea dictumst. Maecenas ut massa quis augue luctus tincidunt. Nulla mollis molestie lorem.
2/15/2020,466,loxecx@imgur.com,Hecla Mining Company,Vivamus in felis eu sapien cursus vestibulum.
1/2/2020,467,acastanacy@photobucket.com,OHA Investment Corporation,"Donec quis orci eget orci vehicula condimentum. Curabitur in libero ut massa volutpat convallis. Morbi odio odio, elementum eu, interdum eu, tincidunt in, leo. Maecenas pulvinar lobortis est."
4/9/2019,468,ablowescz@ucoz.com,"Prudential Short Duration High Yield Fund, Inc.",Etiam vel augue. Vestibulum rutrum rutrum neque. Aenean auctor gravida sem.
11/17/2019,469,tlethbyd0@upenn.edu,GasLog LP.,Nulla justo. Aliquam quis turpis eget elit sodales scelerisque.
2/12/2020,470,bpered1@gov.uk,BlackRock Science and Technology Trust,Nunc purus. Phasellus in felis.
1/28/2020,471,tbattylld2@usatoday.com,BB&T Corporation,Morbi quis tortor id nulla ultrices aliquet.
2/7/2020,472,kbowdend3@nytimes.com,"Insmed, Inc.",Praesent blandit lacinia erat.
12/25/2019,473,jdeluciad4@ezinearticles.com,ICICI Bank Limited,Nulla justo. Aliquam quis turpis eget elit sodales scelerisque. Mauris sit amet eros.
2/11/2020,474,lsemoradd5@sciencedirect.com,The AES Corporation,Phasellus sit amet erat. Nulla tempus. Vivamus in felis eu sapien cursus vestibulum. Proin eu mi.
2/12/2020,475,twillockd6@miibeian.gov.cn,M&T Bank Corporation,"Morbi sem mauris, laoreet ut, rhoncus aliquet, pulvinar sed, nisl."
12/8/2019,476,bvashchenkod7@ucoz.ru,"Bob Evans Farms, Inc.","Nam ultrices, libero non mattis pulvinar, nulla pede ullamcorper augue, a suscipit nulla elit ac nulla."
10/22/2019,477,jrodenhurstd8@google.ru,"Accelerate Diagnostics, Inc.","Nam nulla. Integer pede justo, lacinia eget, tincidunt eget, tempus vel, pede."
12/25/2019,478,vshortd9@ucoz.ru,"Customers Bancorp, Inc",Suspendisse potenti.
10/15/2019,479,psalterneda@virginia.edu,Welltower Inc.,Nulla ut erat id mauris vulputate elementum. Nullam varius. Nulla facilisi. Cras non velit nec nisi vulputate nonummy.
6/23/2019,480,ipulverdb@unicef.org,MFS Municipal Income Trust,Nunc purus.
12/4/2019,481,ntophamdc@feedburner.com,Nuveen New York AMT-Free Quality Municipal,Donec posuere metus vitae ipsum.
12/14/2019,482,bkornyakovdd@psu.edu,"Recon Technology, Ltd.",Nullam molestie nibh in lectus.
12/18/2019,483,ckilleleyde@cnbc.com,"Advanced Drainage Systems, Inc.",Nulla ut erat id mauris vulputate elementum. Nullam varius. Nulla facilisi.
6/29/2019,484,sfairheaddf@alexa.com,"CHF Solutions, Inc.","Proin eu mi. Nulla ac enim. In tempor, turpis nec euismod scelerisque, quam turpis adipiscing lorem, vitae mattis nibh ligula nec sem. Duis aliquam convallis nunc."
1/14/2020,485,nanyenedg@canalblog.com,"Condor Hospitality Trust, Inc.",Nullam porttitor lacus at turpis. Donec posuere metus vitae ipsum.
6/10/2019,486,qdrinkhilldh@fastcompany.com,"AmTrust Financial Services, Inc.",Etiam vel augue. Vestibulum rutrum rutrum neque.
1/14/2020,487,bbiggerstaffdi@berkeley.edu,"Ameresco, Inc.",Nulla ut erat id mauris vulputate elementum. Nullam varius. Nulla facilisi.
6/10/2019,488,coverlanddj@uiuc.edu,Ambev S.A.,Nulla suscipit ligula in lacus.
2/28/2020,489,inorkuttdk@bbc.co.uk,"Blackrock MuniYield Fund, Inc.",Duis at velit eu est congue elementum.
9/11/2019,490,thawkettdl@tripod.com,"NanoString Technologies, Inc.",Vestibulum rutrum rutrum neque. Aenean auctor gravida sem. Praesent id massa id nisl venenatis lacinia. Aenean sit amet justo.
4/1/2019,491,egoodbydm@miibeian.gov.cn,DDR Corp.,Pellentesque eget nunc. Donec quis orci eget orci vehicula condimentum. Curabitur in libero ut massa volutpat convallis.
5/28/2019,492,fshirildn@ustream.tv,"Simon Property Group, Inc.",Etiam faucibus cursus urna. Ut tellus. Nulla ut erat id mauris vulputate elementum. Nullam varius.
4/17/2019,493,lhawesdo@pcworld.com,Invesco High Income 2023 Target Term Fund,"Lorem ipsum dolor sit amet, consectetuer adipiscing elit. Proin risus. Praesent lectus. Vestibulum quam sapien, varius ut, blandit non, interdum in, ante."
4/18/2019,494,grhoadesdp@i2i.jp,"First Capital, Inc.",Aliquam quis turpis eget elit sodales scelerisque. Mauris sit amet eros. Suspendisse accumsan tortor quis turpis.
11/4/2019,495,mmenilovedq@wp.com,"Enviva Partners, LP",Suspendisse accumsan tortor quis turpis. Sed ante. Vivamus tortor.
6/5/2019,496,mharowerdr@businessweek.com,Tribune Media Company,"Integer aliquet, massa id lobortis convallis, tortor risus dapibus augue, vel accumsan tellus nisi eu orci. Mauris lacinia sapien quis libero. Nullam sit amet turpis elementum ligula vehicula consequat."
8/26/2019,497,nellikerds@gravatar.com,Ritchie Bros. Auctioneers Incorporated,"Lorem ipsum dolor sit amet, consectetuer adipiscing elit. Proin risus. Praesent lectus. Vestibulum quam sapien, varius ut, blandit non, interdum in, ante."
10/10/2019,498,aniasdt@edublogs.org,Sparton Corporation,"Integer non velit. Donec diam neque, vestibulum eget, vulputate ut, ultrices vel, augue."
11/13/2019,499,scouperdu@techcrunch.com,Pangaea Logistics Solutions Ltd.,"Vestibulum ante ipsum primis in faucibus orci luctus et ultrices posuere cubilia Curae; Donec pharetra, magna vestibulum aliquet ultrices, erat tortor sollicitudin mi, sit amet lobortis sapien sapien non mi. Integer ac neque."
5/26/2019,500,mcloutedv@shop-pro.jp,Golar LNG Partners LP,Mauris lacinia sapien quis libero. Nullam sit amet turpis elementum ligula vehicula consequat. Morbi a ipsum.
8/17/2019,501,scostindw@ow.ly,Travelport Worldwide Limited,"Quisque erat eros, viverra eget, congue eget, semper rutrum, nulla. Nunc purus."
6/10/2019,502,pdemariadx@yandex.ru,"ING Group, N.V.",In hac habitasse platea dictumst.
8/8/2019,503,pclemensondy@php.net,Triangle Capital Corporation,Suspendisse potenti. Cras in purus eu magna vulputate luctus.
2/19/2020,504,zmoultriedz@cdc.gov,"Ascena Retail Group, Inc.","Integer pede justo, lacinia eget, tincidunt eget, tempus vel, pede. Morbi porttitor lorem id ligula."
10/27/2019,505,cduttone0@etsy.com,"Quanta Services, Inc.","Curabitur at ipsum ac tellus semper interdum. Mauris ullamcorper purus sit amet nulla. Quisque arcu libero, rutrum ac, lobortis vel, dapibus at, diam. Nam tristique tortor eu pede."
7/13/2019,506,dchiezee1@ehow.com,Cambrex Corporation,Maecenas rhoncus aliquam lacus. Morbi quis tortor id nulla ultrices aliquet.
7/18/2019,507,efleotee2@sphinn.com,Hornbeck Offshore Services,Nulla mollis molestie lorem. Quisque ut erat. Curabitur gravida nisi at nibh. In hac habitasse platea dictumst.
4/25/2019,508,hmanvillee3@shinystat.com,Pegasystems Inc.,Aliquam erat volutpat.
10/10/2019,509,jmiccoe4@google.cn,"Texas Capital Bancshares, Inc.",Nulla mollis molestie lorem. Quisque ut erat. Curabitur gravida nisi at nibh.
7/31/2019,510,zrenehane5@about.me,Dynagas LNG Partners LP,"Aenean sit amet justo. Morbi ut odio. Cras mi pede, malesuada in, imperdiet et, commodo vulputate, justo. In blandit ultrices enim."
10/8/2019,511,shaffnere6@nhs.uk,"Speedway Motorsports, Inc.","Curabitur at ipsum ac tellus semper interdum. Mauris ullamcorper purus sit amet nulla. Quisque arcu libero, rutrum ac, lobortis vel, dapibus at, diam. Nam tristique tortor eu pede."
9/25/2019,512,bcordeaue7@privacy.gov.au,PJT Partners Inc.,Aliquam sit amet diam in magna bibendum imperdiet.
10/27/2019,513,fgiannassie8@cbc.ca,OUTFRONT Media Inc.,"Integer non velit. Donec diam neque, vestibulum eget, vulputate ut, ultrices vel, augue. Vestibulum ante ipsum primis in faucibus orci luctus et ultrices posuere cubilia Curae; Donec pharetra, magna vestibulum aliquet ultrices, erat tortor sollicitudin mi, sit amet lobortis sapien sapien non mi."
3/20/2020,514,jwadgee9@cdc.gov,"First Connecticut Bancorp, Inc.",Sed accumsan felis. Ut at dolor quis odio consequat varius.
11/11/2019,515,ttuckieea@google.de,"Dynex Capital, Inc.",In eleifend quam a odio. In hac habitasse platea dictumst. Maecenas ut massa quis augue luctus tincidunt. Nulla mollis molestie lorem.
6/6/2019,516,ctoopeeb@dmoz.org,Gentex Corporation,"Fusce congue, diam id ornare imperdiet, sapien urna pretium nisl, ut volutpat sapien arcu sed augue."
2/27/2020,517,cwearneec@mlb.com,Intelsat S.A.,Pellentesque at nulla.
3/7/2020,518,vixered@harvard.edu,General Electric Capital Corporation,Donec dapibus. Duis at velit eu est congue elementum.
4/26/2019,519,fmatyuginee@google.es,Rosetta Stone,Etiam faucibus cursus urna. Ut tellus. Nulla ut erat id mauris vulputate elementum.
1/7/2020,520,ldrydaleef@friendfeed.com,"BLACKROCK INTERNATIONAL, LTD.","Duis aliquam convallis nunc. Proin at turpis a pede posuere nonummy. Integer non velit. Donec diam neque, vestibulum eget, vulputate ut, ultrices vel, augue."
7/31/2019,521,earnaudeteg@goodreads.com,Park-Ohio Holdings Corp.,Morbi quis tortor id nulla ultrices aliquet.
4/9/2019,522,sroddieeh@dagondesign.com,"Nuveen Municipal Income Fund, Inc.",Duis consequat dui nec nisi volutpat eleifend.
4/25/2019,523,spollandei@sphinn.com,DCP Midstream LP,"Proin risus. Praesent lectus. Vestibulum quam sapien, varius ut, blandit non, interdum in, ante. Vestibulum ante ipsum primis in faucibus orci luctus et ultrices posuere cubilia Curae; Duis faucibus accumsan odio."
4/4/2019,524,btryej@geocities.jp,ABB Ltd,Duis aliquam convallis nunc.
5/25/2019,525,lbethellek@opera.com,"Gyrodyne , LLC",Fusce posuere felis sed lacus.
1/12/2020,526,scestardel@taobao.com,"Synthetic Fixed-Income Securities, Inc.",Fusce consequat. Nulla nisl.
4/16/2019,527,mpiddleem@cbc.ca,TransMontaigne Partners L.P.,"In est risus, auctor sed, tristique in, tempus sit amet, sem. Fusce consequat. Nulla nisl. Nunc nisl."
4/4/2019,528,aadneen@infoseek.co.jp,Investors Real Estate Trust,Quisque ut erat.
9/21/2019,529,sferridayeo@cocolog-nifty.com,"First Business Financial Services, Inc.","Donec quis orci eget orci vehicula condimentum. Curabitur in libero ut massa volutpat convallis. Morbi odio odio, elementum eu, interdum eu, tincidunt in, leo."
5/12/2019,530,jsealeep@senate.gov,Capital One Financial Corporation,In congue. Etiam justo. Etiam pretium iaculis justo. In hac habitasse platea dictumst.
12/28/2019,531,imateescueq@eventbrite.com,"Watsco, Inc.","Fusce congue, diam id ornare imperdiet, sapien urna pretium nisl, ut volutpat sapien arcu sed augue."
12/22/2019,532,dcunaher@weather.com,M III Acquisition Corp.,"Morbi odio odio, elementum eu, interdum eu, tincidunt in, leo. Maecenas pulvinar lobortis est. Phasellus sit amet erat."
2/13/2020,533,mdebeneditties@rambler.ru,Halcon Resources Corporation,Nulla nisl.
3/11/2020,534,dkieranet@t-online.de,Asia Pacific Wire & Cable Corporation Limited,"Maecenas rhoncus aliquam lacus. Morbi quis tortor id nulla ultrices aliquet. Maecenas leo odio, condimentum id, luctus nec, molestie sed, justo."
3/8/2020,535,tgiamettieu@columbia.edu,Medley LLC,"Quisque porta volutpat erat. Quisque erat eros, viverra eget, congue eget, semper rutrum, nulla. Nunc purus."
11/10/2019,536,smacandrewev@ebay.com,"CommerceHub, Inc.",Quisque ut erat. Curabitur gravida nisi at nibh. In hac habitasse platea dictumst.
6/4/2019,537,lhewew@blog.com,"Taubman Centers, Inc.",Nulla tempus. Vivamus in felis eu sapien cursus vestibulum. Proin eu mi. Nulla ac enim.
9/21/2019,538,sshoppeeex@examiner.com,TiGenix,Pellentesque eget nunc. Donec quis orci eget orci vehicula condimentum. Curabitur in libero ut massa volutpat convallis.
10/9/2019,539,rgaddieey@mozilla.com,vTv Therapeutics Inc.,In blandit ultrices enim.
2/12/2020,540,anazerez@seesaa.net,Fabrinet,"Cras pellentesque volutpat dui. Maecenas tristique, est et tempus semper, est quam pharetra magna, ac consequat metus sapien ut nunc. Vestibulum ante ipsum primis in faucibus orci luctus et ultrices posuere cubilia Curae; Mauris viverra diam vitae quam."
6/19/2019,541,pmeechanf0@ftc.gov,CME Group Inc.,"Mauris enim leo, rhoncus sed, vestibulum sit amet, cursus id, turpis. Integer aliquet, massa id lobortis convallis, tortor risus dapibus augue, vel accumsan tellus nisi eu orci. Mauris lacinia sapien quis libero. Nullam sit amet turpis elementum ligula vehicula consequat."
2/11/2020,542,crhubottomf1@slate.com,PartnerRe Ltd.,"Nunc rhoncus dui vel sem. Sed sagittis. Nam congue, risus semper porta volutpat, quam pede lobortis ligula, sit amet eleifend pede libero quis orci."
2/7/2020,543,gtidballf2@sun.com,Navios Maritime Partners LP,Morbi ut odio.
3/2/2020,544,cbalshenf3@zimbio.com,"Tahoe Resources, Inc.","Vivamus metus arcu, adipiscing molestie, hendrerit at, vulputate vitae, nisl. Aenean lectus. Pellentesque eget nunc. Donec quis orci eget orci vehicula condimentum."
4/29/2019,545,mstoecklef4@jugem.jp,"GWG Holdings, Inc",Donec posuere metus vitae ipsum. Aliquam non mauris. Morbi non lectus.
4/10/2019,546,nkempef5@nbcnews.com,"Primerica, Inc.","Curabitur at ipsum ac tellus semper interdum. Mauris ullamcorper purus sit amet nulla. Quisque arcu libero, rutrum ac, lobortis vel, dapibus at, diam."
6/9/2019,547,kdomelawf6@nifty.com,Compass Diversified Holdings,"Morbi odio odio, elementum eu, interdum eu, tincidunt in, leo."
2/7/2020,548,bdyballf7@gnu.org,"Ohr Pharmaceuticals, Inc.",Ut tellus.
1/1/2020,549,anichollsf8@phpbb.com,"Ascent Capital Group, Inc.",Morbi ut odio.
8/26/2019,550,btoffalof9@ted.com,Vanguard Russell 2000 ETF,Suspendisse accumsan tortor quis turpis. Sed ante. Vivamus tortor.
12/15/2019,551,rmcpikefa@narod.ru,Tsakos Energy Navigation Ltd,Aliquam erat volutpat. In congue.
10/3/2019,552,lhinchamfb@spiegel.de,Kingold Jewelry Inc.,Integer a nibh. In quis justo. Maecenas rhoncus aliquam lacus.
5/4/2019,553,ldederichfc@mapquest.com,Stantec Inc,Aliquam non mauris. Morbi non lectus.
1/20/2020,554,sfussellfd@google.fr,SPDR Dorsey Wright Fixed Income Allocation ETF,"Quisque arcu libero, rutrum ac, lobortis vel, dapibus at, diam. Nam tristique tortor eu pede."
11/30/2019,555,cchallensfe@newyorker.com,BlackRock Credit Allocation Income Trust,Nunc rhoncus dui vel sem. Sed sagittis.
3/24/2019,556,cpoonff@people.com.cn,BioAmber Inc.,Vivamus in felis eu sapien cursus vestibulum.
11/28/2019,557,rivanonkofg@buzzfeed.com,"Colony NorthStar, Inc.","Nullam orci pede, venenatis non, sodales sed, tincidunt eu, felis. Fusce posuere felis sed lacus. Morbi sem mauris, laoreet ut, rhoncus aliquet, pulvinar sed, nisl."
5/22/2019,558,mmenezesfh@woothemes.com,"Perfumania Holdings, Inc","Curabitur in libero ut massa volutpat convallis. Morbi odio odio, elementum eu, interdum eu, tincidunt in, leo. Maecenas pulvinar lobortis est. Phasellus sit amet erat."
12/11/2019,559,kheeleyfi@topsy.com,KeyCorp,"Quisque arcu libero, rutrum ac, lobortis vel, dapibus at, diam."
6/30/2019,560,dmaccartfj@economist.com,"Mid-America Apartment Communities, Inc.",Vivamus tortor. Duis mattis egestas metus. Aenean fermentum. Donec ut mauris eget massa tempor convallis.
12/4/2019,561,tgeorgotfk@hc360.com,"Texas Roadhouse, Inc.",Aliquam quis turpis eget elit sodales scelerisque. Mauris sit amet eros. Suspendisse accumsan tortor quis turpis. Sed ante.
5/25/2019,562,bhedgesfl@liveinternet.ru,Main Street Capital Corporation,Proin interdum mauris non ligula pellentesque ultrices. Phasellus id sapien in sapien iaculis congue.
6/16/2019,563,clidingtonfm@vk.com,Flaherty & Crumrine Preferred Securities Income Fund Inc,"Vestibulum ac est lacinia nisi venenatis tristique. Fusce congue, diam id ornare imperdiet, sapien urna pretium nisl, ut volutpat sapien arcu sed augue."
5/25/2019,564,adabsfn@bizjournals.com,PAR Technology Corporation,"Donec odio justo, sollicitudin ut, suscipit a, feugiat et, eros. Vestibulum ac est lacinia nisi venenatis tristique."
9/27/2019,565,bpouckfo@hugedomains.com,"Hartford Financial Services Group, Inc. (The)",Proin eu mi.
9/15/2019,566,jweinerfp@about.com,Northwest Natural Gas Company,Integer tincidunt ante vel ipsum. Praesent blandit lacinia erat.
11/16/2019,567,dlambswoodfq@acquirethisname.com,Restaurant Brands International Inc.,"Curabitur in libero ut massa volutpat convallis. Morbi odio odio, elementum eu, interdum eu, tincidunt in, leo. Maecenas pulvinar lobortis est."
6/1/2019,568,bplewmanfr@usnews.com,"First Solar, Inc.",Aenean lectus. Pellentesque eget nunc. Donec quis orci eget orci vehicula condimentum. Curabitur in libero ut massa volutpat convallis.
3/16/2020,569,npatterfieldfs@fotki.com,SemiLEDS Corporation,Integer ac leo. Pellentesque ultrices mattis odio. Donec vitae nisi.
11/27/2019,570,fsneddenft@utexas.edu,IRIDEX Corporation,Quisque ut erat. Curabitur gravida nisi at nibh.
1/28/2020,571,cchomleyfu@lycos.com,Assured Guaranty Ltd.,Duis mattis egestas metus. Aenean fermentum.
2/18/2020,572,msisslandfv@youtube.com,"MabVax Therapeutics Holdings, Inc.","Integer aliquet, massa id lobortis convallis, tortor risus dapibus augue, vel accumsan tellus nisi eu orci."
8/6/2019,573,gtapinfw@eventbrite.com,First Trust Senior Floating Rate 2022 Target Term Fund,Curabitur at ipsum ac tellus semper interdum.
2/28/2020,574,mstarrsfx@shinystat.com,Eaton Vance Corporation,"Nulla neque libero, convallis eget, eleifend luctus, ultricies eu, nibh. Quisque id justo sit amet sapien dignissim vestibulum."
5/5/2019,575,pcrosify@netlog.com,"NRG Yield, Inc.",In hac habitasse platea dictumst.
9/16/2019,576,cpittetfz@tinypic.com,ProShares UltraPro Short QQQ,"Mauris enim leo, rhoncus sed, vestibulum sit amet, cursus id, turpis. Integer aliquet, massa id lobortis convallis, tortor risus dapibus augue, vel accumsan tellus nisi eu orci. Mauris lacinia sapien quis libero."
8/6/2019,577,cperesg0@wsj.com,TransUnion,"Nullam orci pede, venenatis non, sodales sed, tincidunt eu, felis. Fusce posuere felis sed lacus. Morbi sem mauris, laoreet ut, rhoncus aliquet, pulvinar sed, nisl."
9/21/2019,578,kformieg1@marriott.com,Mitsubishi UFJ Financial Group Inc,Etiam pretium iaculis justo. In hac habitasse platea dictumst.
9/26/2019,579,adanslowg2@delicious.com,"MFA Financial, Inc.",Aliquam quis turpis eget elit sodales scelerisque. Mauris sit amet eros. Suspendisse accumsan tortor quis turpis. Sed ante.
4/15/2019,580,rlishmundg3@yelp.com,General Finance Corporation,"Pellentesque eget nunc. Donec quis orci eget orci vehicula condimentum. Curabitur in libero ut massa volutpat convallis. Morbi odio odio, elementum eu, interdum eu, tincidunt in, leo."
2/18/2020,581,upogsong4@prweb.com,Tuesday Morning Corp.,Nulla suscipit ligula in lacus. Curabitur at ipsum ac tellus semper interdum.
3/8/2020,582,tsatting5@is.gd,Pacific Coast Oil Trust,"Donec semper sapien a libero. Nam dui. Proin leo odio, porttitor id, consequat in, consequat ut, nulla. Sed accumsan felis."
1/14/2020,583,tbridgelandg6@google.com.hk,"Tile Shop Hldgs, Inc.","Nulla nisl. Nunc nisl. Duis bibendum, felis sed interdum venenatis, turpis enim blandit mi, in porttitor pede justo eu massa."
9/28/2019,584,kellereyg7@google.cn,Investors Real Estate Trust,Phasellus in felis.
12/10/2019,585,sbickerdykeg8@netlog.com,JMP Group LLC,Mauris sit amet eros.
7/9/2019,586,ngilberthorpeg9@google.cn,Timken Company (The),Morbi quis tortor id nulla ultrices aliquet.
6/1/2019,587,llightningga@google.co.jp,"Himax Technologies, Inc.",Maecenas tincidunt lacus at velit. Vivamus vel nulla eget eros elementum pellentesque.
6/28/2019,588,lwolfartgb@smugmug.com,EMCORE Corporation,Aliquam non mauris. Morbi non lectus.
5/7/2019,589,jannandalegc@washingtonpost.com,Morgan Stanley,Sed vel enim sit amet nunc viverra dapibus. Nulla suscipit ligula in lacus. Curabitur at ipsum ac tellus semper interdum. Mauris ullamcorper purus sit amet nulla.
12/27/2019,590,siacovinigd@discovery.com,"Commerce Bancshares, Inc.","Vivamus metus arcu, adipiscing molestie, hendrerit at, vulputate vitae, nisl. Aenean lectus."
3/21/2020,591,areglarge@cocolog-nifty.com,EXCO Resources NL,In sagittis dui vel nisl. Duis ac nibh.
12/4/2019,592,fpiengf@a8.net,"China Fund, Inc. (The)","Nulla nisl. Nunc nisl. Duis bibendum, felis sed interdum venenatis, turpis enim blandit mi, in porttitor pede justo eu massa. Donec dapibus."
3/28/2019,593,chatchettegg@oracle.com,Vistra Energy Corp.,Aenean auctor gravida sem. Praesent id massa id nisl venenatis lacinia.
2/5/2020,594,kwestnedgegh@amazon.co.jp,Pure Cycle Corporation,"In hac habitasse platea dictumst. Morbi vestibulum, velit id pretium iaculis, diam erat fermentum justo, nec condimentum neque sapien placerat ante."
8/3/2019,595,jhalbardgi@trellian.com,"Eagle Bancorp, Inc.","In est risus, auctor sed, tristique in, tempus sit amet, sem."
11/5/2019,596,kspatarogj@bbc.co.uk,Grupo Financiero Santander Mexico S.A. B. de C.V.,Integer tincidunt ante vel ipsum. Praesent blandit lacinia erat. Vestibulum sed magna at nunc commodo placerat. Praesent blandit.
3/2/2020,597,msermangk@wikispaces.com,THL Credit Senior Loan Fund,"In sagittis dui vel nisl. Duis ac nibh. Fusce lacus purus, aliquet at, feugiat non, pretium quis, lectus."
7/7/2019,598,cplampeyngl@bbb.org,Senior Housing Properties Trust,Vestibulum rutrum rutrum neque. Aenean auctor gravida sem.
5/18/2019,599,nmiddlemassgm@harvard.edu,PAVmed Inc.,"In sagittis dui vel nisl. Duis ac nibh. Fusce lacus purus, aliquet at, feugiat non, pretium quis, lectus. Suspendisse potenti."
3/12/2020,600,apuckringn@gmpg.org,Consolidated Water Co. Ltd.,"Proin at turpis a pede posuere nonummy. Integer non velit. Donec diam neque, vestibulum eget, vulputate ut, ultrices vel, augue. Vestibulum ante ipsum primis in faucibus orci luctus et ultrices posuere cubilia Curae; Donec pharetra, magna vestibulum aliquet ultrices, erat tortor sollicitudin mi, sit amet lobortis sapien sapien non mi."
11/17/2019,601,dcorbetgo@ehow.com,"ABIOMED, Inc.",Nulla tempus. Vivamus in felis eu sapien cursus vestibulum.
3/17/2020,602,jbodygp@omniture.com,Oasis Petroleum Inc.,"Morbi ut odio. Cras mi pede, malesuada in, imperdiet et, commodo vulputate, justo. In blandit ultrices enim."
3/26/2019,603,hshippgq@umich.edu,NetSol Technologies Inc.,Nulla nisl.
2/12/2020,604,iloniegr@51.la,"Carver Bancorp, Inc.",Integer tincidunt ante vel ipsum. Praesent blandit lacinia erat. Vestibulum sed magna at nunc commodo placerat. Praesent blandit.
2/9/2020,605,jpitrelligs@behance.net,Guggenheim Enhanced Equity Income Fund,Integer ac neque.
4/29/2019,606,mlynasgt@reference.com,"Aberdeen Singapore Fund, Inc.",Duis mattis egestas metus. Aenean fermentum.
12/12/2019,607,aastlettgu@toplist.cz,"PolarityTE, Inc.","In est risus, auctor sed, tristique in, tempus sit amet, sem. Fusce consequat. Nulla nisl. Nunc nisl."
8/27/2019,608,hbirchenheadgv@go.com,"Novan, Inc.",Ut at dolor quis odio consequat varius.
3/17/2020,609,crobygw@comcast.net,Petroleo Brasileiro S.A.- Petrobras,Phasellus in felis. Donec semper sapien a libero. Nam dui.
11/27/2019,610,iantoniougx@discovery.com,Horizon Bancorp (IN),"Quisque erat eros, viverra eget, congue eget, semper rutrum, nulla."
4/3/2019,611,lsanziogy@mtv.com,"Chegg, Inc.",Nulla justo. Aliquam quis turpis eget elit sodales scelerisque. Mauris sit amet eros. Suspendisse accumsan tortor quis turpis.
8/12/2019,612,tbaskwellgz@biblegateway.com,AllianceBernstein Holding L.P.,"Duis ac nibh. Fusce lacus purus, aliquet at, feugiat non, pretium quis, lectus. Suspendisse potenti."
5/2/2019,613,amcmillamh0@harvard.edu,"Genesee & Wyoming, Inc.",Maecenas pulvinar lobortis est. Phasellus sit amet erat.
10/23/2019,614,dkantorh1@wikimedia.org,"Boston Properties, Inc.",Etiam vel augue. Vestibulum rutrum rutrum neque. Aenean auctor gravida sem. Praesent id massa id nisl venenatis lacinia.
5/31/2019,615,wrobkenh2@slideshare.net,"Blackrock MuniEnhanced Fund, Inc.",Etiam pretium iaculis justo.
9/27/2019,616,kferronelh3@weibo.com,"Colony NorthStar, Inc.",Pellentesque viverra pede ac diam.
8/23/2019,617,epellmanh4@cloudflare.com,Kansas City Southern,"Nulla tellus. In sagittis dui vel nisl. Duis ac nibh. Fusce lacus purus, aliquet at, feugiat non, pretium quis, lectus."
3/21/2020,618,rcockshotth5@independent.co.uk,"Savara, Inc.","Aliquam augue quam, sollicitudin vitae, consectetuer eget, rutrum at, lorem. Integer tincidunt ante vel ipsum. Praesent blandit lacinia erat. Vestibulum sed magna at nunc commodo placerat."
7/31/2019,619,jwoolseyh6@businesswire.com,"Scripps Networks Interactive, Inc","Proin eu mi. Nulla ac enim. In tempor, turpis nec euismod scelerisque, quam turpis adipiscing lorem, vitae mattis nibh ligula nec sem. Duis aliquam convallis nunc."
1/26/2020,620,tfritschelh7@wiley.com,"BWX Technologies, Inc.","Vivamus vestibulum sagittis sapien. Cum sociis natoque penatibus et magnis dis parturient montes, nascetur ridiculus mus. Etiam vel augue."
4/24/2019,621,kcosinh8@chronoengine.com,"West Marine, Inc.","Proin interdum mauris non ligula pellentesque ultrices. Phasellus id sapien in sapien iaculis congue. Vivamus metus arcu, adipiscing molestie, hendrerit at, vulputate vitae, nisl."
