fec,idticket,correo,titulo,descripcion
3/15/2020,622,rpedrocchih9@mayoclinic.com,National Energy Services Reunited Corp.,"In blandit ultrices enim. Lorem ipsum dolor sit amet, consectetuer adipiscing elit. Proin interdum mauris non ligula pellentesque ultrices. Phasellus id sapien in sapien iaculis congue."
7/1/2019,623,lguideraha@google.ru,ProShares UltraShort Nasdaq Biotechnology,"Aliquam augue quam, sollicitudin vitae, consectetuer eget, rutrum at, lorem. Integer tincidunt ante vel ipsum."
6/27/2019,624,rneliganhb@senate.gov,Public Storage,"In tempor, turpis nec euismod scelerisque, quam turpis adipiscing lorem, vitae mattis nibh ligula nec sem."
7/26/2019,625,rharlinhc@dedecms.com,Digimarc Corporation,Fusce consequat. Nulla nisl. Nunc nisl.
9/30/2019,626,rdrachehd@bloglovin.com,Petrobras Argentina S.A.,"Praesent blandit. Nam nulla. Integer pede justo, lacinia eget, tincidunt eget, tempus vel, pede. Morbi porttitor lorem id ligula."
3/25/2019,627,dfindinghe@msn.com,"Delta Air Lines, Inc.",Donec posuere metus vitae ipsum. Aliquam non mauris. Morbi non lectus. Aliquam sit amet diam in magna bibendum imperdiet.
3/30/2019,628,icrowsonhf@umn.edu,"NN, Inc.","Suspendisse ornare consequat lectus. In est risus, auctor sed, tristique in, tempus sit amet, sem. Fusce consequat. Nulla nisl."
2/17/2020,629,mpoteshg@tiny.cc,McEwen Mining Inc.,"Nullam orci pede, venenatis non, sodales sed, tincidunt eu, felis. Fusce posuere felis sed lacus. Morbi sem mauris, laoreet ut, rhoncus aliquet, pulvinar sed, nisl."
3/17/2020,630,sfrowdhh@yahoo.com,Semiconductor  Manufacturing International Corporation,Pellentesque eget nunc.
2/28/2020,631,amoncktonhi@nba.com,"Consolidated Communications Holdings, Inc.",Morbi a ipsum.
7/25/2019,632,dlabitthj@mapquest.com,"Waterstone Financial, Inc.",Mauris sit amet eros.
5/4/2019,633,barmalhk@qq.com,"Sunshine Bancorp, Inc.","Quisque erat eros, viverra eget, congue eget, semper rutrum, nulla. Nunc purus."
7/15/2019,634,wdunanhl@oakley.com,"Nuveen California Municipal Value Fund, Inc.",Aliquam erat volutpat. In congue.
11/5/2019,635,rgrushinhm@paypal.com,Modern Media Acquisition Corp.,Aliquam erat volutpat. In congue. Etiam justo. Etiam pretium iaculis justo.
12/14/2019,636,twillmanhn@opera.com,"Hamilton Bancorp, Inc.",Duis consequat dui nec nisi volutpat eleifend. Donec ut dolor.
10/30/2019,637,lkeinratho@sogou.com,"EastGroup Properties, Inc.",Sed ante. Vivamus tortor.
7/6/2019,638,nburchfieldhp@twitter.com,Vanguard Russell 1000 ETF,"Nam nulla. Integer pede justo, lacinia eget, tincidunt eget, tempus vel, pede."
7/21/2019,639,dmacclurehq@dedecms.com,"Schmitt Industries, Inc.",Pellentesque ultrices mattis odio.
3/7/2020,640,ldiffleyhr@canalblog.com,"Energy Focus, Inc.","Aliquam sit amet diam in magna bibendum imperdiet. Nullam orci pede, venenatis non, sodales sed, tincidunt eu, felis. Fusce posuere felis sed lacus."
12/8/2019,641,aturfushs@microsoft.com,IZEA Inc.,"Vivamus vestibulum sagittis sapien. Cum sociis natoque penatibus et magnis dis parturient montes, nascetur ridiculus mus."
9/21/2019,642,sjirzikht@yahoo.com,"Houlihan Lokey, Inc.",In quis justo. Maecenas rhoncus aliquam lacus. Morbi quis tortor id nulla ultrices aliquet.
7/17/2019,643,ilodovichihu@abc.net.au,Blackrock MuniYield Pennsylvania Quality Fund,Sed ante.
7/17/2019,644,emctavishhv@weibo.com,Diebold Nixdorf Incorporated,"Morbi sem mauris, laoreet ut, rhoncus aliquet, pulvinar sed, nisl. Nunc rhoncus dui vel sem. Sed sagittis."
6/5/2019,645,kdigwoodhw@infoseek.co.jp,"First Interstate BancSystem, Inc.","Vestibulum quam sapien, varius ut, blandit non, interdum in, ante. Vestibulum ante ipsum primis in faucibus orci luctus et ultrices posuere cubilia Curae; Duis faucibus accumsan odio. Curabitur convallis. Duis consequat dui nec nisi volutpat eleifend."
3/13/2020,646,omycrofthx@etsy.com,"FuelCell Energy, Inc.",Pellentesque at nulla. Suspendisse potenti.
4/25/2019,647,vinsworthhy@mail.ru,W.R. Berkley Corporation,"Nulla neque libero, convallis eget, eleifend luctus, ultricies eu, nibh. Quisque id justo sit amet sapien dignissim vestibulum. Vestibulum ante ipsum primis in faucibus orci luctus et ultrices posuere cubilia Curae; Nulla dapibus dolor vel est."
11/11/2019,648,mpeckhamhz@g.co,Ares Commercial Real Estate Corporation,In congue. Etiam justo.
7/1/2019,649,malflatti0@wordpress.com,Macro Bank Inc.,Integer non velit.
12/21/2019,650,scowdeni1@people.com.cn,BlackRock Strategic Municipal Trust Inc. (The),"Nam congue, risus semper porta volutpat, quam pede lobortis ligula, sit amet eleifend pede libero quis orci."
11/12/2019,651,ntalli2@sina.com.cn,"Monolithic Power Systems, Inc.","Phasellus in felis. Donec semper sapien a libero. Nam dui. Proin leo odio, porttitor id, consequat in, consequat ut, nulla."
5/6/2019,652,rdohmeri3@de.vu,"Wheeler Real Estate Investment Trust, Inc.",Duis bibendum. Morbi non quam nec dui luctus rutrum. Nulla tellus. In sagittis dui vel nisl.
5/16/2019,653,dchadburni4@addtoany.com,Gabelli Utility Trust (The),"Cum sociis natoque penatibus et magnis dis parturient montes, nascetur ridiculus mus. Vivamus vestibulum sagittis sapien. Cum sociis natoque penatibus et magnis dis parturient montes, nascetur ridiculus mus. Etiam vel augue."
8/14/2019,654,stimckei5@xrea.com,"Madrigal Pharmaceuticals, Inc.",Pellentesque eget nunc. Donec quis orci eget orci vehicula condimentum.
9/4/2019,655,tmcspirroni6@yelp.com,"Anthem, Inc.","In sagittis dui vel nisl. Duis ac nibh. Fusce lacus purus, aliquet at, feugiat non, pretium quis, lectus."
1/31/2020,656,aoverilli7@amazon.co.jp,"PS Business Parks, Inc.",Vestibulum ante ipsum primis in faucibus orci luctus et ultrices posuere cubilia Curae; Duis faucibus accumsan odio. Curabitur convallis. Duis consequat dui nec nisi volutpat eleifend. Donec ut dolor.
3/29/2019,657,dspedronii8@deviantart.com,"Southern First Bancshares, Inc.","Curabitur in libero ut massa volutpat convallis. Morbi odio odio, elementum eu, interdum eu, tincidunt in, leo."
7/17/2019,658,arattenburyi9@businesswire.com,"Twin Disc, Incorporated","Cras in purus eu magna vulputate luctus. Cum sociis natoque penatibus et magnis dis parturient montes, nascetur ridiculus mus. Vivamus vestibulum sagittis sapien."
8/18/2019,659,vtolandia@naver.com,"Stemline Therapeutics, Inc.",Etiam vel augue. Vestibulum rutrum rutrum neque.
1/23/2020,660,lfoxenib@technorati.com,"FireEye, Inc.",Sed ante.
2/22/2020,661,mswinnic@buzzfeed.com,Triangle Capital Corporation,Duis ac nibh.
3/16/2020,662,iduxburyid@apple.com,"ATN International, Inc.",Donec posuere metus vitae ipsum. Aliquam non mauris. Morbi non lectus.
6/29/2019,663,gdanie@github.io,Dollar General Corporation,Duis mattis egestas metus.
12/17/2019,664,kbertheletif@devhub.com,Superconductor Technologies Inc.,"Nam nulla. Integer pede justo, lacinia eget, tincidunt eget, tempus vel, pede."
11/21/2019,665,hrufflerig@dagondesign.com,Chicago Bridge & Iron Company N.V.,"Sed sagittis. Nam congue, risus semper porta volutpat, quam pede lobortis ligula, sit amet eleifend pede libero quis orci. Nullam molestie nibh in lectus. Pellentesque at nulla."
3/1/2020,666,hstockenih@icq.com,Veeva Systems Inc.,"Duis consequat dui nec nisi volutpat eleifend. Donec ut dolor. Morbi vel lectus in quam fringilla rhoncus. Mauris enim leo, rhoncus sed, vestibulum sit amet, cursus id, turpis."
5/28/2019,667,mbelfii@aboutads.info,Regulus Therapeutics Inc.,Curabitur gravida nisi at nibh. In hac habitasse platea dictumst.
1/8/2020,668,jboylundij@surveymonkey.com,Advantage Oil & Gas Ltd,Vestibulum rutrum rutrum neque. Aenean auctor gravida sem. Praesent id massa id nisl venenatis lacinia.
5/30/2019,669,dbrambillik@google.ru,TAT Technologies Ltd.,"Duis bibendum, felis sed interdum venenatis, turpis enim blandit mi, in porttitor pede justo eu massa. Donec dapibus. Duis at velit eu est congue elementum. In hac habitasse platea dictumst."
11/23/2019,670,kadolthineil@free.fr,Colonial Investment Grade Municipal Trust,Aenean lectus. Pellentesque eget nunc. Donec quis orci eget orci vehicula condimentum. Curabitur in libero ut massa volutpat convallis.
12/27/2019,671,ochominskiim@pagesperso-orange.fr,PIMCO California Municipal Income Fund,Donec ut mauris eget massa tempor convallis.
6/29/2019,672,vroughanin@goo.gl,B.O.S. Better Online Solutions,Vestibulum sed magna at nunc commodo placerat. Praesent blandit.
12/13/2019,673,bbridleio@parallels.com,"Columbia Property Trust, Inc.","Lorem ipsum dolor sit amet, consectetuer adipiscing elit. Proin risus. Praesent lectus."
10/16/2019,674,esnoadip@oracle.com,vTv Therapeutics Inc.,"Pellentesque viverra pede ac diam. Cras pellentesque volutpat dui. Maecenas tristique, est et tempus semper, est quam pharetra magna, ac consequat metus sapien ut nunc."
11/24/2019,675,bmatterdaceiq@live.com,NewJersey Resources Corporation,In quis justo. Maecenas rhoncus aliquam lacus.
3/12/2020,676,mmunghamir@berkeley.edu,Macquarie/First Trust Global,Morbi porttitor lorem id ligula.
12/5/2019,677,mcardenosais@dagondesign.com,CSI Compressco LP,"Donec odio justo, sollicitudin ut, suscipit a, feugiat et, eros. Vestibulum ac est lacinia nisi venenatis tristique."
1/8/2020,678,ndominikit@google.co.jp,"CBIZ, Inc.","Fusce posuere felis sed lacus. Morbi sem mauris, laoreet ut, rhoncus aliquet, pulvinar sed, nisl."
3/3/2020,679,cbummfreyiu@hexun.com,Proshares UltraPro Nasdaq Biotechnology,"Nam ultrices, libero non mattis pulvinar, nulla pede ullamcorper augue, a suscipit nulla elit ac nulla."
5/11/2019,680,gvenniv@barnesandnoble.com,"Winnebago Industries, Inc.","Vivamus metus arcu, adipiscing molestie, hendrerit at, vulputate vitae, nisl. Aenean lectus. Pellentesque eget nunc. Donec quis orci eget orci vehicula condimentum."
3/25/2019,681,jpalumboiw@ftc.gov,"Rockwell Medical, Inc.",Nullam varius. Nulla facilisi.
12/18/2019,682,ltescheix@nyu.edu,STORE Capital Corporation,Nulla ut erat id mauris vulputate elementum. Nullam varius. Nulla facilisi.
7/21/2019,683,zmcinteeiy@cloudflare.com,"Niagara Mohawk Holdings, Inc.",Nullam molestie nibh in lectus.
10/18/2019,684,alambotiz@vk.com,"Kingstone Companies, Inc","Phasellus id sapien in sapien iaculis congue. Vivamus metus arcu, adipiscing molestie, hendrerit at, vulputate vitae, nisl. Aenean lectus. Pellentesque eget nunc."
8/5/2019,685,jpotburyj0@webeden.co.uk,Double Eagle Acquisition Corp.,Mauris sit amet eros. Suspendisse accumsan tortor quis turpis. Sed ante. Vivamus tortor.
7/14/2019,686,rlinsayj1@uol.com.br,Gladstone Land Corporation,Proin interdum mauris non ligula pellentesque ultrices.
12/29/2019,687,fgalletyj2@fema.gov,Kraton Corporation,"Quisque arcu libero, rutrum ac, lobortis vel, dapibus at, diam. Nam tristique tortor eu pede."
8/26/2019,688,fgoldenj3@wordpress.com,"StarTek, Inc.","Vivamus vel nulla eget eros elementum pellentesque. Quisque porta volutpat erat. Quisque erat eros, viverra eget, congue eget, semper rutrum, nulla. Nunc purus."
3/19/2020,689,bpachtaj4@ftc.gov,Vanguard Global ex-U.S. Real Estate ETF,Cras non velit nec nisi vulputate nonummy. Maecenas tincidunt lacus at velit. Vivamus vel nulla eget eros elementum pellentesque.
7/18/2019,690,wrandlesj5@ox.ac.uk,Hardinge Inc.,"Donec odio justo, sollicitudin ut, suscipit a, feugiat et, eros. Vestibulum ac est lacinia nisi venenatis tristique. Fusce congue, diam id ornare imperdiet, sapien urna pretium nisl, ut volutpat sapien arcu sed augue."
4/13/2019,691,dvernazzaj6@free.fr,"Computer Task Group, Incorporated",Donec dapibus.
6/1/2019,692,dgraysmarkj7@unicef.org,"Century Bancorp, Inc.","Nam nulla. Integer pede justo, lacinia eget, tincidunt eget, tempus vel, pede."
12/11/2019,693,bdarreej8@fc2.com,Protective Life Corporation,Vestibulum ante ipsum primis in faucibus orci luctus et ultrices posuere cubilia Curae; Mauris viverra diam vitae quam.
3/19/2020,694,aaynsleyj9@lulu.com,"Allied Motion Technologies, Inc.",Donec dapibus. Duis at velit eu est congue elementum.
4/26/2019,695,mleggisja@digg.com,"Heartland Express, Inc.",Mauris sit amet eros.
11/4/2019,696,lreadheadjb@bloglines.com,STRATS Trust,"Vestibulum ante ipsum primis in faucibus orci luctus et ultrices posuere cubilia Curae; Donec pharetra, magna vestibulum aliquet ultrices, erat tortor sollicitudin mi, sit amet lobortis sapien sapien non mi. Integer ac neque."
1/19/2020,697,ssemechikjc@smh.com.au,"P & F Industries, Inc.",Vestibulum ante ipsum primis in faucibus orci luctus et ultrices posuere cubilia Curae; Duis faucibus accumsan odio.
12/23/2019,698,lstronackjd@unc.edu,The GDL Fund,"Vestibulum ante ipsum primis in faucibus orci luctus et ultrices posuere cubilia Curae; Donec pharetra, magna vestibulum aliquet ultrices, erat tortor sollicitudin mi, sit amet lobortis sapien sapien non mi."
6/21/2019,699,smettetalje@i2i.jp,Ark Restaurants Corp.,"Lorem ipsum dolor sit amet, consectetuer adipiscing elit. Proin risus."
2/11/2020,700,sgeekiejf@is.gd,"Arista Networks, Inc.",Morbi a ipsum.
2/23/2020,701,hsiwardjg@psu.edu,"Conn's, Inc.",Morbi a ipsum.
12/26/2019,702,emcentagartjh@wordpress.com,Unico American Corporation,Praesent id massa id nisl venenatis lacinia.
9/1/2019,703,llawlessji@blogs.com,First Trust NASDAQ-100- Technology Index Fund,Vestibulum sed magna at nunc commodo placerat.
2/6/2020,704,sdesseinejj@engadget.com,"FLIR Systems, Inc.",Etiam vel augue. Vestibulum rutrum rutrum neque. Aenean auctor gravida sem. Praesent id massa id nisl venenatis lacinia.
11/5/2019,705,sribbensjk@artisteer.com,"Kingstone Companies, Inc",Ut tellus. Nulla ut erat id mauris vulputate elementum. Nullam varius. Nulla facilisi.
10/3/2019,706,jbrinklerjl@gnu.org,"Provident Bancorp, Inc.",Nulla tempus. Vivamus in felis eu sapien cursus vestibulum. Proin eu mi. Nulla ac enim.
12/16/2019,707,cboornjm@yellowbook.com,"Gabelli Equity Trust, Inc. (The)",In blandit ultrices enim.
8/21/2019,708,ckynforthjn@bloglovin.com,MainStay DefinedTerm Municipal Opportunities Fund,"Nulla neque libero, convallis eget, eleifend luctus, ultricies eu, nibh. Quisque id justo sit amet sapien dignissim vestibulum. Vestibulum ante ipsum primis in faucibus orci luctus et ultrices posuere cubilia Curae; Nulla dapibus dolor vel est. Donec odio justo, sollicitudin ut, suscipit a, feugiat et, eros."
11/14/2019,709,bmaccartneyjo@homestead.com,"Manitex International, Inc.",Sed vel enim sit amet nunc viverra dapibus. Nulla suscipit ligula in lacus.
10/8/2019,710,ogerredjp@admin.ch,Ophthotech Corporation,"Donec diam neque, vestibulum eget, vulputate ut, ultrices vel, augue. Vestibulum ante ipsum primis in faucibus orci luctus et ultrices posuere cubilia Curae; Donec pharetra, magna vestibulum aliquet ultrices, erat tortor sollicitudin mi, sit amet lobortis sapien sapien non mi. Integer ac neque. Duis bibendum."
8/16/2019,711,ghardestyjq@weibo.com,"Blueknight Energy Partners L.P., L.L.C.","Nulla neque libero, convallis eget, eleifend luctus, ultricies eu, nibh. Quisque id justo sit amet sapien dignissim vestibulum. Vestibulum ante ipsum primis in faucibus orci luctus et ultrices posuere cubilia Curae; Nulla dapibus dolor vel est."
8/23/2019,712,mbarksjr@sun.com,"Manhattan Bridge Capital, Inc","In hac habitasse platea dictumst. Aliquam augue quam, sollicitudin vitae, consectetuer eget, rutrum at, lorem. Integer tincidunt ante vel ipsum."
8/27/2019,713,skennellyjs@scribd.com,Advanced Accelerator Applications S.A.,"Nunc rhoncus dui vel sem. Sed sagittis. Nam congue, risus semper porta volutpat, quam pede lobortis ligula, sit amet eleifend pede libero quis orci."
2/18/2020,714,nworsnapjt@toplist.cz,"Energy Transfer Equity, L.P.","Suspendisse potenti. Cras in purus eu magna vulputate luctus. Cum sociis natoque penatibus et magnis dis parturient montes, nascetur ridiculus mus. Vivamus vestibulum sagittis sapien."
12/17/2019,715,afilewoodju@walmart.com,"Skyworks Solutions, Inc.",Duis bibendum. Morbi non quam nec dui luctus rutrum.
2/20/2020,716,bholbiejv@51.la,"Pearson, Plc","Vivamus metus arcu, adipiscing molestie, hendrerit at, vulputate vitae, nisl. Aenean lectus."
6/9/2019,717,cchuggjw@state.gov,Griffon Corporation,Praesent blandit.
9/4/2019,718,hvaneschijx@redcross.org,"CACI International, Inc.",Nulla justo. Aliquam quis turpis eget elit sodales scelerisque. Mauris sit amet eros.
7/23/2019,719,ddaglishjy@abc.net.au,Nuveen Global High Income Fund,"In tempor, turpis nec euismod scelerisque, quam turpis adipiscing lorem, vitae mattis nibh ligula nec sem."
8/12/2019,720,ndjurkovicjz@mysql.com,First Trust New Opportunities MLP & Energy Fund,Suspendisse accumsan tortor quis turpis. Sed ante. Vivamus tortor. Duis mattis egestas metus.
8/14/2019,721,acantillionk0@naver.com,Viacom Inc.,"Donec odio justo, sollicitudin ut, suscipit a, feugiat et, eros. Vestibulum ac est lacinia nisi venenatis tristique. Fusce congue, diam id ornare imperdiet, sapien urna pretium nisl, ut volutpat sapien arcu sed augue."
9/14/2019,722,astanlickk1@hud.gov,Federal Realty Investment Trust,"Maecenas tristique, est et tempus semper, est quam pharetra magna, ac consequat metus sapien ut nunc. Vestibulum ante ipsum primis in faucibus orci luctus et ultrices posuere cubilia Curae; Mauris viverra diam vitae quam."
10/13/2019,723,nhunstonek2@macromedia.com,"HSN, Inc.",Pellentesque eget nunc. Donec quis orci eget orci vehicula condimentum.
1/9/2020,724,cpickerink3@cocolog-nifty.com,E.W. Scripps Company (The),"Lorem ipsum dolor sit amet, consectetuer adipiscing elit. Proin interdum mauris non ligula pellentesque ultrices. Phasellus id sapien in sapien iaculis congue. Vivamus metus arcu, adipiscing molestie, hendrerit at, vulputate vitae, nisl."
8/8/2019,725,bmccaughank4@4shared.com,La Quinta Holdings Inc.,"Quisque erat eros, viverra eget, congue eget, semper rutrum, nulla."
2/21/2020,726,tvauterk5@delicious.com,"Prudential Global Short Duration High Yield Fund, Inc.","Pellentesque ultrices mattis odio. Donec vitae nisi. Nam ultrices, libero non mattis pulvinar, nulla pede ullamcorper augue, a suscipit nulla elit ac nulla."
4/21/2019,727,jsexk6@nhs.uk,"Fuwei Films (Holdings) Co., Ltd.","Duis ac nibh. Fusce lacus purus, aliquet at, feugiat non, pretium quis, lectus."
6/5/2019,728,cbellingerk7@guardian.co.uk,"Marathon Patent Group, Inc.",Vestibulum ante ipsum primis in faucibus orci luctus et ultrices posuere cubilia Curae; Duis faucibus accumsan odio.
1/3/2020,729,aheapek8@desdev.cn,Credit Suisse Group,Donec quis orci eget orci vehicula condimentum. Curabitur in libero ut massa volutpat convallis.
10/25/2019,730,fkerbyk9@photobucket.com,Cott Corporation,Integer non velit.
4/11/2019,731,mcuddihyka@freewebs.com,Western Asset Corporate Loan Fund Inc,"Maecenas tincidunt lacus at velit. Vivamus vel nulla eget eros elementum pellentesque. Quisque porta volutpat erat. Quisque erat eros, viverra eget, congue eget, semper rutrum, nulla."
8/26/2019,732,rcleatherowkb@exblog.jp,"Gabelli Equity Trust, Inc. (The)","Mauris ullamcorper purus sit amet nulla. Quisque arcu libero, rutrum ac, lobortis vel, dapibus at, diam."
12/16/2019,733,mmackelworthkc@ehow.com,"Skechers U.S.A., Inc.",Fusce consequat. Nulla nisl.
10/17/2019,734,jnardrupkd@mit.edu,BSQUARE Corporation,"Aliquam sit amet diam in magna bibendum imperdiet. Nullam orci pede, venenatis non, sodales sed, tincidunt eu, felis. Fusce posuere felis sed lacus. Morbi sem mauris, laoreet ut, rhoncus aliquet, pulvinar sed, nisl."
11/28/2019,735,bkitchersideke@slideshare.net,Seacoast Banking Corporation of Florida,Cras non velit nec nisi vulputate nonummy. Maecenas tincidunt lacus at velit. Vivamus vel nulla eget eros elementum pellentesque.
1/5/2020,736,lheughkf@fda.gov,"Isramco, Inc.","Lorem ipsum dolor sit amet, consectetuer adipiscing elit."
3/14/2020,737,mstubbingskg@51.la,"Endocyte, Inc.","Cras mi pede, malesuada in, imperdiet et, commodo vulputate, justo. In blandit ultrices enim. Lorem ipsum dolor sit amet, consectetuer adipiscing elit."
6/3/2019,738,bgoodwinkh@360.cn,"Universal Logistics Holdings, Inc.","Nunc rhoncus dui vel sem. Sed sagittis. Nam congue, risus semper porta volutpat, quam pede lobortis ligula, sit amet eleifend pede libero quis orci."
6/26/2019,739,aharcaseki@live.com,ClearBridge Energy MLP Fund Inc.,"Maecenas tristique, est et tempus semper, est quam pharetra magna, ac consequat metus sapien ut nunc. Vestibulum ante ipsum primis in faucibus orci luctus et ultrices posuere cubilia Curae; Mauris viverra diam vitae quam. Suspendisse potenti."
8/19/2019,740,ccokerkj@slate.com,Pimco Income Opportunity Fund,"Donec vitae nisi. Nam ultrices, libero non mattis pulvinar, nulla pede ullamcorper augue, a suscipit nulla elit ac nulla."
1/22/2020,741,upikesleykk@bandcamp.com,"IES Holdings, Inc.","In est risus, auctor sed, tristique in, tempus sit amet, sem. Fusce consequat. Nulla nisl."
3/3/2020,742,bmateescukl@t.co,"Aqua America, Inc.","Morbi ut odio. Cras mi pede, malesuada in, imperdiet et, commodo vulputate, justo. In blandit ultrices enim. Lorem ipsum dolor sit amet, consectetuer adipiscing elit."
4/11/2019,743,dyukhnevichkm@fastcompany.com,"CenterState Banks, Inc.","Duis ac nibh. Fusce lacus purus, aliquet at, feugiat non, pretium quis, lectus. Suspendisse potenti. In eleifend quam a odio."
6/27/2019,744,umatantsevkn@posterous.com,"A V Homes, Inc.","Duis aliquam convallis nunc. Proin at turpis a pede posuere nonummy. Integer non velit. Donec diam neque, vestibulum eget, vulputate ut, ultrices vel, augue."
8/11/2019,745,cruoffko@about.me,"China Jo-Jo Drugstores, Inc.",Ut tellus. Nulla ut erat id mauris vulputate elementum. Nullam varius. Nulla facilisi.
2/5/2020,746,mlatorekp@icio.us,Blackrock Municipal 2020 Term Trust,Mauris sit amet eros. Suspendisse accumsan tortor quis turpis. Sed ante. Vivamus tortor.
12/1/2019,747,gmcterrykq@go.com,"Akorn, Inc.","In tempor, turpis nec euismod scelerisque, quam turpis adipiscing lorem, vitae mattis nibh ligula nec sem. Duis aliquam convallis nunc. Proin at turpis a pede posuere nonummy. Integer non velit."
5/31/2019,748,msuttiekr@over-blog.com,"Diamond Offshore Drilling, Inc.",Morbi ut odio.
10/13/2019,749,ksimonnetks@ucoz.ru,Galmed Pharmaceuticals Ltd.,In hac habitasse platea dictumst.
5/4/2019,750,rlindemankt@google.fr,"Viking Therapeutics, Inc.","Vivamus metus arcu, adipiscing molestie, hendrerit at, vulputate vitae, nisl. Aenean lectus."
4/29/2019,751,jhortopku@plala.or.jp,General Electric Company,"Donec vitae nisi. Nam ultrices, libero non mattis pulvinar, nulla pede ullamcorper augue, a suscipit nulla elit ac nulla. Sed vel enim sit amet nunc viverra dapibus. Nulla suscipit ligula in lacus."
2/29/2020,752,gslessorkv@dedecms.com,"Kinder Morgan, Inc.","Proin at turpis a pede posuere nonummy. Integer non velit. Donec diam neque, vestibulum eget, vulputate ut, ultrices vel, augue. Vestibulum ante ipsum primis in faucibus orci luctus et ultrices posuere cubilia Curae; Donec pharetra, magna vestibulum aliquet ultrices, erat tortor sollicitudin mi, sit amet lobortis sapien sapien non mi."
4/29/2019,753,owhittakerkw@npr.org,Moelis & Company,"Vestibulum ante ipsum primis in faucibus orci luctus et ultrices posuere cubilia Curae; Nulla dapibus dolor vel est. Donec odio justo, sollicitudin ut, suscipit a, feugiat et, eros."
1/14/2020,754,srochfordkx@comsenz.com,Bioblast Pharma Ltd.,"In est risus, auctor sed, tristique in, tempus sit amet, sem. Fusce consequat. Nulla nisl. Nunc nisl."
1/29/2020,755,lsummerskillky@nba.com,Blackstone / GSO Strategic Credit Fund,"Duis bibendum, felis sed interdum venenatis, turpis enim blandit mi, in porttitor pede justo eu massa."
6/14/2019,756,bbadbykz@csmonitor.com,"Neuralstem, Inc.","Fusce posuere felis sed lacus. Morbi sem mauris, laoreet ut, rhoncus aliquet, pulvinar sed, nisl. Nunc rhoncus dui vel sem. Sed sagittis."
8/2/2019,757,acamamilll0@ox.ac.uk,"M I Acquisitions, Inc.","Proin at turpis a pede posuere nonummy. Integer non velit. Donec diam neque, vestibulum eget, vulputate ut, ultrices vel, augue. Vestibulum ante ipsum primis in faucibus orci luctus et ultrices posuere cubilia Curae; Donec pharetra, magna vestibulum aliquet ultrices, erat tortor sollicitudin mi, sit amet lobortis sapien sapien non mi."
3/19/2020,758,vdudmeshl1@domainmarket.com,MB Financial Inc.,Vestibulum ante ipsum primis in faucibus orci luctus et ultrices posuere cubilia Curae; Mauris viverra diam vitae quam.
11/7/2019,759,mreavelll2@webmd.com,Franco-Nevada Corporation,Nulla suscipit ligula in lacus.
5/6/2019,760,dmcquarterl3@si.edu,"Goldman Sachs Group, Inc. (The)","Fusce lacus purus, aliquet at, feugiat non, pretium quis, lectus."
9/20/2019,761,dscotcherl4@loc.gov,Liberty Media Corporation,"Donec diam neque, vestibulum eget, vulputate ut, ultrices vel, augue."
2/28/2020,762,sschermel5@paypal.com,MB Financial Inc.,"Cum sociis natoque penatibus et magnis dis parturient montes, nascetur ridiculus mus. Vivamus vestibulum sagittis sapien. Cum sociis natoque penatibus et magnis dis parturient montes, nascetur ridiculus mus. Etiam vel augue."
2/27/2020,763,mtorell6@sciencedirect.com,"First Cash, Inc.","Aliquam sit amet diam in magna bibendum imperdiet. Nullam orci pede, venenatis non, sodales sed, tincidunt eu, felis. Fusce posuere felis sed lacus. Morbi sem mauris, laoreet ut, rhoncus aliquet, pulvinar sed, nisl."
11/16/2019,764,gmactrustiel7@statcounter.com,"Hibbett Sports, Inc.",Nulla tempus. Vivamus in felis eu sapien cursus vestibulum.
9/15/2019,765,aferdinandl8@bbb.org,"Shiloh Industries, Inc.","Integer aliquet, massa id lobortis convallis, tortor risus dapibus augue, vel accumsan tellus nisi eu orci."
6/12/2019,766,morrl9@vistaprint.com,Adobe Systems Incorporated,Curabitur gravida nisi at nibh.
10/19/2019,767,wsydneyla@ehow.com,"RCM Technologies, Inc.","Vivamus metus arcu, adipiscing molestie, hendrerit at, vulputate vitae, nisl."
6/2/2019,768,ncattanachlb@cpanel.net,TPG Pace Energy Holdings Corp.,Aenean lectus.
5/24/2019,769,emulkerrinslc@comcast.net,National Holdings Corporation,Pellentesque ultrices mattis odio. Donec vitae nisi.
