fec,correo,idticket,titulo,descripcion
5/14/2019,daxby0@indiegogo.com,1,"HubSpot, Inc.",Etiam faucibus cursus urna. Ut tellus. Nulla ut erat id mauris vulputate elementum. Nullam varius.
1/22/2020,cjaime1@japanpost.jp,2,Covanta Holding Corporation,Suspendisse potenti.
5/2/2019,kadamo2@cloudflare.com,3,"Mohawk Industries, Inc.",Vestibulum ante ipsum primis in faucibus orci luctus et ultrices posuere cubilia Curae; Duis faucibus accumsan odio. Curabitur convallis. Duis consequat dui nec nisi volutpat eleifend.
3/26/2019,dderx3@timesonline.co.uk,4,Piper Jaffray Companies,Vestibulum ante ipsum primis in faucibus orci luctus et ultrices posuere cubilia Curae; Duis faucibus accumsan odio. Curabitur convallis. Duis consequat dui nec nisi volutpat eleifend. Donec ut dolor.
7/7/2019,ddeverson4@google.de,5,"First Solar, Inc.","Vestibulum ante ipsum primis in faucibus orci luctus et ultrices posuere cubilia Curae; Nulla dapibus dolor vel est. Donec odio justo, sollicitudin ut, suscipit a, feugiat et, eros. Vestibulum ac est lacinia nisi venenatis tristique."
8/24/2019,cbrumby5@hugedomains.com,6,Nabriva Therapeutics AG,Mauris sit amet eros. Suspendisse accumsan tortor quis turpis. Sed ante. Vivamus tortor.
4/9/2019,kproffer6@etsy.com,7,Calamos Convertible and High Income Fund,Pellentesque eget nunc. Donec quis orci eget orci vehicula condimentum.
4/23/2019,mmarqyes7@shareasale.com,8,"Insight Enterprises, Inc.","Proin leo odio, porttitor id, consequat in, consequat ut, nulla. Sed accumsan felis. Ut at dolor quis odio consequat varius. Integer ac leo."
6/8/2019,cpiwall8@creativecommons.org,9,"RPC, Inc.",Cras non velit nec nisi vulputate nonummy. Maecenas tincidunt lacus at velit. Vivamus vel nulla eget eros elementum pellentesque.
5/27/2019,aduligal9@plala.or.jp,10,Aegon NV,"In tempor, turpis nec euismod scelerisque, quam turpis adipiscing lorem, vitae mattis nibh ligula nec sem. Duis aliquam convallis nunc."
7/16/2019,dmacgilfoylea@i2i.jp,11,Eaton Vance Risk-Managed Diversified Equity Income Fund,"In tempor, turpis nec euismod scelerisque, quam turpis adipiscing lorem, vitae mattis nibh ligula nec sem. Duis aliquam convallis nunc."
6/26/2019,dsailorb@google.co.uk,12,"EV Energy Partners, L.P.","Fusce posuere felis sed lacus. Morbi sem mauris, laoreet ut, rhoncus aliquet, pulvinar sed, nisl."
6/30/2019,yveryardc@flavors.me,13,"Parke Bancorp, Inc.",Vestibulum ante ipsum primis in faucibus orci luctus et ultrices posuere cubilia Curae; Mauris viverra diam vitae quam. Suspendisse potenti. Nullam porttitor lacus at turpis. Donec posuere metus vitae ipsum.
12/9/2019,mdumingod@arizona.edu,14,"Templeton Dragon Fund, Inc.","In blandit ultrices enim. Lorem ipsum dolor sit amet, consectetuer adipiscing elit."
12/13/2019,kparkynse@skype.com,15,"The Rubicon Project, Inc.","Donec diam neque, vestibulum eget, vulputate ut, ultrices vel, augue. Vestibulum ante ipsum primis in faucibus orci luctus et ultrices posuere cubilia Curae; Donec pharetra, magna vestibulum aliquet ultrices, erat tortor sollicitudin mi, sit amet lobortis sapien sapien non mi. Integer ac neque."
4/28/2019,mnehlsf@timesonline.co.uk,16,Sunoco LP,"Praesent blandit. Nam nulla. Integer pede justo, lacinia eget, tincidunt eget, tempus vel, pede."
2/9/2020,tkilculleng@shutterfly.com,17,Nuveen Credit Opportunities 2022 Target Term Fund,"Aliquam sit amet diam in magna bibendum imperdiet. Nullam orci pede, venenatis non, sodales sed, tincidunt eu, felis."
12/14/2019,esellorh@ibm.com,18,CNA Financial Corporation,"Aliquam sit amet diam in magna bibendum imperdiet. Nullam orci pede, venenatis non, sodales sed, tincidunt eu, felis. Fusce posuere felis sed lacus. Morbi sem mauris, laoreet ut, rhoncus aliquet, pulvinar sed, nisl."
6/24/2019,cdondoni@netscape.com,19,The Descartes Systems Group Inc.,"Fusce lacus purus, aliquet at, feugiat non, pretium quis, lectus. Suspendisse potenti. In eleifend quam a odio."
1/8/2020,dorneblowj@youku.com,20,CNB Financial Corporation,Praesent id massa id nisl venenatis lacinia.
1/25/2020,hpuckhamk@walmart.com,21,"ShotSpotter, Inc.",Aliquam non mauris.
11/15/2019,hziemsenl@jugem.jp,22,Eaton Vance Tax-Managed Global Diversified Equity Income Fund,Nulla tellus.
11/9/2019,ljusterm@senate.gov,23,First Trust Nasdaq Oil & Gas ETF,"Donec vitae nisi. Nam ultrices, libero non mattis pulvinar, nulla pede ullamcorper augue, a suscipit nulla elit ac nulla. Sed vel enim sit amet nunc viverra dapibus."
8/27/2019,cmaciunasn@cnet.com,24,"Arch Coal, Inc.","Cras in purus eu magna vulputate luctus. Cum sociis natoque penatibus et magnis dis parturient montes, nascetur ridiculus mus. Vivamus vestibulum sagittis sapien."
4/19/2019,pmcallastero@unc.edu,25,"OneBeacon Insurance Group, Ltd.",Nullam varius. Nulla facilisi.
9/28/2019,tdurandp@amazonaws.com,26,Westlake Chemical Partners LP,"Phasellus id sapien in sapien iaculis congue. Vivamus metus arcu, adipiscing molestie, hendrerit at, vulputate vitae, nisl."
11/10/2019,jlongwoodq@sun.com,27,"PhotoMedex, Inc.",Donec semper sapien a libero.
10/11/2019,madawayr@vkontakte.ru,28,Swift Transportation Company,Nulla mollis molestie lorem. Quisque ut erat. Curabitur gravida nisi at nibh. In hac habitasse platea dictumst.
4/17/2019,ktessingtons@tamu.edu,29,"Obalon Therapeutics, Inc.","Aenean sit amet justo. Morbi ut odio. Cras mi pede, malesuada in, imperdiet et, commodo vulputate, justo."
12/10/2019,kaymest@cdbaby.com,30,Liberty Global plc,Integer ac leo. Pellentesque ultrices mattis odio. Donec vitae nisi.
6/11/2019,kcolbridgeu@indiatimes.com,31,Franco-Nevada Corporation,Nullam varius. Nulla facilisi. Cras non velit nec nisi vulputate nonummy.
9/20/2019,tmcauliffev@senate.gov,32,Golar LNG Partners LP,Duis mattis egestas metus. Aenean fermentum. Donec ut mauris eget massa tempor convallis.
2/29/2020,bhunw@patch.com,33,"China Natural Resources, Inc.",Aenean auctor gravida sem. Praesent id massa id nisl venenatis lacinia. Aenean sit amet justo.
4/25/2019,fateridgex@foxnews.com,34,Clipper Realty Inc.,Vestibulum sed magna at nunc commodo placerat.
9/13/2019,cebhardty@huffingtonpost.com,35,"Delta Natural Gas Company, Inc.","Vestibulum ante ipsum primis in faucibus orci luctus et ultrices posuere cubilia Curae; Donec pharetra, magna vestibulum aliquet ultrices, erat tortor sollicitudin mi, sit amet lobortis sapien sapien non mi."
3/13/2020,jjeaycockz@purevolume.com,36,IBERIABANK Corporation,Fusce consequat.
10/18/2019,vgensavage10@usda.gov,37,"Synopsys, Inc.","In hac habitasse platea dictumst. Morbi vestibulum, velit id pretium iaculis, diam erat fermentum justo, nec condimentum neque sapien placerat ante. Nulla justo."
9/16/2019,thryniewicki11@creativecommons.org,38,United States Cellular Corporation,Vestibulum ante ipsum primis in faucibus orci luctus et ultrices posuere cubilia Curae; Nulla dapibus dolor vel est.
11/4/2019,gmacallester12@comsenz.com,39,NASDAQ TEST STOCK,"Fusce lacus purus, aliquet at, feugiat non, pretium quis, lectus. Suspendisse potenti."
8/27/2019,sschreurs13@pen.io,40,"Union Bankshares, Inc.",Fusce consequat.
11/14/2019,nmacfadzan14@ask.com,41,"PulteGroup, Inc.",Integer tincidunt ante vel ipsum. Praesent blandit lacinia erat. Vestibulum sed magna at nunc commodo placerat.
3/30/2019,cleblanc15@europa.eu,42,"Fitbit, Inc.",Sed vel enim sit amet nunc viverra dapibus. Nulla suscipit ligula in lacus.
9/3/2019,fcaverhill16@nyu.edu,43,Clorox Company (The),"Proin eu mi. Nulla ac enim. In tempor, turpis nec euismod scelerisque, quam turpis adipiscing lorem, vitae mattis nibh ligula nec sem."
1/9/2020,eroussell17@fotki.com,44,Empresa Distribuidora Y Comercializadora Norte S.A. (Edenor),"Proin risus. Praesent lectus. Vestibulum quam sapien, varius ut, blandit non, interdum in, ante. Vestibulum ante ipsum primis in faucibus orci luctus et ultrices posuere cubilia Curae; Duis faucibus accumsan odio."
12/30/2019,mklaassens18@answers.com,45,HollyFrontier Corporation,Suspendisse potenti. In eleifend quam a odio.
3/28/2019,dauthers19@t-online.de,46,"AMC Entertainment Holdings, Inc.",Cras pellentesque volutpat dui.
1/15/2020,lmaccallister1a@sourceforge.net,47,"Colony NorthStar, Inc.",Pellentesque at nulla. Suspendisse potenti. Cras in purus eu magna vulputate luctus.
5/22/2019,gkingzeth1b@google.com.hk,48,LRAD Corporation,Mauris ullamcorper purus sit amet nulla.
11/12/2019,szorzutti1c@utexas.edu,49,Vuzix Corporation,"Fusce consequat. Nulla nisl. Nunc nisl. Duis bibendum, felis sed interdum venenatis, turpis enim blandit mi, in porttitor pede justo eu massa."
11/11/2019,lleythley1d@facebook.com,50,Kearny Financial,"Duis ac nibh. Fusce lacus purus, aliquet at, feugiat non, pretium quis, lectus."
9/21/2019,kaaron1e@state.tx.us,51,"Amyris, Inc.",Suspendisse potenti. Nullam porttitor lacus at turpis. Donec posuere metus vitae ipsum. Aliquam non mauris.
5/27/2019,tbollum1f@moonfruit.com,52,"Cadiz, Inc.","Lorem ipsum dolor sit amet, consectetuer adipiscing elit."
4/26/2019,gskeggs1g@mashable.com,53,Steel Partners Holdings LP,In hac habitasse platea dictumst. Etiam faucibus cursus urna. Ut tellus. Nulla ut erat id mauris vulputate elementum.
5/9/2019,epickering1h@umich.edu,54,Aon plc,Nulla tempus. Vivamus in felis eu sapien cursus vestibulum. Proin eu mi.
11/2/2019,lchatt1i@deliciousdays.com,55,"MaxLinear, Inc",Integer ac neque. Duis bibendum. Morbi non quam nec dui luctus rutrum.
2/15/2020,nbrettell1j@army.mil,56,Nuveen Build America Bond Fund,Phasellus id sapien in sapien iaculis congue.
6/6/2019,omoncreif1k@google.com,57,ArcelorMittal,Donec ut dolor. Morbi vel lectus in quam fringilla rhoncus.
2/22/2020,mcoates1l@earthlink.net,58,"Equinix, Inc.","Integer non velit. Donec diam neque, vestibulum eget, vulputate ut, ultrices vel, augue."
2/25/2020,adelloyd1m@howstuffworks.com,59,FIRST REPUBLIC BANK,"In hac habitasse platea dictumst. Morbi vestibulum, velit id pretium iaculis, diam erat fermentum justo, nec condimentum neque sapien placerat ante. Nulla justo."
1/17/2020,pciric1n@biblegateway.com,60,Orange,Pellentesque eget nunc.
1/20/2020,tbradd1o@dyndns.org,61,Unum Group,Integer a nibh. In quis justo. Maecenas rhoncus aliquam lacus. Morbi quis tortor id nulla ultrices aliquet.
7/2/2019,avye1p@msu.edu,62,Canada Goose Holdings Inc.,"Nam congue, risus semper porta volutpat, quam pede lobortis ligula, sit amet eleifend pede libero quis orci. Nullam molestie nibh in lectus."
11/18/2019,uconisbee1q@umich.edu,63,uniQure N.V.,Ut at dolor quis odio consequat varius. Integer ac leo. Pellentesque ultrices mattis odio. Donec vitae nisi.
5/19/2019,vgething1r@slideshare.net,64,"China Green Agriculture, Inc.","Mauris enim leo, rhoncus sed, vestibulum sit amet, cursus id, turpis. Integer aliquet, massa id lobortis convallis, tortor risus dapibus augue, vel accumsan tellus nisi eu orci. Mauris lacinia sapien quis libero. Nullam sit amet turpis elementum ligula vehicula consequat."
1/17/2020,dsoans1s@domainmarket.com,65,Vanguard Russell 1000 Value ETF,In hac habitasse platea dictumst. Maecenas ut massa quis augue luctus tincidunt.
6/13/2019,wshenfisch1t@google.es,66,"Consolidated Communications Holdings, Inc.","Donec ut mauris eget massa tempor convallis. Nulla neque libero, convallis eget, eleifend luctus, ultricies eu, nibh."
12/9/2019,cboundley1u@nps.gov,67,IRSA Inversiones Y Representaciones S.A.,"Integer aliquet, massa id lobortis convallis, tortor risus dapibus augue, vel accumsan tellus nisi eu orci."
6/23/2019,dfitter1v@uiuc.edu,68,"Home BancShares, Inc.","Donec quis orci eget orci vehicula condimentum. Curabitur in libero ut massa volutpat convallis. Morbi odio odio, elementum eu, interdum eu, tincidunt in, leo. Maecenas pulvinar lobortis est."
3/19/2020,kclaus1w@istockphoto.com,69,Alibaba Group Holding Limited,Donec dapibus. Duis at velit eu est congue elementum. In hac habitasse platea dictumst.
1/9/2020,aduerden1x@a8.net,70,"Minerva Neurosciences, Inc",Aenean lectus. Pellentesque eget nunc. Donec quis orci eget orci vehicula condimentum. Curabitur in libero ut massa volutpat convallis.
7/16/2019,jkempston1y@wordpress.org,71,Axis Capital Holdings Limited,Phasellus id sapien in sapien iaculis congue.
4/9/2019,noloman1z@paypal.com,72,STORE Capital Corporation,Etiam faucibus cursus urna. Ut tellus. Nulla ut erat id mauris vulputate elementum. Nullam varius.
6/9/2019,aswancott20@huffingtonpost.com,73,Oak Valley Bancorp (CA),"Pellentesque viverra pede ac diam. Cras pellentesque volutpat dui. Maecenas tristique, est et tempus semper, est quam pharetra magna, ac consequat metus sapien ut nunc."
3/4/2020,woldfieldcherry21@eepurl.com,74,USD Partners LP,"Suspendisse ornare consequat lectus. In est risus, auctor sed, tristique in, tempus sit amet, sem."
8/17/2019,ctailby22@arstechnica.com,75,"Isramco, Inc.","Suspendisse potenti. Cras in purus eu magna vulputate luctus. Cum sociis natoque penatibus et magnis dis parturient montes, nascetur ridiculus mus."
3/8/2020,asatterly23@indiatimes.com,76,Bank of America Corporation,Morbi a ipsum. Integer a nibh. In quis justo.
4/30/2019,tgarrold24@columbia.edu,77,"Royce Micro-Cap Trust, Inc.","Nulla neque libero, convallis eget, eleifend luctus, ultricies eu, nibh."
11/19/2019,hmeiklejohn25@nps.gov,78,"Village Super Market, Inc.",Nulla tempus.
1/3/2020,gtuckey26@blinklist.com,79,Baltimore Gas & Electric Company,Curabitur gravida nisi at nibh. In hac habitasse platea dictumst.
3/4/2020,talleyne27@parallels.com,80,Capstone Turbine Corporation,"Morbi porttitor lorem id ligula. Suspendisse ornare consequat lectus. In est risus, auctor sed, tristique in, tempus sit amet, sem. Fusce consequat."
8/24/2019,rgilstin28@latimes.com,81,Hanmi Financial Corporation,Maecenas ut massa quis augue luctus tincidunt. Nulla mollis molestie lorem.
3/12/2020,cgyenes29@theatlantic.com,82,Galapagos NV,In hac habitasse platea dictumst.
2/21/2020,cdolton2a@mail.ru,83,First Trust Nasdaq Pharmaceuticals ETF,Vestibulum ante ipsum primis in faucibus orci luctus et ultrices posuere cubilia Curae; Mauris viverra diam vitae quam. Suspendisse potenti. Nullam porttitor lacus at turpis. Donec posuere metus vitae ipsum.
8/29/2019,rgoldney2b@prweb.com,84,Pacific Drilling S.A.,"Cras mi pede, malesuada in, imperdiet et, commodo vulputate, justo."
7/3/2019,pmawdsley2c@addtoany.com,85,Hovnanian Enterprises Inc,"Fusce posuere felis sed lacus. Morbi sem mauris, laoreet ut, rhoncus aliquet, pulvinar sed, nisl."
1/20/2020,asheehan2d@japanpost.jp,86,Kosmos Energy Ltd.,"Vestibulum ante ipsum primis in faucibus orci luctus et ultrices posuere cubilia Curae; Nulla dapibus dolor vel est. Donec odio justo, sollicitudin ut, suscipit a, feugiat et, eros. Vestibulum ac est lacinia nisi venenatis tristique. Fusce congue, diam id ornare imperdiet, sapien urna pretium nisl, ut volutpat sapien arcu sed augue."
12/10/2019,tthwaites2e@elpais.com,87,National Fuel Gas Company,Proin risus. Praesent lectus.
2/23/2020,aklais2f@cnn.com,88,Quinpario Acquisition Corp. 2,"Nullam orci pede, venenatis non, sodales sed, tincidunt eu, felis. Fusce posuere felis sed lacus."
6/2/2019,dmewett2g@blogs.com,89,"Barnes & Noble, Inc.",Duis aliquam convallis nunc.
4/5/2019,gsambidge2h@usa.gov,90,Public Storage,Proin eu mi. Nulla ac enim.
11/17/2019,oalcido2i@xing.com,91,"Prudential Financial, Inc.",Praesent blandit lacinia erat. Vestibulum sed magna at nunc commodo placerat.
8/13/2019,bmcenery2j@g.co,92,First Trust NASDAQ Cybersecurity ETF,Duis mattis egestas metus. Aenean fermentum. Donec ut mauris eget massa tempor convallis.
11/24/2019,jlowy2k@dmoz.org,93,Nuveen Arizona Quality Municipal Income Fund,"Vestibulum quam sapien, varius ut, blandit non, interdum in, ante. Vestibulum ante ipsum primis in faucibus orci luctus et ultrices posuere cubilia Curae; Duis faucibus accumsan odio. Curabitur convallis. Duis consequat dui nec nisi volutpat eleifend."
12/8/2019,kcockran2l@cbc.ca,94,iShares Global Infrastructure ETF,Suspendisse potenti. In eleifend quam a odio. In hac habitasse platea dictumst.
4/7/2019,hsimioli2m@bbc.co.uk,95,"PB Bancorp, Inc.","Nam ultrices, libero non mattis pulvinar, nulla pede ullamcorper augue, a suscipit nulla elit ac nulla."
3/5/2020,esaddleton2n@tripadvisor.com,96,Vistra Energy Corp.,Proin eu mi.
3/26/2019,boliphant2o@nyu.edu,97,Global Partner Acquisition Corp.,"Donec semper sapien a libero. Nam dui. Proin leo odio, porttitor id, consequat in, consequat ut, nulla. Sed accumsan felis."
5/18/2019,mgarrard2p@japanpost.jp,98,Kellogg Company,Nullam molestie nibh in lectus.
12/3/2019,scapron2q@dot.gov,99,"The Hackett Group, Inc.",Nulla tempus. Vivamus in felis eu sapien cursus vestibulum. Proin eu mi.
6/13/2019,jlarge2r@hubpages.com,100,"Energizer Holdings, Inc.","Mauris enim leo, rhoncus sed, vestibulum sit amet, cursus id, turpis."
1/9/2020,vfillan2s@chronoengine.com,101,"Reata Pharmaceuticals, Inc.",Vestibulum ante ipsum primis in faucibus orci luctus et ultrices posuere cubilia Curae; Nulla dapibus dolor vel est.
4/22/2019,cpaulillo2t@samsung.com,102,"Take-Two Interactive Software, Inc.","Nam dui. Proin leo odio, porttitor id, consequat in, consequat ut, nulla. Sed accumsan felis. Ut at dolor quis odio consequat varius."
4/21/2019,tpues2u@naver.com,103,"Gabelli Equity Trust, Inc. (The)",Nullam varius.
10/28/2019,mcains2v@ow.ly,104,Telefonica SA,Vestibulum rutrum rutrum neque. Aenean auctor gravida sem.
12/13/2019,pkindley2w@csmonitor.com,105,"Banco Santander, S.A.",In quis justo. Maecenas rhoncus aliquam lacus.
1/24/2020,aletherbury2x@taobao.com,106,Bioverativ Inc.,Maecenas rhoncus aliquam lacus.
5/29/2019,hmaskrey2y@amazon.co.jp,107,"Synthetic Fixed-Income Securities, Inc.",Pellentesque eget nunc.
8/10/2019,rstrachan2z@virginia.edu,108,Prospect Capital Corporation,Integer ac neque. Duis bibendum.
8/5/2019,nomolan30@godaddy.com,109,"Lifetime Brands, Inc.","Cras mi pede, malesuada in, imperdiet et, commodo vulputate, justo. In blandit ultrices enim."
10/18/2019,eswindells31@ucoz.ru,110,"Flotek Industries, Inc.","Cras in purus eu magna vulputate luctus. Cum sociis natoque penatibus et magnis dis parturient montes, nascetur ridiculus mus."
9/24/2019,atrolley32@reverbnation.com,111,"Lawson Products, Inc.",Vivamus in felis eu sapien cursus vestibulum. Proin eu mi. Nulla ac enim.
5/16/2019,dbickardike33@51.la,112,AmeriServ Financial Inc.,Etiam vel augue. Vestibulum rutrum rutrum neque.
10/28/2019,tames34@ezinearticles.com,113,Comerica Incorporated,Etiam vel augue. Vestibulum rutrum rutrum neque.
4/30/2019,tdeniso35@miibeian.gov.cn,114,Embotelladora Andina S.A.,Proin interdum mauris non ligula pellentesque ultrices.
3/24/2019,ngilphillan36@google.fr,115,"BioDelivery Sciences International, Inc.","Cras pellentesque volutpat dui. Maecenas tristique, est et tempus semper, est quam pharetra magna, ac consequat metus sapien ut nunc. Vestibulum ante ipsum primis in faucibus orci luctus et ultrices posuere cubilia Curae; Mauris viverra diam vitae quam. Suspendisse potenti."
10/10/2019,nmcilmorie37@psu.edu,116,Sumitomo Mitsui Financial Group Inc,Etiam vel augue. Vestibulum rutrum rutrum neque.
9/22/2019,wstandfield38@addthis.com,117,FIRST REPUBLIC BANK,"Quisque ut erat. Curabitur gravida nisi at nibh. In hac habitasse platea dictumst. Aliquam augue quam, sollicitudin vitae, consectetuer eget, rutrum at, lorem."
11/11/2019,klapsley39@quantcast.com,118,"First Financial Northwest, Inc.","Proin interdum mauris non ligula pellentesque ultrices. Phasellus id sapien in sapien iaculis congue. Vivamus metus arcu, adipiscing molestie, hendrerit at, vulputate vitae, nisl."
10/16/2019,stoms3a@desdev.cn,119,Luxfer Holdings PLC,Ut at dolor quis odio consequat varius.
8/1/2019,ccossentine3b@hugedomains.com,120,"Digital Realty Trust, Inc.","Fusce consequat. Nulla nisl. Nunc nisl. Duis bibendum, felis sed interdum venenatis, turpis enim blandit mi, in porttitor pede justo eu massa."
1/21/2020,rbeament3c@blogspot.com,121,CounterPath Corporation,Nullam porttitor lacus at turpis. Donec posuere metus vitae ipsum. Aliquam non mauris. Morbi non lectus.
2/14/2020,rdearnaly3d@tuttocitta.it,122,"NextEra Energy, Inc.",Duis aliquam convallis nunc. Proin at turpis a pede posuere nonummy.
11/7/2019,pwinpenny3e@jimdo.com,123,"CF Industries Holdings, Inc.",Nam tristique tortor eu pede.
4/19/2019,kvennart3f@hubpages.com,124,"Spark Therapeutics, Inc.","Donec odio justo, sollicitudin ut, suscipit a, feugiat et, eros."
9/26/2019,jgillbard3g@guardian.co.uk,125,"Compania Cervecerias Unidas, S.A.",Ut tellus. Nulla ut erat id mauris vulputate elementum.
7/16/2019,rrusso3h@oaic.gov.au,126,Energous Corporation,Mauris lacinia sapien quis libero. Nullam sit amet turpis elementum ligula vehicula consequat. Morbi a ipsum.
1/26/2020,rworrill3i@washingtonpost.com,127,Bank of America Corporation,Quisque id justo sit amet sapien dignissim vestibulum. Vestibulum ante ipsum primis in faucibus orci luctus et ultrices posuere cubilia Curae; Nulla dapibus dolor vel est.
10/13/2019,aleathard3j@ow.ly,128,Enstar Group Limited,Sed vel enim sit amet nunc viverra dapibus. Nulla suscipit ligula in lacus. Curabitur at ipsum ac tellus semper interdum.
1/11/2020,bmcpeck3k@craigslist.org,129,Zions Bancorporation,Pellentesque at nulla. Suspendisse potenti.
5/30/2019,mmaskill3l@blinklist.com,130,"Lion Biotechnologies, Inc.",Sed accumsan felis. Ut at dolor quis odio consequat varius. Integer ac leo.
1/8/2020,dblest3m@vinaora.com,131,Vident International Equity Fund,"Nulla neque libero, convallis eget, eleifend luctus, ultricies eu, nibh. Quisque id justo sit amet sapien dignissim vestibulum."
4/15/2019,gmeckiff3n@multiply.com,132,Columbia Sportswear Company,In quis justo.
9/13/2019,tstambridge3o@goodreads.com,133,YPF Sociedad Anonima,"Proin risus. Praesent lectus. Vestibulum quam sapien, varius ut, blandit non, interdum in, ante. Vestibulum ante ipsum primis in faucibus orci luctus et ultrices posuere cubilia Curae; Duis faucibus accumsan odio."
1/1/2020,jbreens3p@time.com,134,"Carver Bancorp, Inc.","Nulla suscipit ligula in lacus. Curabitur at ipsum ac tellus semper interdum. Mauris ullamcorper purus sit amet nulla. Quisque arcu libero, rutrum ac, lobortis vel, dapibus at, diam."
9/23/2019,nnutt3q@redcross.org,135,"Dominion Energy Midstream Partners, LP",Suspendisse accumsan tortor quis turpis.
2/13/2020,nbold3r@wiley.com,136,CBS Corporation,"Nam nulla. Integer pede justo, lacinia eget, tincidunt eget, tempus vel, pede."
10/10/2019,dpondjones3s@sohu.com,137,BlueStar TA-BIGITech Israel Technology ETF,"Vivamus vel nulla eget eros elementum pellentesque. Quisque porta volutpat erat. Quisque erat eros, viverra eget, congue eget, semper rutrum, nulla. Nunc purus."
3/7/2020,lheckney3t@webnode.com,138,"NextEra Energy, Inc.",Cras non velit nec nisi vulputate nonummy. Maecenas tincidunt lacus at velit.
6/4/2019,smayell3u@auda.org.au,139,Royal Dutch Shell PLC,"Maecenas leo odio, condimentum id, luctus nec, molestie sed, justo. Pellentesque viverra pede ac diam. Cras pellentesque volutpat dui. Maecenas tristique, est et tempus semper, est quam pharetra magna, ac consequat metus sapien ut nunc."
5/29/2019,bmulrenan3v@mit.edu,140,KT Corporation,"Donec diam neque, vestibulum eget, vulputate ut, ultrices vel, augue. Vestibulum ante ipsum primis in faucibus orci luctus et ultrices posuere cubilia Curae; Donec pharetra, magna vestibulum aliquet ultrices, erat tortor sollicitudin mi, sit amet lobortis sapien sapien non mi. Integer ac neque. Duis bibendum."
8/26/2019,dcrosen3w@sakura.ne.jp,141,Innodata Inc.,"Nulla ac enim. In tempor, turpis nec euismod scelerisque, quam turpis adipiscing lorem, vitae mattis nibh ligula nec sem. Duis aliquam convallis nunc. Proin at turpis a pede posuere nonummy."
4/16/2019,egrote3x@blogspot.com,142,Endurance Specialty Holdings Ltd,"Proin eu mi. Nulla ac enim. In tempor, turpis nec euismod scelerisque, quam turpis adipiscing lorem, vitae mattis nibh ligula nec sem. Duis aliquam convallis nunc."
6/25/2019,fbraban3y@va.gov,143,SodaStream International Ltd.,"Nam dui. Proin leo odio, porttitor id, consequat in, consequat ut, nulla. Sed accumsan felis."
9/22/2019,jiannuzzelli3z@usda.gov,144,Ardagh Group S.A.,"In blandit ultrices enim. Lorem ipsum dolor sit amet, consectetuer adipiscing elit."
8/10/2019,rclemmensen40@360.cn,145,"Prudential Global Short Duration High Yield Fund, Inc.",Etiam vel augue. Vestibulum rutrum rutrum neque. Aenean auctor gravida sem. Praesent id massa id nisl venenatis lacinia.
10/12/2019,sbirley41@networksolutions.com,146,"Eiger BioPharmaceuticals, Inc.",Nullam molestie nibh in lectus.
5/18/2019,spettko42@feedburner.com,147,ClearBridge Energy MLP Total Return Fund Inc.,In quis justo. Maecenas rhoncus aliquam lacus.
6/2/2019,wphiller43@wikispaces.com,148,Atmos Energy Corporation,Integer tincidunt ante vel ipsum. Praesent blandit lacinia erat. Vestibulum sed magna at nunc commodo placerat. Praesent blandit.
1/15/2020,rsaice44@bing.com,149,Oasis Petroleum Inc.,Nulla justo. Aliquam quis turpis eget elit sodales scelerisque. Mauris sit amet eros. Suspendisse accumsan tortor quis turpis.
5/22/2019,jord45@ucoz.com,150,U.S. Bancorp,Proin eu mi.
10/16/2019,vbackshall46@nationalgeographic.com,151,TiVo Corporation,Aenean lectus.
10/6/2019,alydster47@narod.ru,152,Omnicom Group Inc.,Phasellus in felis. Donec semper sapien a libero.
9/30/2019,nschapiro48@blogger.com,153,"Audentes Therapeutics, Inc.","Fusce lacus purus, aliquet at, feugiat non, pretium quis, lectus. Suspendisse potenti. In eleifend quam a odio."
2/10/2020,elamplough49@squidoo.com,154,"CenturyLink, Inc.","Nam congue, risus semper porta volutpat, quam pede lobortis ligula, sit amet eleifend pede libero quis orci."
3/1/2020,bstockford4a@google.com.au,155,"Nova Lifestyle, Inc",Mauris sit amet eros. Suspendisse accumsan tortor quis turpis. Sed ante. Vivamus tortor.
1/9/2020,rbrummell4b@pcworld.com,156,"Zendesk, Inc.","Fusce congue, diam id ornare imperdiet, sapien urna pretium nisl, ut volutpat sapien arcu sed augue."
