fec,correo,idticket,titulo,descripcion
2/12/2020,lbuckelhb@disqus.com,624,"Isramco, Inc.","Maecenas leo odio, condimentum id, luctus nec, molestie sed, justo. Pellentesque viverra pede ac diam."
12/16/2019,jshailerhc@dell.com,625,Black Box Corporation,Sed ante. Vivamus tortor. Duis mattis egestas metus.
4/12/2019,mheershd@friendfeed.com,626,F.N.B. Corporation,"Morbi non lectus. Aliquam sit amet diam in magna bibendum imperdiet. Nullam orci pede, venenatis non, sodales sed, tincidunt eu, felis."
3/25/2019,gkhanhe@chronoengine.com,627,"Advaxis, Inc.","Proin leo odio, porttitor id, consequat in, consequat ut, nulla. Sed accumsan felis. Ut at dolor quis odio consequat varius. Integer ac leo."
2/25/2020,bbatesonhf@discuz.net,628,Royal Dutch Shell PLC,"In est risus, auctor sed, tristique in, tempus sit amet, sem. Fusce consequat. Nulla nisl."
9/27/2019,ihaggithhg@oaic.gov.au,629,Weight Watchers International Inc,Aliquam sit amet diam in magna bibendum imperdiet.
11/13/2019,mdommetthh@github.io,630,Myovant Sciences Ltd.,"Quisque arcu libero, rutrum ac, lobortis vel, dapibus at, diam."
9/24/2019,kyounghi@google.co.uk,631,Royal Caribbean Cruises Ltd.,"Fusce lacus purus, aliquet at, feugiat non, pretium quis, lectus."
3/14/2020,llynashj@wikipedia.org,632,"ANI Pharmaceuticals, Inc.","Vestibulum ac est lacinia nisi venenatis tristique. Fusce congue, diam id ornare imperdiet, sapien urna pretium nisl, ut volutpat sapien arcu sed augue."
9/10/2019,jchatbandhk@flickr.com,633,O2Micro International Limited,"Fusce lacus purus, aliquet at, feugiat non, pretium quis, lectus. Suspendisse potenti. In eleifend quam a odio."
8/10/2019,ccongreavehl@gizmodo.com,634,"Summer Infant, Inc.",Donec quis orci eget orci vehicula condimentum. Curabitur in libero ut massa volutpat convallis.
9/10/2019,ssmidmorhm@t.co,635,Seadrill Limited,"Morbi ut odio. Cras mi pede, malesuada in, imperdiet et, commodo vulputate, justo. In blandit ultrices enim. Lorem ipsum dolor sit amet, consectetuer adipiscing elit."
5/16/2019,kdeetlefshn@over-blog.com,636,"Praxair, Inc.",Nullam porttitor lacus at turpis.
10/22/2019,nlanglandho@geocities.jp,637,"Synacor, Inc.",Pellentesque at nulla.
3/1/2020,dmolfinohp@uol.com.br,638,"MercadoLibre, Inc.","Nam ultrices, libero non mattis pulvinar, nulla pede ullamcorper augue, a suscipit nulla elit ac nulla. Sed vel enim sit amet nunc viverra dapibus. Nulla suscipit ligula in lacus."
7/7/2019,izuanazzihq@hao123.com,639,Mesabi Trust,Mauris sit amet eros. Suspendisse accumsan tortor quis turpis.
7/23/2019,mspindlerhr@arstechnica.com,640,Optical Cable Corporation,"Suspendisse potenti. Cras in purus eu magna vulputate luctus. Cum sociis natoque penatibus et magnis dis parturient montes, nascetur ridiculus mus. Vivamus vestibulum sagittis sapien."
8/6/2019,jusherhs@ning.com,641,"Customers Bancorp, Inc",Etiam faucibus cursus urna. Ut tellus. Nulla ut erat id mauris vulputate elementum. Nullam varius.
11/13/2019,cthorntondewhirstht@ow.ly,642,Saban Capital Acquisition Corp.,Curabitur gravida nisi at nibh.
11/29/2019,ugrouvelhu@scientificamerican.com,643,Innocoll Holdings,"Cras in purus eu magna vulputate luctus. Cum sociis natoque penatibus et magnis dis parturient montes, nascetur ridiculus mus. Vivamus vestibulum sagittis sapien."
6/23/2019,bsomersetthv@telegraph.co.uk,644,Easterly Acquisition Corp.,Maecenas tincidunt lacus at velit.
6/25/2019,kgazehw@networksolutions.com,645,Third Point Reinsurance Ltd.,Duis bibendum. Morbi non quam nec dui luctus rutrum. Nulla tellus. In sagittis dui vel nisl.
8/18/2019,mglusbyhx@51.la,646,MGC Diagnostics Corporation,"Maecenas tristique, est et tempus semper, est quam pharetra magna, ac consequat metus sapien ut nunc. Vestibulum ante ipsum primis in faucibus orci luctus et ultrices posuere cubilia Curae; Mauris viverra diam vitae quam. Suspendisse potenti."
10/14/2019,atippetthy@bigcartel.com,647,Cypress Semiconductor Corporation,"Fusce lacus purus, aliquet at, feugiat non, pretium quis, lectus."
5/3/2019,jvenninghz@pen.io,648,"United States Lime & Minerals, Inc.","Proin eu mi. Nulla ac enim. In tempor, turpis nec euismod scelerisque, quam turpis adipiscing lorem, vitae mattis nibh ligula nec sem."
5/16/2019,gwillgressi0@cornell.edu,649,PPlus Trust,Fusce consequat.
3/12/2020,mphilbricki1@independent.co.uk,650,"A. Schulman, Inc.","Donec quis orci eget orci vehicula condimentum. Curabitur in libero ut massa volutpat convallis. Morbi odio odio, elementum eu, interdum eu, tincidunt in, leo."
5/18/2019,ldionisoi2@plala.or.jp,651,Lehman ABS Corporation,"In blandit ultrices enim. Lorem ipsum dolor sit amet, consectetuer adipiscing elit. Proin interdum mauris non ligula pellentesque ultrices. Phasellus id sapien in sapien iaculis congue."
9/22/2019,mdrennani3@google.co.uk,652,"Customers Bancorp, Inc","Mauris ullamcorper purus sit amet nulla. Quisque arcu libero, rutrum ac, lobortis vel, dapibus at, diam. Nam tristique tortor eu pede."
4/2/2019,mhumphreyi4@indiatimes.com,653,Horizon Technology Finance Corporation,"Sed sagittis. Nam congue, risus semper porta volutpat, quam pede lobortis ligula, sit amet eleifend pede libero quis orci. Nullam molestie nibh in lectus. Pellentesque at nulla."
5/21/2019,dhalwilli5@admin.ch,654,"SI Financial Group, Inc.","Phasellus id sapien in sapien iaculis congue. Vivamus metus arcu, adipiscing molestie, hendrerit at, vulputate vitae, nisl. Aenean lectus. Pellentesque eget nunc."
7/27/2019,wtumberi6@wikimedia.org,655,Energous Corporation,Ut tellus. Nulla ut erat id mauris vulputate elementum. Nullam varius.
5/21/2019,rcresseri7@ebay.com,656,"Swiss Helvetia Fund, Inc. (The)",In sagittis dui vel nisl.
12/4/2019,cheggsi8@a8.net,657,NASDAQ TEST STOCK,"Cum sociis natoque penatibus et magnis dis parturient montes, nascetur ridiculus mus. Etiam vel augue."
8/29/2019,nswofferi9@discuz.net,658,"Voya Infrastructure, Industrials and Materials Fund",Sed accumsan felis. Ut at dolor quis odio consequat varius. Integer ac leo.
8/30/2019,wwifeia@themeforest.net,659,"Natuzzi, S.p.A.",In congue.
6/26/2019,jroycroftib@reuters.com,660,"BCE, Inc.","In est risus, auctor sed, tristique in, tempus sit amet, sem."
3/16/2020,vbesseyic@economist.com,661,Conyers Park Acquisition Corp.,"Duis consequat dui nec nisi volutpat eleifend. Donec ut dolor. Morbi vel lectus in quam fringilla rhoncus. Mauris enim leo, rhoncus sed, vestibulum sit amet, cursus id, turpis."
12/27/2019,dbuttnerid@washingtonpost.com,662,Century Aluminum Company,"Integer aliquet, massa id lobortis convallis, tortor risus dapibus augue, vel accumsan tellus nisi eu orci. Mauris lacinia sapien quis libero. Nullam sit amet turpis elementum ligula vehicula consequat."
6/23/2019,dcorderie@netscape.com,663,"MKS Instruments, Inc.",Morbi quis tortor id nulla ultrices aliquet.
9/4/2019,bdarcoif@surveymonkey.com,664,"UMH Properties, Inc.",Nulla facilisi.
5/5/2019,ahryncewiczig@people.com.cn,665,"Prudential Short Duration High Yield Fund, Inc.","Suspendisse ornare consequat lectus. In est risus, auctor sed, tristique in, tempus sit amet, sem. Fusce consequat."
11/30/2019,rstopperih@meetup.com,666,Gridsum Holding Inc.,"Nam congue, risus semper porta volutpat, quam pede lobortis ligula, sit amet eleifend pede libero quis orci. Nullam molestie nibh in lectus. Pellentesque at nulla. Suspendisse potenti."
10/4/2019,cpogeii@free.fr,667,Harmony Gold Mining Company Limited,"Nullam orci pede, venenatis non, sodales sed, tincidunt eu, felis."
4/11/2019,nvasyuninij@bandcamp.com,668,E*TRADE Financial Corporation,"Quisque arcu libero, rutrum ac, lobortis vel, dapibus at, diam. Nam tristique tortor eu pede."
3/13/2020,cbirdallik@wiley.com,669,LiNiu Technology Group,Donec posuere metus vitae ipsum.
7/30/2019,aweissil@fastcompany.com,670,Regency Centers Corporation,Etiam justo. Etiam pretium iaculis justo. In hac habitasse platea dictumst. Etiam faucibus cursus urna.
7/25/2019,abraunleim@netscape.com,671,"Bancorp 34, Inc.","Integer aliquet, massa id lobortis convallis, tortor risus dapibus augue, vel accumsan tellus nisi eu orci. Mauris lacinia sapien quis libero. Nullam sit amet turpis elementum ligula vehicula consequat."
8/30/2019,ccholtonin@mit.edu,672,Genworth Financial Inc,"Morbi non lectus. Aliquam sit amet diam in magna bibendum imperdiet. Nullam orci pede, venenatis non, sodales sed, tincidunt eu, felis."
11/30/2019,apearseyio@umich.edu,673,Xcerra Corporation,Integer a nibh. In quis justo.
2/1/2020,vjiroutkaip@gravatar.com,674,"Assurant, Inc.",Mauris lacinia sapien quis libero. Nullam sit amet turpis elementum ligula vehicula consequat. Morbi a ipsum.
1/27/2020,dlemmertziq@g.co,675,"Sturm, Ruger & Company, Inc.",Fusce posuere felis sed lacus.
6/3/2019,mlovekinir@hp.com,676,"bebe stores, inc.",Aenean fermentum. Donec ut mauris eget massa tempor convallis.
4/3/2019,gfuzzeyis@sfgate.com,677,Knowles Corporation,"Duis aliquam convallis nunc. Proin at turpis a pede posuere nonummy. Integer non velit. Donec diam neque, vestibulum eget, vulputate ut, ultrices vel, augue."
11/21/2019,clukesit@yale.edu,678,RADA Electronic Industries Ltd.,"Duis bibendum, felis sed interdum venenatis, turpis enim blandit mi, in porttitor pede justo eu massa. Donec dapibus."
9/29/2019,mbawleiu@dropbox.com,679,"Quality Systems, Inc.",Vivamus in felis eu sapien cursus vestibulum. Proin eu mi.
8/22/2019,cmcquiltyiv@domainmarket.com,680,Western Asset/Claymore U.S. Treasury Inflation Prot Secs Fd,Curabitur at ipsum ac tellus semper interdum. Mauris ullamcorper purus sit amet nulla.
5/2/2019,rpymariw@hatena.ne.jp,681,Comcast Corporation,Mauris lacinia sapien quis libero. Nullam sit amet turpis elementum ligula vehicula consequat. Morbi a ipsum.
11/28/2019,chaithix@discovery.com,682,"Compania Cervecerias Unidas, S.A.","Integer aliquet, massa id lobortis convallis, tortor risus dapibus augue, vel accumsan tellus nisi eu orci. Mauris lacinia sapien quis libero."
5/6/2019,pirnisiy@sbwire.com,683,SBA Communications Corporation,Maecenas tincidunt lacus at velit. Vivamus vel nulla eget eros elementum pellentesque.
8/19/2019,jraymaniz@pen.io,684,Cathay General Bancorp,Nulla suscipit ligula in lacus. Curabitur at ipsum ac tellus semper interdum. Mauris ullamcorper purus sit amet nulla.
5/3/2019,aloanj0@google.com.hk,685,SBA Communications Corporation,Etiam pretium iaculis justo. In hac habitasse platea dictumst. Etiam faucibus cursus urna.
11/26/2019,atomaszynskij1@odnoklassniki.ru,686,"Ruth's Hospitality Group, Inc.",Vivamus vel nulla eget eros elementum pellentesque.
8/5/2019,pscarffej2@google.cn,687,First Trust Strategic High Income Fund II,Maecenas rhoncus aliquam lacus.
9/25/2019,cjenksj3@bluehost.com,688,Alpine Global Dynamic Dividend Fund,Etiam pretium iaculis justo. In hac habitasse platea dictumst. Etiam faucibus cursus urna.
5/20/2019,dfewlessj4@spiegel.de,689,Simmons First National Corporation,Praesent blandit lacinia erat. Vestibulum sed magna at nunc commodo placerat.
5/26/2019,jwethj5@usda.gov,690,Ark Restaurants Corp.,Etiam justo. Etiam pretium iaculis justo. In hac habitasse platea dictumst.
3/19/2020,mapplewhaitej6@rambler.ru,691,"Ebix, Inc.",Mauris lacinia sapien quis libero.
1/18/2020,rgalgeyj7@nymag.com,692,"Franklin Financial Network, Inc.",Nullam molestie nibh in lectus. Pellentesque at nulla. Suspendisse potenti.
8/10/2019,gawinj8@github.io,693,BLDRS Emerging Markets 50 ADR Index Fund,Fusce consequat.
1/6/2020,lvezeyj9@china.com.cn,694,"America Movil, S.A.B. de C.V.",Vestibulum ante ipsum primis in faucibus orci luctus et ultrices posuere cubilia Curae; Mauris viverra diam vitae quam. Suspendisse potenti. Nullam porttitor lacus at turpis.
4/26/2019,etimckeja@xrea.com,695,Camden National Corporation,Nunc purus. Phasellus in felis. Donec semper sapien a libero.
2/21/2020,bmaletrattjb@hibu.com,696,BLDRS Asia 50 ADR Index Fund,Vestibulum sed magna at nunc commodo placerat. Praesent blandit. Nam nulla.
6/24/2019,jmcgillegholejc@businessweek.com,697,Calamos Strategic Total Return Fund,Nulla mollis molestie lorem. Quisque ut erat.
7/11/2019,bharrolljd@weather.com,698,Genco Shipping & Trading Limited Warrants Expiring 12/31/2021 ,Maecenas tincidunt lacus at velit. Vivamus vel nulla eget eros elementum pellentesque. Quisque porta volutpat erat.
8/22/2019,dgabbettje@nsw.gov.au,699,Pointer Telocation Ltd.,Praesent blandit lacinia erat. Vestibulum sed magna at nunc commodo placerat.
6/29/2019,spattingsonjf@unc.edu,700,Torchmark Corporation,In hac habitasse platea dictumst. Etiam faucibus cursus urna. Ut tellus.
12/14/2019,cstandonjg@stumbleupon.com,701,ePlus inc.,Ut tellus. Nulla ut erat id mauris vulputate elementum.
7/9/2019,gmapotherjh@prlog.org,702,First Trust Intermediate Duration Preferred & Income Fund,"Quisque arcu libero, rutrum ac, lobortis vel, dapibus at, diam."
12/26/2019,hmiskimmonji@posterous.com,703,PowerShares FTSE RAFI US 1500 Small-Mid Portfolio,Quisque porta volutpat erat.
6/8/2019,sentwislejj@godaddy.com,704,"Warrior Met Coal, Inc.",Phasellus in felis. Donec semper sapien a libero. Nam dui.
10/22/2019,smullinjk@disqus.com,705,"Maiden Holdings, Ltd.","Vivamus vel nulla eget eros elementum pellentesque. Quisque porta volutpat erat. Quisque erat eros, viverra eget, congue eget, semper rutrum, nulla. Nunc purus."
12/15/2019,cgowlandjl@wsj.com,706,"B&G Foods, Inc.",In quis justo. Maecenas rhoncus aliquam lacus.
9/26/2019,btremmeljm@meetup.com,707,"LightInTheBox Holding Co., Ltd.",Vestibulum sed magna at nunc commodo placerat. Praesent blandit. Nam nulla.
5/7/2019,mmoynejn@blog.com,708,"Internationa Flavors & Fragrances, Inc.","Fusce lacus purus, aliquet at, feugiat non, pretium quis, lectus."
4/2/2019,bdorkensjo@scribd.com,709,TransAct Technologies Incorporated,Nullam sit amet turpis elementum ligula vehicula consequat. Morbi a ipsum. Integer a nibh. In quis justo.
3/16/2020,peshmadejp@princeton.edu,710,American Homes 4 Rent,"Nullam orci pede, venenatis non, sodales sed, tincidunt eu, felis. Fusce posuere felis sed lacus."
3/17/2020,lmeasejq@google.com.br,711,Sonic Corp.,Aliquam quis turpis eget elit sodales scelerisque. Mauris sit amet eros.
12/6/2019,ogreerjr@tamu.edu,712,Davis Select Worldwide ETF,"Pellentesque ultrices mattis odio. Donec vitae nisi. Nam ultrices, libero non mattis pulvinar, nulla pede ullamcorper augue, a suscipit nulla elit ac nulla."
5/25/2019,mdomejs@chron.com,713,Annaly Capital Management Inc,Aliquam quis turpis eget elit sodales scelerisque. Mauris sit amet eros. Suspendisse accumsan tortor quis turpis.
6/8/2019,landriulisjt@goodreads.com,714,"FRONTEO, Inc.",Praesent id massa id nisl venenatis lacinia. Aenean sit amet justo.
9/28/2019,slammertju@tinypic.com,715,Wingstop Inc.,Mauris lacinia sapien quis libero. Nullam sit amet turpis elementum ligula vehicula consequat.
2/19/2020,tsansomjv@bizjournals.com,716,"AMAG Pharmaceuticals, Inc.",Integer ac leo.
6/2/2019,tlevetjw@ifeng.com,717,Pzena Investment Management Inc,"Vestibulum quam sapien, varius ut, blandit non, interdum in, ante. Vestibulum ante ipsum primis in faucibus orci luctus et ultrices posuere cubilia Curae; Duis faucibus accumsan odio."
6/30/2019,smacurajx@wunderground.com,718,"Coastway Bancorp, Inc.","Morbi odio odio, elementum eu, interdum eu, tincidunt in, leo. Maecenas pulvinar lobortis est. Phasellus sit amet erat."
5/7/2019,mleathartjy@list-manage.com,719,Gramercy Property Trust Inc.,Vestibulum ante ipsum primis in faucibus orci luctus et ultrices posuere cubilia Curae; Duis faucibus accumsan odio. Curabitur convallis.
9/19/2019,pbramontjz@twitpic.com,720,"STARWOOD PROPERTY TRUST, INC.",In hac habitasse platea dictumst.
10/12/2019,thumphriesk0@yelp.com,721,Microbot Medical Inc. ,"Vestibulum ante ipsum primis in faucibus orci luctus et ultrices posuere cubilia Curae; Nulla dapibus dolor vel est. Donec odio justo, sollicitudin ut, suscipit a, feugiat et, eros. Vestibulum ac est lacinia nisi venenatis tristique. Fusce congue, diam id ornare imperdiet, sapien urna pretium nisl, ut volutpat sapien arcu sed augue."
1/10/2020,dothenk1@dailymotion.com,722,Hill-Rom Holdings Inc,Mauris lacinia sapien quis libero. Nullam sit amet turpis elementum ligula vehicula consequat.
10/3/2019,aouthwaitek2@alibaba.com,723,"PROS Holdings, Inc.",Nunc nisl.
9/16/2019,dcolamk3@theguardian.com,724,"Aptose Biosciences, Inc.",Integer a nibh. In quis justo. Maecenas rhoncus aliquam lacus.
7/7/2019,klavrinovk4@163.com,725,Mercury General Corporation,"Nunc rhoncus dui vel sem. Sed sagittis. Nam congue, risus semper porta volutpat, quam pede lobortis ligula, sit amet eleifend pede libero quis orci. Nullam molestie nibh in lectus."
7/27/2019,tbonnink5@domainmarket.com,726,"DWS High Income Opportunities Fund, Inc.",Nullam sit amet turpis elementum ligula vehicula consequat. Morbi a ipsum.
4/12/2019,adunseathk6@gmpg.org,727,"Citizens Community Bancorp, Inc.","Morbi odio odio, elementum eu, interdum eu, tincidunt in, leo. Maecenas pulvinar lobortis est."
6/14/2019,rmenendezk7@dyndns.org,728,"AMAG Pharmaceuticals, Inc.",Vivamus tortor. Duis mattis egestas metus. Aenean fermentum.
9/16/2019,ethoresbiek8@cloudflare.com,729,"OpGen, Inc.","Donec ut dolor. Morbi vel lectus in quam fringilla rhoncus. Mauris enim leo, rhoncus sed, vestibulum sit amet, cursus id, turpis. Integer aliquet, massa id lobortis convallis, tortor risus dapibus augue, vel accumsan tellus nisi eu orci."
2/15/2020,ahancellk9@opensource.org,730,"ExlService Holdings, Inc.","Duis ac nibh. Fusce lacus purus, aliquet at, feugiat non, pretium quis, lectus."
6/22/2019,aennska@cbsnews.com,731,Bitauto Holdings Limited,Nulla justo. Aliquam quis turpis eget elit sodales scelerisque. Mauris sit amet eros.
9/1/2019,emccurtainkb@tamu.edu,732,Nutraceutical International Corporation,"Vivamus metus arcu, adipiscing molestie, hendrerit at, vulputate vitae, nisl. Aenean lectus. Pellentesque eget nunc."
3/7/2020,sturpeykc@tinyurl.com,733,VivoPower International PLC,Etiam faucibus cursus urna. Ut tellus. Nulla ut erat id mauris vulputate elementum.
4/27/2019,vhellsdonkd@biglobe.ne.jp,734,Mack-Cali Realty Corporation,"Proin risus. Praesent lectus. Vestibulum quam sapien, varius ut, blandit non, interdum in, ante."
11/4/2019,omolineske@sourceforge.net,735,Great Lakes Dredge & Dock Corporation,"Lorem ipsum dolor sit amet, consectetuer adipiscing elit. Proin interdum mauris non ligula pellentesque ultrices. Phasellus id sapien in sapien iaculis congue."
5/14/2019,hcornewellkf@usnews.com,736,First Trust NASDAQ Cybersecurity ETF,Pellentesque eget nunc. Donec quis orci eget orci vehicula condimentum. Curabitur in libero ut massa volutpat convallis.
10/11/2019,jbollomkg@youtu.be,737,"Guaranty Federal Bancshares, Inc.",Praesent blandit lacinia erat. Vestibulum sed magna at nunc commodo placerat. Praesent blandit. Nam nulla.
7/10/2019,msyredkh@dropbox.com,738,SCIENCE APPLICATIONS INTERNATIONAL CORPORATION,"Cras mi pede, malesuada in, imperdiet et, commodo vulputate, justo."
11/26/2019,kscardifeildki@tinyurl.com,739,Tupperware Brands Corporation,"Vivamus metus arcu, adipiscing molestie, hendrerit at, vulputate vitae, nisl. Aenean lectus. Pellentesque eget nunc. Donec quis orci eget orci vehicula condimentum."
12/14/2019,stourlekj@sitemeter.com,740,Gladstone Commercial Corporation,"Vestibulum ante ipsum primis in faucibus orci luctus et ultrices posuere cubilia Curae; Nulla dapibus dolor vel est. Donec odio justo, sollicitudin ut, suscipit a, feugiat et, eros. Vestibulum ac est lacinia nisi venenatis tristique. Fusce congue, diam id ornare imperdiet, sapien urna pretium nisl, ut volutpat sapien arcu sed augue."
6/24/2019,gyersinkk@livejournal.com,741,"Bassett Furniture Industries, Incorporated",Nulla tempus. Vivamus in felis eu sapien cursus vestibulum. Proin eu mi.
6/9/2019,ksheahankl@soup.io,742,"UMH Properties, Inc.",Nulla facilisi. Cras non velit nec nisi vulputate nonummy.
8/25/2019,mcaizleykm@state.tx.us,743,First Trust High Income Long Short Fund,"Cras in purus eu magna vulputate luctus. Cum sociis natoque penatibus et magnis dis parturient montes, nascetur ridiculus mus. Vivamus vestibulum sagittis sapien."
8/16/2019,wbotleykn@businesswire.com,744,Brown Forman Corporation,In blandit ultrices enim.
6/18/2019,tbownassko@facebook.com,745,"Consumer Portfolio Services, Inc.",Phasellus sit amet erat. Nulla tempus. Vivamus in felis eu sapien cursus vestibulum.
4/25/2019,kbinchkp@archive.org,746,LiNiu Technology Group,Integer ac leo.
2/29/2020,lvettorekq@earthlink.net,747,"Interlink Electronics, Inc.","Lorem ipsum dolor sit amet, consectetuer adipiscing elit. Proin interdum mauris non ligula pellentesque ultrices. Phasellus id sapien in sapien iaculis congue. Vivamus metus arcu, adipiscing molestie, hendrerit at, vulputate vitae, nisl."
9/4/2019,jloffheadkr@msu.edu,748,"Madrigal Pharmaceuticals, Inc.","Quisque erat eros, viverra eget, congue eget, semper rutrum, nulla. Nunc purus. Phasellus in felis."
3/28/2019,veliazks@plala.or.jp,749,"Tyson Foods, Inc.","Cras mi pede, malesuada in, imperdiet et, commodo vulputate, justo."
12/8/2019,gkockkt@sourceforge.net,750,"Cogentix Medical, Inc.","Morbi quis tortor id nulla ultrices aliquet. Maecenas leo odio, condimentum id, luctus nec, molestie sed, justo. Pellentesque viverra pede ac diam. Cras pellentesque volutpat dui."
4/17/2019,aacomeku@craigslist.org,751,XL Group Ltd.,"Integer non velit. Donec diam neque, vestibulum eget, vulputate ut, ultrices vel, augue. Vestibulum ante ipsum primis in faucibus orci luctus et ultrices posuere cubilia Curae; Donec pharetra, magna vestibulum aliquet ultrices, erat tortor sollicitudin mi, sit amet lobortis sapien sapien non mi. Integer ac neque."
10/25/2019,glamswoodkv@spotify.com,752,Sabre Corporation,"Nunc rhoncus dui vel sem. Sed sagittis. Nam congue, risus semper porta volutpat, quam pede lobortis ligula, sit amet eleifend pede libero quis orci. Nullam molestie nibh in lectus."
11/9/2019,amargetsonkw@mozilla.org,753,"Kandi Technologies Group, Inc.","Nam ultrices, libero non mattis pulvinar, nulla pede ullamcorper augue, a suscipit nulla elit ac nulla. Sed vel enim sit amet nunc viverra dapibus. Nulla suscipit ligula in lacus. Curabitur at ipsum ac tellus semper interdum."
11/23/2019,yharcuskx@sciencedirect.com,754,Nymox Pharmaceutical Corporation,Sed accumsan felis. Ut at dolor quis odio consequat varius. Integer ac leo. Pellentesque ultrices mattis odio.
2/16/2020,loylettky@ihg.com,755,"Holly Energy Partners, L.P.",Proin interdum mauris non ligula pellentesque ultrices. Phasellus id sapien in sapien iaculis congue.
6/7/2019,dgelardikz@xrea.com,756,"USA Technologies, Inc.",Aenean auctor gravida sem. Praesent id massa id nisl venenatis lacinia. Aenean sit amet justo. Morbi ut odio.
2/28/2020,dsemirasl0@rakuten.co.jp,757,Two Harbors Investments Corp,"Integer pede justo, lacinia eget, tincidunt eget, tempus vel, pede."
8/13/2019,dortl1@instagram.com,758,GW Pharmaceuticals Plc,Nulla facilisi.
8/20/2019,stordiffel2@google.it,759,"Dominion Energy Midstream Partners, LP","Vivamus in felis eu sapien cursus vestibulum. Proin eu mi. Nulla ac enim. In tempor, turpis nec euismod scelerisque, quam turpis adipiscing lorem, vitae mattis nibh ligula nec sem."
5/26/2019,cwimpeyl3@nbcnews.com,760,"Howard Bancorp, Inc.",Praesent blandit. Nam nulla.
6/5/2019,hfugerel4@furl.net,761,AmeriServ Financial Inc.,"Nunc rhoncus dui vel sem. Sed sagittis. Nam congue, risus semper porta volutpat, quam pede lobortis ligula, sit amet eleifend pede libero quis orci."
9/11/2019,bsladl5@amazon.com,762,"Pinnacle Entertainment, Inc.",Proin risus. Praesent lectus.
2/24/2020,sdengel6@flickr.com,763,Liberty All-Star Equity Fund,"Morbi vestibulum, velit id pretium iaculis, diam erat fermentum justo, nec condimentum neque sapien placerat ante. Nulla justo."
2/27/2020,pmooresl7@over-blog.com,764,"EPAM Systems, Inc.",Nam nulla.
2/24/2020,aallinghaml8@storify.com,765,"CBAK Energy Technology, Inc.","Morbi sem mauris, laoreet ut, rhoncus aliquet, pulvinar sed, nisl."
7/15/2019,tjindacekl9@homestead.com,766,Stellar Acquisition III Inc.,Nulla facilisi. Cras non velit nec nisi vulputate nonummy. Maecenas tincidunt lacus at velit.
6/15/2019,hmummla@ifeng.com,767,"Marchex, Inc.",Aliquam non mauris.
8/26/2019,dnorrielb@freewebs.com,768,Psychemedics Corporation,Maecenas pulvinar lobortis est.
11/4/2019,shallbordlc@berkeley.edu,769,OMNOVA Solutions Inc.,"Nam dui. Proin leo odio, porttitor id, consequat in, consequat ut, nulla. Sed accumsan felis."
3/17/2020,dpipetld@nih.gov,770,Enersys,Ut tellus. Nulla ut erat id mauris vulputate elementum. Nullam varius.
10/22/2019,ctodarinile@1und1.de,771,"Colony NorthStar, Inc.",Vivamus vel nulla eget eros elementum pellentesque.
2/27/2020,gstrotonlf@skyrock.com,772,"PDC Energy, Inc.","Vestibulum quam sapien, varius ut, blandit non, interdum in, ante."
10/16/2019,bolekhovlg@t.co,773,"Independence Contract Drilling, Inc.",Aliquam quis turpis eget elit sodales scelerisque. Mauris sit amet eros. Suspendisse accumsan tortor quis turpis.
12/25/2019,ssleenylh@guardian.co.uk,774,Federated National Holding Company,"In blandit ultrices enim. Lorem ipsum dolor sit amet, consectetuer adipiscing elit. Proin interdum mauris non ligula pellentesque ultrices. Phasellus id sapien in sapien iaculis congue."
7/10/2019,jdooneyli@list-manage.com,775,Spire Inc.,"Proin risus. Praesent lectus. Vestibulum quam sapien, varius ut, blandit non, interdum in, ante. Vestibulum ante ipsum primis in faucibus orci luctus et ultrices posuere cubilia Curae; Duis faucibus accumsan odio."
12/29/2019,sjeffcocklj@ted.com,776,NQ Mobile Inc.,In hac habitasse platea dictumst.
1/10/2020,sgrimshawlk@t-online.de,777,Tantech Holdings Ltd.,Curabitur convallis. Duis consequat dui nec nisi volutpat eleifend. Donec ut dolor.
3/11/2020,bstrongmanll@independent.co.uk,778,Morgan Stanley,"Cum sociis natoque penatibus et magnis dis parturient montes, nascetur ridiculus mus. Etiam vel augue. Vestibulum rutrum rutrum neque."
6/5/2019,zmatissofflm@mozilla.org,779,JMP Group LLC,Nulla mollis molestie lorem.
