fec,correo,idticket,titulo,descripcion
10/23/2019,bverricocx@google.it,466,"Eagle Bancorp Montana, Inc.",Curabitur convallis. Duis consequat dui nec nisi volutpat eleifend. Donec ut dolor. Morbi vel lectus in quam fringilla rhoncus.
3/21/2020,bmeddowscy@wikipedia.org,467,CTI BioPharma Corp.,"Vestibulum ante ipsum primis in faucibus orci luctus et ultrices posuere cubilia Curae; Nulla dapibus dolor vel est. Donec odio justo, sollicitudin ut, suscipit a, feugiat et, eros. Vestibulum ac est lacinia nisi venenatis tristique. Fusce congue, diam id ornare imperdiet, sapien urna pretium nisl, ut volutpat sapien arcu sed augue."
2/10/2020,gflaycz@statcounter.com,468,Invesco Trust  for Investment Grade New York Municipal,Praesent blandit. Nam nulla.
11/3/2019,smossomd0@walmart.com,469,"QTS Realty Trust, Inc.",Etiam vel augue.
8/2/2019,kgayled1@washingtonpost.com,470,MFS Charter Income Trust,Morbi non quam nec dui luctus rutrum. Nulla tellus. In sagittis dui vel nisl. Duis ac nibh.
6/26/2019,agallihaulkd2@census.gov,471,ROBO Global Robotics and Automation Index ETF,Fusce posuere felis sed lacus.
8/14/2019,mgorewayd3@umn.edu,472,"Delta Air Lines, Inc.",In hac habitasse platea dictumst.
9/4/2019,giskowitzd4@dion.ne.jp,473,Bank of America Corporation,"Sed sagittis. Nam congue, risus semper porta volutpat, quam pede lobortis ligula, sit amet eleifend pede libero quis orci. Nullam molestie nibh in lectus."
2/19/2020,tharcourtd5@sourceforge.net,474,Ares Capital Corporation,In congue. Etiam justo. Etiam pretium iaculis justo.
12/3/2019,dfealtyd6@senate.gov,475,Southern Company (The),Sed accumsan felis. Ut at dolor quis odio consequat varius. Integer ac leo. Pellentesque ultrices mattis odio.
3/30/2019,cmilehamd7@over-blog.com,476,Target Corporation,"Integer non velit. Donec diam neque, vestibulum eget, vulputate ut, ultrices vel, augue."
7/16/2019,jmerrisond8@mashable.com,477,"MaxPoint Interactive, Inc.",Suspendisse accumsan tortor quis turpis. Sed ante. Vivamus tortor.
3/2/2020,jtrased9@imdb.com,478,"BGC Partners, Inc.","Fusce lacus purus, aliquet at, feugiat non, pretium quis, lectus."
4/26/2019,dsleneyda@netscape.com,479,Semtech Corporation,Duis aliquam convallis nunc. Proin at turpis a pede posuere nonummy.
5/15/2019,jlutwychedb@marriott.com,480,Pioneer Floating Rate Trust,"Cum sociis natoque penatibus et magnis dis parturient montes, nascetur ridiculus mus."
4/18/2019,sgiddinsdc@jalbum.net,481,Time Warner Inc.,"Morbi vel lectus in quam fringilla rhoncus. Mauris enim leo, rhoncus sed, vestibulum sit amet, cursus id, turpis."
3/26/2019,drobedd@house.gov,482,Lightbridge Corporation,Duis aliquam convallis nunc.
12/8/2019,hsanbrookede@biglobe.ne.jp,483,"NetScout Systems, Inc.","Nunc nisl. Duis bibendum, felis sed interdum venenatis, turpis enim blandit mi, in porttitor pede justo eu massa."
1/1/2020,htidcombedf@sfgate.com,484,"National Grid Transco, PLC","In tempor, turpis nec euismod scelerisque, quam turpis adipiscing lorem, vitae mattis nibh ligula nec sem. Duis aliquam convallis nunc."
10/26/2019,mstorriedg@amazonaws.com,485,Security National Financial Corporation,"Praesent lectus. Vestibulum quam sapien, varius ut, blandit non, interdum in, ante. Vestibulum ante ipsum primis in faucibus orci luctus et ultrices posuere cubilia Curae; Duis faucibus accumsan odio. Curabitur convallis."
3/27/2019,agrinleydh@telegraph.co.uk,486,"JD.com, Inc.",Mauris lacinia sapien quis libero.
4/12/2019,bbornedi@a8.net,487,"First Capital, Inc.",Nullam varius.
11/6/2019,smorbydj@ycombinator.com,488,"Determine, Inc. ","Nulla neque libero, convallis eget, eleifend luctus, ultricies eu, nibh. Quisque id justo sit amet sapien dignissim vestibulum."
1/20/2020,kfranzonettidk@woothemes.com,489,"Dominion Energy, Inc.",Donec posuere metus vitae ipsum. Aliquam non mauris. Morbi non lectus.
11/14/2019,ebrutydl@theguardian.com,490,Cemtrex Inc.,Aenean fermentum.
4/13/2019,hprugeldm@simplemachines.org,491,"Liberty All-Star Growth Fund, Inc.",Suspendisse potenti. In eleifend quam a odio.
2/28/2020,mwilbrahamdn@buzzfeed.com,492,"Nustar GP Holdings, LLC",Curabitur convallis. Duis consequat dui nec nisi volutpat eleifend. Donec ut dolor. Morbi vel lectus in quam fringilla rhoncus.
2/2/2020,ewoodroofedo@fema.gov,493,Vicor Corporation,"Vestibulum ante ipsum primis in faucibus orci luctus et ultrices posuere cubilia Curae; Donec pharetra, magna vestibulum aliquet ultrices, erat tortor sollicitudin mi, sit amet lobortis sapien sapien non mi. Integer ac neque. Duis bibendum."
4/22/2019,rwaterlanddp@miibeian.gov.cn,494,"Streamline Health Solutions, Inc.","Morbi quis tortor id nulla ultrices aliquet. Maecenas leo odio, condimentum id, luctus nec, molestie sed, justo."
6/16/2019,klutschdq@meetup.com,495,"Impax Laboratories, Inc.",Vestibulum sed magna at nunc commodo placerat. Praesent blandit.
6/30/2019,mfraneydr@accuweather.com,496,Avista Healthcare Public Acquisition Corp.,"Suspendisse ornare consequat lectus. In est risus, auctor sed, tristique in, tempus sit amet, sem."
4/20/2019,egoldneyds@washington.edu,497,"Werner Enterprises, Inc.",Suspendisse potenti.
8/27/2019,iharriskinedt@alibaba.com,498,"Plug Power, Inc.","Suspendisse ornare consequat lectus. In est risus, auctor sed, tristique in, tempus sit amet, sem."
6/7/2019,dmedhurstdu@ted.com,499,Otelco Inc.,Vivamus tortor. Duis mattis egestas metus.
4/28/2019,gfenckdv@uiuc.edu,500,BRF S.A.,"Suspendisse ornare consequat lectus. In est risus, auctor sed, tristique in, tempus sit amet, sem. Fusce consequat."
11/22/2019,pmuglestondw@mac.com,501,BalckRock Taxable Municipal Bond Trust,Etiam faucibus cursus urna. Ut tellus.
7/11/2019,smaccorkelldx@about.me,502,Arch Capital Group Ltd.,"Donec diam neque, vestibulum eget, vulputate ut, ultrices vel, augue. Vestibulum ante ipsum primis in faucibus orci luctus et ultrices posuere cubilia Curae; Donec pharetra, magna vestibulum aliquet ultrices, erat tortor sollicitudin mi, sit amet lobortis sapien sapien non mi."
7/19/2019,cgubbinsdy@goo.ne.jp,503,Nortel Inversora SA,Vestibulum rutrum rutrum neque. Aenean auctor gravida sem. Praesent id massa id nisl venenatis lacinia. Aenean sit amet justo.
3/27/2019,dvalentimdz@e-recht24.de,504,"Huaneng Power International, Inc.","Lorem ipsum dolor sit amet, consectetuer adipiscing elit. Proin interdum mauris non ligula pellentesque ultrices. Phasellus id sapien in sapien iaculis congue."
6/18/2019,ihaselwoode0@plala.or.jp,505,"Box, Inc.","Pellentesque ultrices mattis odio. Donec vitae nisi. Nam ultrices, libero non mattis pulvinar, nulla pede ullamcorper augue, a suscipit nulla elit ac nulla. Sed vel enim sit amet nunc viverra dapibus."
12/31/2019,rlaxene1@google.es,506,Bel Fuse Inc.,Suspendisse ornare consequat lectus.
5/18/2019,astowerse2@geocities.jp,507,"Under Armour, Inc.",Vestibulum sed magna at nunc commodo placerat. Praesent blandit.
8/23/2019,gminchine3@opera.com,508,Invesco Value Municipal Income Trust,Etiam vel augue.
7/17/2019,adaggette4@surveymonkey.com,509,Kohl's Corporation,Mauris lacinia sapien quis libero.
5/30/2019,mprigmoree5@gmpg.org,510,Silgan Holdings Inc.,"Nunc nisl. Duis bibendum, felis sed interdum venenatis, turpis enim blandit mi, in porttitor pede justo eu massa."
6/30/2019,twillimote6@skype.com,511,"Bellerophon Therapeutics, Inc.",Nulla nisl. Nunc nisl.
3/27/2019,jticklee7@ycombinator.com,512,Microchip Technology Incorporated,In blandit ultrices enim.
12/23/2019,jheamse8@printfriendly.com,513,Accenture plc,Aliquam non mauris. Morbi non lectus.
5/25/2019,sdrysdalee9@indiegogo.com,514,iShares MSCI ACWI ex US Index Fund,"Nulla nisl. Nunc nisl. Duis bibendum, felis sed interdum venenatis, turpis enim blandit mi, in porttitor pede justo eu massa."
11/11/2019,gdigiorgioea@mediafire.com,515,Quotient Limited,"Pellentesque viverra pede ac diam. Cras pellentesque volutpat dui. Maecenas tristique, est et tempus semper, est quam pharetra magna, ac consequat metus sapien ut nunc."
7/10/2019,osnipeeb@ft.com,516,"Western Asset Municipal High Income Fund, Inc.","Duis bibendum, felis sed interdum venenatis, turpis enim blandit mi, in porttitor pede justo eu massa. Donec dapibus."
5/26/2019,ggurnayec@histats.com,517,"DexCom, Inc.",In quis justo.
6/18/2019,ahelksed@blogspot.com,518,"Meta Financial Group, Inc.",Quisque id justo sit amet sapien dignissim vestibulum. Vestibulum ante ipsum primis in faucibus orci luctus et ultrices posuere cubilia Curae; Nulla dapibus dolor vel est.
3/25/2019,opedrielliee@discovery.com,519,Jensyn Acquistion Corp.,Quisque ut erat. Curabitur gravida nisi at nibh.
6/18/2019,aconsidineef@hao123.com,520,Sohu.com Inc.,"Vestibulum ante ipsum primis in faucibus orci luctus et ultrices posuere cubilia Curae; Donec pharetra, magna vestibulum aliquet ultrices, erat tortor sollicitudin mi, sit amet lobortis sapien sapien non mi. Integer ac neque."
2/11/2020,rwaplintoneg@alibaba.com,521,Principal Shareholder Yield Index ETF,Fusce consequat.
1/26/2020,lcattermouleh@phpbb.com,522,"Era Group, Inc.",Vestibulum sed magna at nunc commodo placerat. Praesent blandit.
5/26/2019,celgeyei@chronoengine.com,523,"Bob Evans Farms, Inc.","Cras in purus eu magna vulputate luctus. Cum sociis natoque penatibus et magnis dis parturient montes, nascetur ridiculus mus. Vivamus vestibulum sagittis sapien."
4/10/2019,smanhareej@eventbrite.com,524,"American Financial Group, Inc.",Nullam molestie nibh in lectus. Pellentesque at nulla. Suspendisse potenti. Cras in purus eu magna vulputate luctus.
6/3/2019,aciccarelliek@canalblog.com,525,Pacific Continental Corporation (Ore),"Curabitur gravida nisi at nibh. In hac habitasse platea dictumst. Aliquam augue quam, sollicitudin vitae, consectetuer eget, rutrum at, lorem."
2/8/2020,bconrardel@newyorker.com,526,Logitech International S.A.,"Vestibulum ante ipsum primis in faucibus orci luctus et ultrices posuere cubilia Curae; Nulla dapibus dolor vel est. Donec odio justo, sollicitudin ut, suscipit a, feugiat et, eros."
5/22/2019,bdolemanem@vinaora.com,527,"Dominion Energy, Inc.","Maecenas leo odio, condimentum id, luctus nec, molestie sed, justo. Pellentesque viverra pede ac diam. Cras pellentesque volutpat dui."
3/17/2020,mdugmoreen@ning.com,528,"Duff & Phelps Utility & Corporate Bond Trust, Inc.",Vestibulum ante ipsum primis in faucibus orci luctus et ultrices posuere cubilia Curae; Mauris viverra diam vitae quam.
2/4/2020,rborleaceeo@cmu.edu,529,"SunCoke Energy, Inc.",Vestibulum rutrum rutrum neque. Aenean auctor gravida sem. Praesent id massa id nisl venenatis lacinia. Aenean sit amet justo.
8/24/2019,sonolandep@studiopress.com,530,Corporate Office Properties Trust,"In est risus, auctor sed, tristique in, tempus sit amet, sem. Fusce consequat."
6/6/2019,bsawbridgeeq@xrea.com,531,"AllianzGI NFJ Dividend, Interest & Premium Strategy Fund",Ut tellus. Nulla ut erat id mauris vulputate elementum. Nullam varius. Nulla facilisi.
6/30/2019,sgawener@netscape.com,532,Marriott International,"Proin interdum mauris non ligula pellentesque ultrices. Phasellus id sapien in sapien iaculis congue. Vivamus metus arcu, adipiscing molestie, hendrerit at, vulputate vitae, nisl."
12/27/2019,rmazonowiczes@deviantart.com,533,AT&T Inc.,"Fusce lacus purus, aliquet at, feugiat non, pretium quis, lectus. Suspendisse potenti. In eleifend quam a odio."
2/1/2020,aduligallet@diigo.com,534,Sify Technologies Limited,Cras non velit nec nisi vulputate nonummy. Maecenas tincidunt lacus at velit. Vivamus vel nulla eget eros elementum pellentesque. Quisque porta volutpat erat.
3/13/2020,clambertciorwyneu@cdbaby.com,535,Bright Horizons Family Solutions Inc.,"Donec quis orci eget orci vehicula condimentum. Curabitur in libero ut massa volutpat convallis. Morbi odio odio, elementum eu, interdum eu, tincidunt in, leo."
2/28/2020,bcitrineev@nyu.edu,536,"M I Acquisitions, Inc.",Proin risus. Praesent lectus.
7/20/2019,agazeew@uiuc.edu,537,"Twin Disc, Incorporated",Nullam molestie nibh in lectus. Pellentesque at nulla. Suspendisse potenti.
10/25/2019,rwernherex@nih.gov,538,"NextEra Energy, Inc.",Donec dapibus. Duis at velit eu est congue elementum.
8/23/2019,bdetoileey@vistaprint.com,539,"Texas Capital Bancshares, Inc.","Quisque arcu libero, rutrum ac, lobortis vel, dapibus at, diam."
2/21/2020,fbaughanez@wikia.com,540,"Celadon Group, Inc.",Aenean fermentum.
7/30/2019,jgommef0@ebay.co.uk,541,Five Star Senior Living Inc.,"Morbi quis tortor id nulla ultrices aliquet. Maecenas leo odio, condimentum id, luctus nec, molestie sed, justo. Pellentesque viverra pede ac diam."
9/23/2019,dsalmonsf1@washington.edu,542,Workiva Inc.,"Nam congue, risus semper porta volutpat, quam pede lobortis ligula, sit amet eleifend pede libero quis orci. Nullam molestie nibh in lectus."
7/10/2019,sduckersf2@icq.com,543,"Warrior Met Coal, Inc.","Morbi vestibulum, velit id pretium iaculis, diam erat fermentum justo, nec condimentum neque sapien placerat ante."
1/19/2020,mdenyf3@furl.net,544,Exelon Corporation,Donec ut mauris eget massa tempor convallis.
9/1/2019,seldrittf4@sbwire.com,545,MEDIFAST INC,"Praesent blandit. Nam nulla. Integer pede justo, lacinia eget, tincidunt eget, tempus vel, pede. Morbi porttitor lorem id ligula."
3/11/2020,flaintonf5@so-net.ne.jp,546,Investors Real Estate Trust,"Morbi vestibulum, velit id pretium iaculis, diam erat fermentum justo, nec condimentum neque sapien placerat ante."
7/25/2019,kkitcherf6@japanpost.jp,547,"Blackrock Corporate High Yield Fund, Inc.",Suspendisse potenti. Nullam porttitor lacus at turpis.
2/29/2020,edeblasiof7@vkontakte.ru,548,HSBC Holdings plc,"Vestibulum quam sapien, varius ut, blandit non, interdum in, ante."
11/28/2019,radlardf8@sina.com.cn,549,IAC/InterActiveCorp,Duis aliquam convallis nunc. Proin at turpis a pede posuere nonummy.
8/11/2019,jwillwoodf9@telegraph.co.uk,550,"Cohen & Steers Closed-End Opportunity Fund, Inc.","Quisque erat eros, viverra eget, congue eget, semper rutrum, nulla. Nunc purus. Phasellus in felis. Donec semper sapien a libero."
11/11/2019,nsauvagefa@ucsd.edu,551,Lincoln National Corporation,Nulla tellus. In sagittis dui vel nisl.
3/7/2020,ifeasleyfb@tinypic.com,552,Federal Agricultural Mortgage Corporation,"In hac habitasse platea dictumst. Morbi vestibulum, velit id pretium iaculis, diam erat fermentum justo, nec condimentum neque sapien placerat ante. Nulla justo."
11/7/2019,ctownsendfc@soundcloud.com,553,Global X Robotics & Artificial Intelligence ETF,"Donec odio justo, sollicitudin ut, suscipit a, feugiat et, eros. Vestibulum ac est lacinia nisi venenatis tristique. Fusce congue, diam id ornare imperdiet, sapien urna pretium nisl, ut volutpat sapien arcu sed augue."
12/19/2019,eveldmanfd@latimes.com,554,"Ra Pharmaceuticals, Inc.",Suspendisse accumsan tortor quis turpis. Sed ante.
10/5/2019,gwanellfe@japanpost.jp,555,RLJ Lodging Trust,"Lorem ipsum dolor sit amet, consectetuer adipiscing elit. Proin risus. Praesent lectus. Vestibulum quam sapien, varius ut, blandit non, interdum in, ante."
10/8/2019,lbavinff@bloomberg.com,556,"aTyr Pharma, Inc.",Etiam vel augue. Vestibulum rutrum rutrum neque.
9/2/2019,elinehamfg@github.io,557,FIRST REPUBLIC BANK,"In blandit ultrices enim. Lorem ipsum dolor sit amet, consectetuer adipiscing elit. Proin interdum mauris non ligula pellentesque ultrices."
5/6/2019,dcochetfh@com.com,558,Madison Strategic Sector Premium Fund,Pellentesque viverra pede ac diam.
4/13/2019,rdesquesnesfi@clickbank.net,559,"Diamondback Energy, Inc.",Maecenas tincidunt lacus at velit. Vivamus vel nulla eget eros elementum pellentesque. Quisque porta volutpat erat.
5/24/2019,dallettfj@bigcartel.com,560,Newell Brands Inc.,Vestibulum ante ipsum primis in faucibus orci luctus et ultrices posuere cubilia Curae; Duis faucibus accumsan odio. Curabitur convallis.
6/1/2019,cheadinghamfk@shareasale.com,561,"China Green Agriculture, Inc.",Suspendisse potenti. Nullam porttitor lacus at turpis.
11/27/2019,ereicherzfl@list-manage.com,562,"Merit Medical Systems, Inc.","Donec vitae nisi. Nam ultrices, libero non mattis pulvinar, nulla pede ullamcorper augue, a suscipit nulla elit ac nulla."
6/5/2019,vmcrobertfm@upenn.edu,563,"Saia, Inc.","Integer non velit. Donec diam neque, vestibulum eget, vulputate ut, ultrices vel, augue."
4/24/2019,zgammillfn@imageshack.us,564,United States Steel Corporation,"Praesent lectus. Vestibulum quam sapien, varius ut, blandit non, interdum in, ante. Vestibulum ante ipsum primis in faucibus orci luctus et ultrices posuere cubilia Curae; Duis faucibus accumsan odio. Curabitur convallis."
7/20/2019,jklimekfo@slate.com,565,PowerShares Global Gold & Precious Metals Portfolio,Praesent blandit.
7/28/2019,dskipponfp@ning.com,566,Resource Capital Corp.,Nullam porttitor lacus at turpis. Donec posuere metus vitae ipsum. Aliquam non mauris.
11/4/2019,wmaciaszczykfq@phpbb.com,567,CBS Corporation,Nunc rhoncus dui vel sem.
4/20/2019,elaphornfr@etsy.com,568,Annaly Capital Management Inc,Fusce consequat. Nulla nisl.
11/9/2019,dsambathfs@hatena.ne.jp,569,"Information Services Group, Inc.","Aenean fermentum. Donec ut mauris eget massa tempor convallis. Nulla neque libero, convallis eget, eleifend luctus, ultricies eu, nibh."
3/8/2020,khammandft@salon.com,570,VictoryShares US Small Cap High Div Volatility Wtd ETF,"Nulla nisl. Nunc nisl. Duis bibendum, felis sed interdum venenatis, turpis enim blandit mi, in porttitor pede justo eu massa."
11/10/2019,dbaskeyfieldfu@prweb.com,571,Duke Energy Corporation,Aenean fermentum. Donec ut mauris eget massa tempor convallis.
7/2/2019,gscrivenorfv@posterous.com,572,Federal Signal Corporation,Nulla tempus. Vivamus in felis eu sapien cursus vestibulum. Proin eu mi. Nulla ac enim.
10/1/2019,imcwhanfw@stanford.edu,573,Peoples Bancorp Inc.,Nulla mollis molestie lorem. Quisque ut erat. Curabitur gravida nisi at nibh. In hac habitasse platea dictumst.
3/28/2019,tcheeldfx@istockphoto.com,574,HDFC Bank Limited,"Praesent lectus. Vestibulum quam sapien, varius ut, blandit non, interdum in, ante. Vestibulum ante ipsum primis in faucibus orci luctus et ultrices posuere cubilia Curae; Duis faucibus accumsan odio. Curabitur convallis."
9/4/2019,sgouchfy@list-manage.com,575,Credicorp Ltd.,Duis at velit eu est congue elementum.
7/10/2019,gshentonfz@aboutads.info,576,Highland Funds I,"Aenean fermentum. Donec ut mauris eget massa tempor convallis. Nulla neque libero, convallis eget, eleifend luctus, ultricies eu, nibh."
5/16/2019,dbinnesg0@1und1.de,577,"SG Blocks, Inc.",Nullam porttitor lacus at turpis. Donec posuere metus vitae ipsum. Aliquam non mauris.
8/15/2019,egordong1@example.com,578,CafePress Inc.,"In hac habitasse platea dictumst. Aliquam augue quam, sollicitudin vitae, consectetuer eget, rutrum at, lorem. Integer tincidunt ante vel ipsum."
3/24/2019,bcallang2@unicef.org,579,Celanese Corporation,Nunc rhoncus dui vel sem.
2/6/2020,gcathieg3@t.co,580,DMC Global Inc.,"Cum sociis natoque penatibus et magnis dis parturient montes, nascetur ridiculus mus. Vivamus vestibulum sagittis sapien. Cum sociis natoque penatibus et magnis dis parturient montes, nascetur ridiculus mus. Etiam vel augue."
11/5/2019,ayellowleag4@ezinearticles.com,581,"Total System Services, Inc.",Praesent blandit.
6/5/2019,vchurchyardg5@cnbc.com,582,DoubleLine Income Solutions Fund,Aliquam quis turpis eget elit sodales scelerisque.
3/28/2019,iamerg6@indiegogo.com,583,"Landcadia Holdings, Inc.",Vestibulum rutrum rutrum neque.
3/12/2020,bliddeng7@sakura.ne.jp,584,Sunoco LP,Suspendisse accumsan tortor quis turpis. Sed ante. Vivamus tortor.
7/4/2019,lchalonerg8@goo.gl,585,"GAIN Capital Holdings, Inc.","Lorem ipsum dolor sit amet, consectetuer adipiscing elit. Proin risus. Praesent lectus. Vestibulum quam sapien, varius ut, blandit non, interdum in, ante."
8/19/2019,kclawsleyg9@cafepress.com,586,Drive Shack Inc.,Donec semper sapien a libero. Nam dui.
8/6/2019,ncluerga@dion.ne.jp,587,EDAP TMS S.A.,"Duis bibendum, felis sed interdum venenatis, turpis enim blandit mi, in porttitor pede justo eu massa."
10/16/2019,rlavallgb@wp.com,588,Vodafone Group Plc,"Nulla nisl. Nunc nisl. Duis bibendum, felis sed interdum venenatis, turpis enim blandit mi, in porttitor pede justo eu massa. Donec dapibus."
7/12/2019,kwinterbournegc@cdc.gov,589,"Alexander's, Inc.","Fusce lacus purus, aliquet at, feugiat non, pretium quis, lectus. Suspendisse potenti. In eleifend quam a odio."
10/22/2019,msmeallgd@nps.gov,590,Medley LLC,Nulla suscipit ligula in lacus. Curabitur at ipsum ac tellus semper interdum. Mauris ullamcorper purus sit amet nulla.
12/25/2019,akelliege@google.cn,591,"Grand Canyon Education, Inc.","Maecenas rhoncus aliquam lacus. Morbi quis tortor id nulla ultrices aliquet. Maecenas leo odio, condimentum id, luctus nec, molestie sed, justo."
1/29/2020,htitcomgf@bloglovin.com,592,VictoryShares International Volatility Wtd ETF,Curabitur at ipsum ac tellus semper interdum. Mauris ullamcorper purus sit amet nulla.
1/10/2020,sdickonsgg@biblegateway.com,593,Total S.A.,"Vestibulum ante ipsum primis in faucibus orci luctus et ultrices posuere cubilia Curae; Donec pharetra, magna vestibulum aliquet ultrices, erat tortor sollicitudin mi, sit amet lobortis sapien sapien non mi. Integer ac neque. Duis bibendum. Morbi non quam nec dui luctus rutrum."
5/23/2019,dfishlockgh@goo.ne.jp,594,Albany International Corporation,"Proin at turpis a pede posuere nonummy. Integer non velit. Donec diam neque, vestibulum eget, vulputate ut, ultrices vel, augue."
11/10/2019,gmarrangi@geocities.jp,595,"Nexeo Solutions, Inc.","Vivamus vestibulum sagittis sapien. Cum sociis natoque penatibus et magnis dis parturient montes, nascetur ridiculus mus. Etiam vel augue."
6/18/2019,bbessongj@people.com.cn,596,Kemper Corporation,Phasellus in felis. Donec semper sapien a libero. Nam dui.
12/3/2019,lconnewgk@nhs.uk,597,"Invuity, Inc.","Morbi vestibulum, velit id pretium iaculis, diam erat fermentum justo, nec condimentum neque sapien placerat ante. Nulla justo. Aliquam quis turpis eget elit sodales scelerisque. Mauris sit amet eros."
10/5/2019,dknevetgl@163.com,598,Cintas Corporation,Morbi porttitor lorem id ligula.
7/31/2019,iwhyegm@house.gov,599,"A-Mark Precious Metals, Inc.",Sed vel enim sit amet nunc viverra dapibus.
8/12/2019,rdellogn@unc.edu,600,Blackrock MuniYield Pennsylvania Quality Fund,"Praesent lectus. Vestibulum quam sapien, varius ut, blandit non, interdum in, ante. Vestibulum ante ipsum primis in faucibus orci luctus et ultrices posuere cubilia Curae; Duis faucibus accumsan odio."
8/15/2019,scoggengo@etsy.com,601,"CorEnergy Infrastructure Trust, Inc.","Donec ut mauris eget massa tempor convallis. Nulla neque libero, convallis eget, eleifend luctus, ultricies eu, nibh."
3/19/2020,rrobkergp@npr.org,602,"Knight Transportation, Inc.","Lorem ipsum dolor sit amet, consectetuer adipiscing elit. Proin risus."
10/30/2019,wfauguelgq@vinaora.com,603,PIMCO Municipal Income Fund,Cras pellentesque volutpat dui.
12/29/2019,sfarriesgr@indiegogo.com,604,Cerulean Pharma Inc.,"Duis bibendum, felis sed interdum venenatis, turpis enim blandit mi, in porttitor pede justo eu massa."
4/26/2019,lpaulougs@jiathis.com,605,PowerShares DWA NASDAQ Momentum Portfolio,"Suspendisse ornare consequat lectus. In est risus, auctor sed, tristique in, tempus sit amet, sem. Fusce consequat. Nulla nisl."
2/14/2020,mcarwithangt@blogspot.com,606,"Boston Private Financial Holdings, Inc.","Morbi porttitor lorem id ligula. Suspendisse ornare consequat lectus. In est risus, auctor sed, tristique in, tempus sit amet, sem. Fusce consequat."
12/21/2019,wcheeldgu@gnu.org,607,Golden Ocean Group Limited,"Donec ut mauris eget massa tempor convallis. Nulla neque libero, convallis eget, eleifend luctus, ultricies eu, nibh. Quisque id justo sit amet sapien dignissim vestibulum."
5/25/2019,vlehriangv@fema.gov,608,1st Constitution Bancorp (NJ),"Suspendisse ornare consequat lectus. In est risus, auctor sed, tristique in, tempus sit amet, sem. Fusce consequat."
11/22/2019,bbeaufoygw@bbb.org,609,"Safe Bulkers, Inc",Quisque ut erat. Curabitur gravida nisi at nibh. In hac habitasse platea dictumst.
3/4/2020,lbartsgx@si.edu,610,iPath US Treasury 2-year Bear ETN,Etiam pretium iaculis justo.
10/14/2019,ebadhamgy@alibaba.com,611,"Apogee Enterprises, Inc.",Suspendisse ornare consequat lectus.
3/25/2019,tlabrumgz@wired.com,612,GGP Inc.,"Quisque erat eros, viverra eget, congue eget, semper rutrum, nulla. Nunc purus."
1/4/2020,fscowcrofth0@webeden.co.uk,613,Eagle Point Credit Company Inc.,Fusce consequat. Nulla nisl. Nunc nisl.
12/25/2019,welpheyh1@unblog.fr,614,Public Storage,Maecenas pulvinar lobortis est.
7/15/2019,fmalenfanth2@liveinternet.ru,615,EnteroMedics Inc.,"Mauris ullamcorper purus sit amet nulla. Quisque arcu libero, rutrum ac, lobortis vel, dapibus at, diam."
9/7/2019,mleivesleyh3@globo.com,616,"ZAIS Group Holdings, Inc.","Cum sociis natoque penatibus et magnis dis parturient montes, nascetur ridiculus mus. Etiam vel augue."
6/17/2019,cstokoeh4@tinyurl.com,617,"Planet Fitness, Inc.",Integer tincidunt ante vel ipsum.
12/7/2019,gstairmondh5@multiply.com,618,Credit Suisse AG,"Vivamus vestibulum sagittis sapien. Cum sociis natoque penatibus et magnis dis parturient montes, nascetur ridiculus mus. Etiam vel augue."
7/17/2019,smorseh6@deviantart.com,619,CoreSite Realty Corporation,"Morbi vel lectus in quam fringilla rhoncus. Mauris enim leo, rhoncus sed, vestibulum sit amet, cursus id, turpis. Integer aliquet, massa id lobortis convallis, tortor risus dapibus augue, vel accumsan tellus nisi eu orci."
10/19/2019,cvaninh7@spiegel.de,620,Lakeland Financial Corporation,Praesent blandit. Nam nulla.
1/18/2020,ebuckleeh8@fc2.com,621,"American Railcar Industries, Inc.",Vestibulum ante ipsum primis in faucibus orci luctus et ultrices posuere cubilia Curae; Duis faucibus accumsan odio. Curabitur convallis.
5/24/2019,ckynetonh9@addthis.com,622,Deutsche Bank AG,Morbi a ipsum. Integer a nibh. In quis justo. Maecenas rhoncus aliquam lacus.
1/26/2020,vnassiha@youtu.be,623,Origo Acquisition Corporation,"Maecenas leo odio, condimentum id, luctus nec, molestie sed, justo."
