fec,correo,idticket,titulo,descripcion
6/13/2019,kmckelvey8u@auda.org.au,319,"Asia Tigers Fund, Inc. (The)",Morbi non quam nec dui luctus rutrum. Nulla tellus. In sagittis dui vel nisl.
1/2/2020,sjales8v@cnbc.com,320,"Aqua Metals, Inc.",Curabitur gravida nisi at nibh.
8/7/2019,divers8w@pen.io,321,Hudbay Minerals Inc.,Proin eu mi. Nulla ac enim.
9/17/2019,pceller8x@bloglines.com,322,Amplify Online Retail ETF,Cras non velit nec nisi vulputate nonummy.
10/6/2019,bbernuzzi8y@craigslist.org,323,International Bancshares Corporation,"Curabitur gravida nisi at nibh. In hac habitasse platea dictumst. Aliquam augue quam, sollicitudin vitae, consectetuer eget, rutrum at, lorem."
5/20/2019,smeron8z@squarespace.com,324,New York Times Company (The),Integer ac leo. Pellentesque ultrices mattis odio.
7/24/2019,zsephton90@stumbleupon.com,325,"World Wrestling Entertainment, Inc.","Lorem ipsum dolor sit amet, consectetuer adipiscing elit. Proin interdum mauris non ligula pellentesque ultrices."
8/24/2019,kfallens91@msu.edu,326,"Determine, Inc. ",Proin risus. Praesent lectus.
4/1/2019,dokinneally92@google.it,327,"ALJ Regional Holdings, Inc.","Nam congue, risus semper porta volutpat, quam pede lobortis ligula, sit amet eleifend pede libero quis orci. Nullam molestie nibh in lectus. Pellentesque at nulla."
1/2/2020,chellin93@webnode.com,328,"SITO Mobile, Ltd.","Curabitur gravida nisi at nibh. In hac habitasse platea dictumst. Aliquam augue quam, sollicitudin vitae, consectetuer eget, rutrum at, lorem. Integer tincidunt ante vel ipsum."
5/24/2019,wbrithman94@macromedia.com,329,"Walgreens Boots Alliance, Inc.",Nulla tempus.
3/4/2020,karchdeacon95@mayoclinic.com,330,"Cedar Realty Trust, Inc.","Nam ultrices, libero non mattis pulvinar, nulla pede ullamcorper augue, a suscipit nulla elit ac nulla. Sed vel enim sit amet nunc viverra dapibus. Nulla suscipit ligula in lacus. Curabitur at ipsum ac tellus semper interdum."
7/2/2019,sswepson96@quantcast.com,331,Blackrock New York Municipal 2018 Term Trust,"Suspendisse ornare consequat lectus. In est risus, auctor sed, tristique in, tempus sit amet, sem. Fusce consequat. Nulla nisl."
3/4/2020,jkrook97@fc2.com,332,Origin Agritech Limited,Nulla mollis molestie lorem.
12/23/2019,nbettaney98@newyorker.com,333,Columbia Sportswear Company,"Maecenas leo odio, condimentum id, luctus nec, molestie sed, justo. Pellentesque viverra pede ac diam. Cras pellentesque volutpat dui."
9/23/2019,kwooton99@nba.com,334,"Twitter, Inc.","Quisque id justo sit amet sapien dignissim vestibulum. Vestibulum ante ipsum primis in faucibus orci luctus et ultrices posuere cubilia Curae; Nulla dapibus dolor vel est. Donec odio justo, sollicitudin ut, suscipit a, feugiat et, eros."
4/21/2019,gdurham9a@surveymonkey.com,335,Western Asset Global Corporate Defined Opportunity Fund Inc.,Nullam porttitor lacus at turpis. Donec posuere metus vitae ipsum.
8/6/2019,cburchatt9b@google.ru,336,"P & F Industries, Inc.","Fusce congue, diam id ornare imperdiet, sapien urna pretium nisl, ut volutpat sapien arcu sed augue. Aliquam erat volutpat. In congue. Etiam justo."
5/8/2019,usawter9c@discovery.com,337,"Hostess Brands, Inc.","In blandit ultrices enim. Lorem ipsum dolor sit amet, consectetuer adipiscing elit. Proin interdum mauris non ligula pellentesque ultrices. Phasellus id sapien in sapien iaculis congue."
10/8/2019,ldanielski9d@amazon.de,338,Innodata Inc.,Suspendisse ornare consequat lectus.
1/22/2020,rnani9e@yahoo.com,339,Compugen Ltd.,"Integer aliquet, massa id lobortis convallis, tortor risus dapibus augue, vel accumsan tellus nisi eu orci. Mauris lacinia sapien quis libero. Nullam sit amet turpis elementum ligula vehicula consequat. Morbi a ipsum."
10/19/2019,gpiscot9f@bizjournals.com,340,"Roper Technologies, Inc.","Nulla neque libero, convallis eget, eleifend luctus, ultricies eu, nibh. Quisque id justo sit amet sapien dignissim vestibulum. Vestibulum ante ipsum primis in faucibus orci luctus et ultrices posuere cubilia Curae; Nulla dapibus dolor vel est."
3/9/2020,jdannatt9g@reuters.com,341,Putnam Managed Municipal Income Trust,Curabitur gravida nisi at nibh.
12/20/2019,lcolquite9h@oaic.gov.au,342,"Alliance One International, Inc.",Nullam varius.
10/31/2019,tkennedy9i@theatlantic.com,343,Avista Healthcare Public Acquisition Corp.,Vestibulum rutrum rutrum neque.
1/21/2020,sdumbleton9j@ted.com,344,"Blackrock MuniHoldings Quality Fund II, Inc.","Fusce posuere felis sed lacus. Morbi sem mauris, laoreet ut, rhoncus aliquet, pulvinar sed, nisl. Nunc rhoncus dui vel sem."
10/27/2019,amazella9k@fema.gov,345,"MFA Financial, Inc.","Fusce lacus purus, aliquet at, feugiat non, pretium quis, lectus. Suspendisse potenti."
3/22/2020,jpowling9l@miitbeian.gov.cn,346,Cellectis S.A.,"In blandit ultrices enim. Lorem ipsum dolor sit amet, consectetuer adipiscing elit. Proin interdum mauris non ligula pellentesque ultrices. Phasellus id sapien in sapien iaculis congue."
7/9/2019,nbrodway9m@sbwire.com,347,Cellectis S.A.,"Proin leo odio, porttitor id, consequat in, consequat ut, nulla. Sed accumsan felis. Ut at dolor quis odio consequat varius."
6/14/2019,rkas9n@ovh.net,348,Protective Life Corporation,"Nulla ac enim. In tempor, turpis nec euismod scelerisque, quam turpis adipiscing lorem, vitae mattis nibh ligula nec sem. Duis aliquam convallis nunc."
7/25/2019,akilbee9o@last.fm,349,"PPL Capital Funding, Inc.",Phasellus sit amet erat.
3/12/2020,conion9p@google.co.jp,350,Two Harbors Investments Corp,"In hac habitasse platea dictumst. Aliquam augue quam, sollicitudin vitae, consectetuer eget, rutrum at, lorem. Integer tincidunt ante vel ipsum. Praesent blandit lacinia erat."
11/24/2019,sospellissey9q@usgs.gov,351,"Prestige Brand Holdings, Inc.","Quisque erat eros, viverra eget, congue eget, semper rutrum, nulla. Nunc purus. Phasellus in felis. Donec semper sapien a libero."
8/31/2019,cbushen9r@telegraph.co.uk,352,"Santander Holdings USA, Inc.","Nunc rhoncus dui vel sem. Sed sagittis. Nam congue, risus semper porta volutpat, quam pede lobortis ligula, sit amet eleifend pede libero quis orci."
5/30/2019,msarfatti9s@answers.com,353,Seneca Foods Corp.,"Lorem ipsum dolor sit amet, consectetuer adipiscing elit. Proin interdum mauris non ligula pellentesque ultrices. Phasellus id sapien in sapien iaculis congue. Vivamus metus arcu, adipiscing molestie, hendrerit at, vulputate vitae, nisl."
2/4/2020,cbenettini9t@jugem.jp,354,The Long-Term Care ETF,"In tempor, turpis nec euismod scelerisque, quam turpis adipiscing lorem, vitae mattis nibh ligula nec sem. Duis aliquam convallis nunc."
6/29/2019,hfenney9u@mtv.com,355,TCP Capital Corp.,Nunc purus. Phasellus in felis. Donec semper sapien a libero.
6/17/2019,jdadge9v@cnn.com,356,Tenaris S.A.,"Vestibulum quam sapien, varius ut, blandit non, interdum in, ante."
2/22/2020,dcameli9w@trellian.com,357,Arrow Financial Corporation,Integer ac neque. Duis bibendum. Morbi non quam nec dui luctus rutrum.
4/4/2019,tgoney9x@cnn.com,358,Gabelli Utility Trust (The),Mauris lacinia sapien quis libero.
7/20/2019,nbollini9y@gnu.org,359,JetPay Corporation,Nullam molestie nibh in lectus. Pellentesque at nulla.
6/5/2019,deymer9z@europa.eu,360,Wells Fargo & Company,Pellentesque ultrices mattis odio.
9/17/2019,bbravingtona0@cmu.edu,361,"Soleno Therapeutics, Inc.",Integer ac leo. Pellentesque ultrices mattis odio. Donec vitae nisi.
11/11/2019,ibaseleya1@360.cn,362,Cresud S.A.C.I.F. y A.,Sed ante. Vivamus tortor.
11/9/2019,bklosaa2@springer.com,363,Allstate Corporation (The),Nulla nisl. Nunc nisl.
2/13/2020,sosgerbya3@ca.gov,364,"iKang Healthcare Group, Inc.","Aliquam augue quam, sollicitudin vitae, consectetuer eget, rutrum at, lorem. Integer tincidunt ante vel ipsum. Praesent blandit lacinia erat."
10/16/2019,htinmoutha4@goo.gl,365,"Easterly Government Properties, Inc.",Nulla suscipit ligula in lacus. Curabitur at ipsum ac tellus semper interdum. Mauris ullamcorper purus sit amet nulla.
1/16/2020,kjobeya5@yahoo.co.jp,366,"Veracyte, Inc.","Donec diam neque, vestibulum eget, vulputate ut, ultrices vel, augue. Vestibulum ante ipsum primis in faucibus orci luctus et ultrices posuere cubilia Curae; Donec pharetra, magna vestibulum aliquet ultrices, erat tortor sollicitudin mi, sit amet lobortis sapien sapien non mi. Integer ac neque. Duis bibendum."
7/7/2019,ckruscheva6@amazon.co.uk,367,"Safe Bulkers, Inc","Pellentesque eget nunc. Donec quis orci eget orci vehicula condimentum. Curabitur in libero ut massa volutpat convallis. Morbi odio odio, elementum eu, interdum eu, tincidunt in, leo."
4/25/2019,lsibbalda7@umn.edu,368,BlackRock Multi-Sector Income Trust,"In hac habitasse platea dictumst. Morbi vestibulum, velit id pretium iaculis, diam erat fermentum justo, nec condimentum neque sapien placerat ante."
10/20/2019,gvalentinettia8@deliciousdays.com,369,China Southern Airlines Company Limited,Phasellus sit amet erat. Nulla tempus.
10/31/2019,cpalphreymana9@cafepress.com,370,"Aviragen Therapeutics, Inc.",Sed vel enim sit amet nunc viverra dapibus. Nulla suscipit ligula in lacus. Curabitur at ipsum ac tellus semper interdum.
4/20/2019,wklaessenaa@ameblo.jp,371,"Liquidity Services, Inc.",Donec posuere metus vitae ipsum. Aliquam non mauris. Morbi non lectus.
8/19/2019,spaylorab@google.nl,372,iShares S&P/Citigroup International Treasury Bond Fund,"In hac habitasse platea dictumst. Morbi vestibulum, velit id pretium iaculis, diam erat fermentum justo, nec condimentum neque sapien placerat ante. Nulla justo. Aliquam quis turpis eget elit sodales scelerisque."
6/17/2019,ccossorac@globo.com,373,PACCAR Inc.,"Donec diam neque, vestibulum eget, vulputate ut, ultrices vel, augue. Vestibulum ante ipsum primis in faucibus orci luctus et ultrices posuere cubilia Curae; Donec pharetra, magna vestibulum aliquet ultrices, erat tortor sollicitudin mi, sit amet lobortis sapien sapien non mi. Integer ac neque. Duis bibendum."
3/31/2019,ebrosiniad@mashable.com,374,ClearBridge Energy MLP Total Return Fund Inc.,"Duis mattis egestas metus. Aenean fermentum. Donec ut mauris eget massa tempor convallis. Nulla neque libero, convallis eget, eleifend luctus, ultricies eu, nibh."
6/18/2019,cmastrantoneae@cyberchimps.com,375,Avadel Pharmaceuticals plc,Aenean lectus. Pellentesque eget nunc. Donec quis orci eget orci vehicula condimentum.
12/9/2019,lmcgillegholeaf@seesaa.net,376,"Portola Pharmaceuticals, Inc.","In tempor, turpis nec euismod scelerisque, quam turpis adipiscing lorem, vitae mattis nibh ligula nec sem. Duis aliquam convallis nunc. Proin at turpis a pede posuere nonummy. Integer non velit."
8/18/2019,espurretag@cdbaby.com,377,Gabelli Utility Trust (The),"Morbi sem mauris, laoreet ut, rhoncus aliquet, pulvinar sed, nisl. Nunc rhoncus dui vel sem. Sed sagittis. Nam congue, risus semper porta volutpat, quam pede lobortis ligula, sit amet eleifend pede libero quis orci."
9/19/2019,alundbechah@discuz.net,378,"THL Credit, Inc.",Integer tincidunt ante vel ipsum. Praesent blandit lacinia erat.
5/25/2019,ksparkesai@purevolume.com,379,Navios Maritime Partners LP,Quisque id justo sit amet sapien dignissim vestibulum. Vestibulum ante ipsum primis in faucibus orci luctus et ultrices posuere cubilia Curae; Nulla dapibus dolor vel est.
11/20/2019,eminersaj@google.com.au,380,"Shutterstock, Inc.","Nullam orci pede, venenatis non, sodales sed, tincidunt eu, felis. Fusce posuere felis sed lacus. Morbi sem mauris, laoreet ut, rhoncus aliquet, pulvinar sed, nisl. Nunc rhoncus dui vel sem."
5/7/2019,colssonak@irs.gov,381,"Level 3 Communications, Inc.",Sed vel enim sit amet nunc viverra dapibus. Nulla suscipit ligula in lacus.
6/23/2019,cpedronial@altervista.org,382,"Gyrodyne , LLC","Morbi ut odio. Cras mi pede, malesuada in, imperdiet et, commodo vulputate, justo. In blandit ultrices enim. Lorem ipsum dolor sit amet, consectetuer adipiscing elit."
11/8/2019,ccristobalam@wp.com,383,Puma Biotechnology Inc,"Vivamus metus arcu, adipiscing molestie, hendrerit at, vulputate vitae, nisl. Aenean lectus."
10/9/2019,sbolducan@huffingtonpost.com,384,Sina Corporation,Morbi non quam nec dui luctus rutrum. Nulla tellus. In sagittis dui vel nisl. Duis ac nibh.
11/14/2019,abasindaleao@nature.com,385,"Columbia Banking System, Inc.",Aliquam erat volutpat. In congue. Etiam justo. Etiam pretium iaculis justo.
2/23/2020,mrodgeap@omniture.com,386,Greif Bros. Corporation,"Nam ultrices, libero non mattis pulvinar, nulla pede ullamcorper augue, a suscipit nulla elit ac nulla."
6/23/2019,cborelaq@mozilla.com,387,"WCF Bancorp, Inc.","Cras mi pede, malesuada in, imperdiet et, commodo vulputate, justo. In blandit ultrices enim."
8/16/2019,jlippar@un.org,388,ABB Ltd,Mauris lacinia sapien quis libero. Nullam sit amet turpis elementum ligula vehicula consequat.
3/4/2020,rgummeas@xing.com,389,Welltower Inc.,"Donec quis orci eget orci vehicula condimentum. Curabitur in libero ut massa volutpat convallis. Morbi odio odio, elementum eu, interdum eu, tincidunt in, leo."
8/21/2019,vsharrockat@psu.edu,390,"MFA Financial, Inc.",Vivamus tortor. Duis mattis egestas metus. Aenean fermentum.
7/2/2019,kdorringtonau@ow.ly,391,Select Comfort Corporation,Nullam porttitor lacus at turpis. Donec posuere metus vitae ipsum.
5/16/2019,ssplevinav@hubpages.com,392,Data I/O Corporation,"Aliquam sit amet diam in magna bibendum imperdiet. Nullam orci pede, venenatis non, sodales sed, tincidunt eu, felis. Fusce posuere felis sed lacus."
8/27/2019,guphillaw@mac.com,393,"MEI Pharma, Inc.",Integer a nibh. In quis justo. Maecenas rhoncus aliquam lacus.
3/14/2020,telsmoreax@google.com.au,394,"Maxwell Technologies, Inc.","In est risus, auctor sed, tristique in, tempus sit amet, sem. Fusce consequat. Nulla nisl."
8/8/2019,oclowneyay@amazon.com,395,Enterprise Financial Services Corporation,"Donec diam neque, vestibulum eget, vulputate ut, ultrices vel, augue. Vestibulum ante ipsum primis in faucibus orci luctus et ultrices posuere cubilia Curae; Donec pharetra, magna vestibulum aliquet ultrices, erat tortor sollicitudin mi, sit amet lobortis sapien sapien non mi. Integer ac neque. Duis bibendum."
4/5/2019,kstandidgeaz@cornell.edu,396,Repligen Corporation,"Fusce congue, diam id ornare imperdiet, sapien urna pretium nisl, ut volutpat sapien arcu sed augue. Aliquam erat volutpat."
4/22/2019,fmcgonagleb0@salon.com,397,"Dillard's, Inc.",In eleifend quam a odio. In hac habitasse platea dictumst. Maecenas ut massa quis augue luctus tincidunt.
4/25/2019,kocurneenb1@comsenz.com,398,Modern Media Acquisition Corp.,"Pellentesque viverra pede ac diam. Cras pellentesque volutpat dui. Maecenas tristique, est et tempus semper, est quam pharetra magna, ac consequat metus sapien ut nunc. Vestibulum ante ipsum primis in faucibus orci luctus et ultrices posuere cubilia Curae; Mauris viverra diam vitae quam."
7/4/2019,fbedwellb2@acquirethisname.com,399,Cincinnati Financial Corporation,Fusce consequat. Nulla nisl. Nunc nisl.
8/24/2019,aselewayb3@istockphoto.com,400,"Activision Blizzard, Inc",Integer a nibh. In quis justo. Maecenas rhoncus aliquam lacus.
8/22/2019,dmabbuttb4@com.com,401,Gabelli Global Small and Mid Cap Value Trust (The),"Proin eu mi. Nulla ac enim. In tempor, turpis nec euismod scelerisque, quam turpis adipiscing lorem, vitae mattis nibh ligula nec sem."
1/31/2020,lmouldsb5@webnode.com,402,"Terra Nitrogen Company, L.P.","In blandit ultrices enim. Lorem ipsum dolor sit amet, consectetuer adipiscing elit."
6/3/2019,craithbieb6@ustream.tv,403,Civeo Corporation,Cras non velit nec nisi vulputate nonummy. Maecenas tincidunt lacus at velit. Vivamus vel nulla eget eros elementum pellentesque.
12/1/2019,wlockhurstb7@shutterfly.com,404,Ligand Pharmaceuticals Incorporated,"Nam congue, risus semper porta volutpat, quam pede lobortis ligula, sit amet eleifend pede libero quis orci. Nullam molestie nibh in lectus. Pellentesque at nulla."
8/7/2019,ttathacottb8@e-recht24.de,405,"Regeneron Pharmaceuticals, Inc.",Morbi a ipsum. Integer a nibh. In quis justo. Maecenas rhoncus aliquam lacus.
5/23/2019,wmatzkaitisb9@photobucket.com,406,CONSOL Energy Inc.,Donec posuere metus vitae ipsum. Aliquam non mauris. Morbi non lectus.
2/5/2020,fterbeckba@odnoklassniki.ru,407,"Aqua America, Inc.",Donec posuere metus vitae ipsum. Aliquam non mauris. Morbi non lectus.
9/26/2019,nmcinultybb@cmu.edu,408,Luxfer Holdings PLC,Maecenas tincidunt lacus at velit. Vivamus vel nulla eget eros elementum pellentesque. Quisque porta volutpat erat.
7/15/2019,lbeaulieubc@businessinsider.com,409,Eagle Bulk Shipping Inc.,"Fusce lacus purus, aliquet at, feugiat non, pretium quis, lectus. Suspendisse potenti. In eleifend quam a odio. In hac habitasse platea dictumst."
1/2/2020,foswickbd@printfriendly.com,410,Mesoblast Limited,Duis mattis egestas metus. Aenean fermentum. Donec ut mauris eget massa tempor convallis.
10/13/2019,legellbe@virginia.edu,411,Atlantic Alliance Partnership Corp.,"Nulla ac enim. In tempor, turpis nec euismod scelerisque, quam turpis adipiscing lorem, vitae mattis nibh ligula nec sem. Duis aliquam convallis nunc. Proin at turpis a pede posuere nonummy."
9/26/2019,kelsburybf@mysql.com,412,Bridgford Foods Corporation,"Integer pede justo, lacinia eget, tincidunt eget, tempus vel, pede. Morbi porttitor lorem id ligula. Suspendisse ornare consequat lectus. In est risus, auctor sed, tristique in, tempus sit amet, sem."
6/22/2019,rbettleybg@mtv.com,413,Jabil Inc.,Fusce posuere felis sed lacus.
6/12/2019,laronsbh@mac.com,414,"America's Car-Mart, Inc.","In est risus, auctor sed, tristique in, tempus sit amet, sem. Fusce consequat. Nulla nisl."
3/30/2019,tlewsleybi@prlog.org,415,"Associated Capital Group, Inc.","Morbi sem mauris, laoreet ut, rhoncus aliquet, pulvinar sed, nisl. Nunc rhoncus dui vel sem. Sed sagittis. Nam congue, risus semper porta volutpat, quam pede lobortis ligula, sit amet eleifend pede libero quis orci."
8/24/2019,rstrafenbj@walmart.com,416,"Valhi, Inc.",Morbi porttitor lorem id ligula.
2/6/2020,agavaghanbk@usda.gov,417,"Oceaneering International, Inc.","Aliquam augue quam, sollicitudin vitae, consectetuer eget, rutrum at, lorem."
5/10/2019,fcolcombbl@t-online.de,418,The GDL Fund,"Morbi non lectus. Aliquam sit amet diam in magna bibendum imperdiet. Nullam orci pede, venenatis non, sodales sed, tincidunt eu, felis."
1/26/2020,mnewrickbm@chron.com,419,Texas Pacific Land Trust,"Fusce lacus purus, aliquet at, feugiat non, pretium quis, lectus. Suspendisse potenti. In eleifend quam a odio."
2/17/2020,fruminbn@nih.gov,420,Concord Medical Services Holdings Limited,"Integer ac leo. Pellentesque ultrices mattis odio. Donec vitae nisi. Nam ultrices, libero non mattis pulvinar, nulla pede ullamcorper augue, a suscipit nulla elit ac nulla."
2/2/2020,cskarrbo@illinois.edu,421,Jumei International Holding Limited,"Phasellus id sapien in sapien iaculis congue. Vivamus metus arcu, adipiscing molestie, hendrerit at, vulputate vitae, nisl. Aenean lectus."
2/8/2020,agrigollibp@fema.gov,422,Kansas City Southern,"Fusce congue, diam id ornare imperdiet, sapien urna pretium nisl, ut volutpat sapien arcu sed augue. Aliquam erat volutpat. In congue. Etiam justo."
1/29/2020,igreathambq@disqus.com,423,"EQT Midstream Partners, LP",Cras in purus eu magna vulputate luctus.
3/30/2019,egiorgiuttibr@boston.com,424,Cintas Corporation,Pellentesque at nulla.
9/17/2019,fovidbs@chronoengine.com,425,"Equinix, Inc.",Nunc purus.
11/5/2019,mmawbybt@reference.com,426,MSA Safety Incorporporated,Nullam porttitor lacus at turpis.
7/29/2019,bgartenfeldbu@xrea.com,427,CMS Energy Corporation,"Quisque porta volutpat erat. Quisque erat eros, viverra eget, congue eget, semper rutrum, nulla. Nunc purus. Phasellus in felis."
5/8/2019,eduncansonbv@trellian.com,428,Saratoga Investment Corp,"Duis ac nibh. Fusce lacus purus, aliquet at, feugiat non, pretium quis, lectus."
9/30/2019,apolibw@theglobeandmail.com,429,"Acorn International, Inc.",Ut at dolor quis odio consequat varius. Integer ac leo. Pellentesque ultrices mattis odio.
2/10/2020,despinobx@ask.com,430,Regions Financial Corporation,Quisque ut erat. Curabitur gravida nisi at nibh.
8/28/2019,bbromwichby@ucsd.edu,431,"Chuy's Holdings, Inc.",Nulla ac enim.
11/11/2019,mpraundlbz@engadget.com,432,Landmark Infrastructure Partners LP,"Donec odio justo, sollicitudin ut, suscipit a, feugiat et, eros."
9/17/2019,abrimilcombec0@mlb.com,433,Invesco High Income Trust II,"Quisque porta volutpat erat. Quisque erat eros, viverra eget, congue eget, semper rutrum, nulla."
12/11/2019,lhurworthc1@businesswire.com,434,"CoreLogic, Inc.",Duis ac nibh.
11/29/2019,rkleinbererc2@latimes.com,435,State Street Corporation,"Donec odio justo, sollicitudin ut, suscipit a, feugiat et, eros. Vestibulum ac est lacinia nisi venenatis tristique. Fusce congue, diam id ornare imperdiet, sapien urna pretium nisl, ut volutpat sapien arcu sed augue. Aliquam erat volutpat."
4/23/2019,hellereyc3@ucoz.com,436,"Colony NorthStar, Inc.",Fusce posuere felis sed lacus.
5/30/2019,ljeensc4@shareasale.com,437,"Maiden Holdings, Ltd.","Quisque porta volutpat erat. Quisque erat eros, viverra eget, congue eget, semper rutrum, nulla. Nunc purus. Phasellus in felis."
1/2/2020,rgrangerc5@ifeng.com,438,"Second Sight Medical Products, Inc.","In tempor, turpis nec euismod scelerisque, quam turpis adipiscing lorem, vitae mattis nibh ligula nec sem. Duis aliquam convallis nunc."
8/8/2019,ctunmorec6@arstechnica.com,439,"TIER REIT, Inc.","Mauris enim leo, rhoncus sed, vestibulum sit amet, cursus id, turpis. Integer aliquet, massa id lobortis convallis, tortor risus dapibus augue, vel accumsan tellus nisi eu orci. Mauris lacinia sapien quis libero."
12/1/2019,tvalentic7@ebay.com,440,Marcus Corporation (The),Etiam vel augue. Vestibulum rutrum rutrum neque. Aenean auctor gravida sem. Praesent id massa id nisl venenatis lacinia.
2/5/2020,lasaafc8@dailymotion.com,441,Foresight Autonomous Holdings Ltd.,Vestibulum ante ipsum primis in faucibus orci luctus et ultrices posuere cubilia Curae; Mauris viverra diam vitae quam. Suspendisse potenti. Nullam porttitor lacus at turpis.
4/9/2019,hcliburnc9@abc.net.au,442,"Autoliv, Inc.","Duis bibendum, felis sed interdum venenatis, turpis enim blandit mi, in porttitor pede justo eu massa. Donec dapibus. Duis at velit eu est congue elementum."
9/9/2019,lqueyosca@cdbaby.com,443,Old Point Financial Corporation,Vivamus tortor.
1/20/2020,ktyndallcb@netlog.com,444,Middlesex Water Company,Cras in purus eu magna vulputate luctus.
7/27/2019,cclaringboldcc@yale.edu,445,First Trust Large Cap Core AlphaDEX Fund,"Phasellus id sapien in sapien iaculis congue. Vivamus metus arcu, adipiscing molestie, hendrerit at, vulputate vitae, nisl. Aenean lectus. Pellentesque eget nunc."
7/16/2019,nearlandcd@nsw.gov.au,446,Royal Bank Scotland plc (The),Vestibulum ante ipsum primis in faucibus orci luctus et ultrices posuere cubilia Curae; Duis faucibus accumsan odio. Curabitur convallis. Duis consequat dui nec nisi volutpat eleifend. Donec ut dolor.
2/22/2020,ogeraldice@goodreads.com,447,Oasmia Pharmaceutical AB,"In hac habitasse platea dictumst. Morbi vestibulum, velit id pretium iaculis, diam erat fermentum justo, nec condimentum neque sapien placerat ante."
11/10/2019,ppurveyscf@odnoklassniki.ru,448,FORM Holdings Corp.,Maecenas ut massa quis augue luctus tincidunt. Nulla mollis molestie lorem. Quisque ut erat.
12/16/2019,gbrockingcg@cornell.edu,449,First Trust MLP and Energy Income Fund,"Cras mi pede, malesuada in, imperdiet et, commodo vulputate, justo. In blandit ultrices enim. Lorem ipsum dolor sit amet, consectetuer adipiscing elit. Proin interdum mauris non ligula pellentesque ultrices."
11/6/2019,hcrowthch@github.io,450,"TCW Strategic Income Fund, Inc.",Duis bibendum. Morbi non quam nec dui luctus rutrum.
10/31/2019,dhessingci@eventbrite.com,451,Discover Financial Services,Etiam pretium iaculis justo.
3/21/2020,eferrellicj@usnews.com,452,Voya Prime Rate Trust,Suspendisse accumsan tortor quis turpis. Sed ante. Vivamus tortor.
2/23/2020,jyegorovck@squarespace.com,453,iStar Financial Inc.,Cras non velit nec nisi vulputate nonummy. Maecenas tincidunt lacus at velit.
4/21/2019,ngrayshancl@delicious.com,454,Korn/Ferry International,Donec dapibus. Duis at velit eu est congue elementum. In hac habitasse platea dictumst.
12/18/2019,ddownscm@usatoday.com,455,Liberty Media Corporation,"In est risus, auctor sed, tristique in, tempus sit amet, sem. Fusce consequat."
12/12/2019,tmcnultycn@bbc.co.uk,456,Medigus Ltd.,Nulla tempus.
7/3/2019,civimeyco@who.int,457,"Builders FirstSource, Inc.",Praesent blandit. Nam nulla.
3/28/2019,mroddellcp@flickr.com,458,"CACI International, Inc.","Duis at velit eu est congue elementum. In hac habitasse platea dictumst. Morbi vestibulum, velit id pretium iaculis, diam erat fermentum justo, nec condimentum neque sapien placerat ante."
7/3/2019,dstoppcq@dmoz.org,459,UnitedHealth Group Incorporated,Phasellus sit amet erat. Nulla tempus.
4/24/2019,rtimothycr@theguardian.com,460,"Western Gas Partners, LP",Suspendisse potenti. Nullam porttitor lacus at turpis. Donec posuere metus vitae ipsum. Aliquam non mauris.
12/15/2019,gtrippittcs@google.co.jp,461,PennantPark Investment Corporation,Nulla facilisi. Cras non velit nec nisi vulputate nonummy.
11/17/2019,massonct@moonfruit.com,462,Nuveen Municipal 2021 Target Term Fund,"Vestibulum ac est lacinia nisi venenatis tristique. Fusce congue, diam id ornare imperdiet, sapien urna pretium nisl, ut volutpat sapien arcu sed augue."
5/30/2019,sbenedidickcu@cargocollective.com,463,Numerex Corp.,"Fusce posuere felis sed lacus. Morbi sem mauris, laoreet ut, rhoncus aliquet, pulvinar sed, nisl. Nunc rhoncus dui vel sem. Sed sagittis."
9/17/2019,sangercv@mlb.com,464,State Street Corporation,Integer ac leo. Pellentesque ultrices mattis odio.
12/22/2019,dsalkildcw@hostgator.com,465,Ship Finance International Limited,Nullam porttitor lacus at turpis. Donec posuere metus vitae ipsum. Aliquam non mauris. Morbi non lectus.
